title,href,tag,summary
US condemns 'brutal' Russian strikes on Ukraine,/news/world-europe-63208897,Europe,"Joe Biden says attacks on cities including central Kyiv show the ""brutality"" of Putin's ""illegal war""."
Videos show Iran teenager protesting before death,https://www.bbc.com/news/world-middle-east-63200652,Middle East,
Australians arrested over alleged Sri Lanka bribes,https://www.bbc.com/news/world-australia-63210319,Australia,
Harvey Weinstein trial begins in Los Angeles,https://www.bbc.com/news/entertainment-arts-63197830,Entertainment & Arts,
The essential skill not on your CV,https://www.bbc.com/worklife/article/20221005-eq-why-leaders-are-looking-for-emotional-intelligence,Worklife,
Russian hawks celebrate deadly response to setbacks,/news/world-europe-63205446,Europe,"Missiles launched at Ukraine were the first day at work for a newly appointed, hard-line Russian general."
Officer fired after shooting teen in McDonald's car park,/news/world-us-canada-63209829,US & Canada,"The teenaged boy was shot multiple times while eating a burger with a friend in San Antonio, Texas."
Death toll rises after landslides in Venezuela,/news/world-latin-america-63200569,Latin America & Caribbean,At least 36 people have died and 56 are missing as torrential rain hits the Latin American country.
Under-pressure Gerrard needs 'headline writers’,/sport/football/63209487,Football,"Steven Gerrard says he needs his Aston Villa players to become ""headline writers"" to improve their form after drawing at Nottingham Forest."
Red Bull found guilty of breaking F1's budget cap,/sport/formula1/63204082,Formula 1,"Red Bull are found guilty of breaking Formula 1's budget cap by the sport's governing body, the FIA."
Atletico re-sign Griezmann on permanent deal,/sport/football/63200405,European Football,Atletico Madrid re-sign France forward Antoine Griezmann from Barcelona on a deal that runs until 2026.
When and why did consciousness evolve on Earth?,/reel/video/p0d5zwbb/when-and-why-did-consciousness-evolve-on-earth-,,
Why the way you see the world may be a hallucination,/reel/video/p0cjqx25/are-we-all-living-in-a-hallucination-,,
How the Swedes survive without small talk,/reel/video/p08v2cjz/how-the-swedes-survive-without-small-talk,,
The health benefits of muddy puddles,https://www.bbc.com/future/article/20220929-how-outdoor-play-boosts-kids-immune-systems,Future,The right kind of dirt can nourish the body and mind
The one-company workers who never leave,https://www.bbc.com/worklife/article/20221005-the-one-company-workers-who-never-leave,Worklife,"Even as more of us job-hop, some workers have stayed put for years. Why?"
A sacred peak off-limits for decades,https://www.bbc.com/travel/article/20221010-pico-da-neblina-a-sacred-peak-off-limits-for-decades,Travel,Its opening marks the end of a nearly 20-year wait for some hikers
The 39 best books of the year so far,https://www.bbc.com/culture/article/20220407-the-best-books-of-the-year-2022,Culture,From the new Stephen King horror to a millennial anti-romcom set in New York
Explosion in frog numbers after mass pond digging,https://www.bbc.com/news/science-environment-63206140,Science & Environment,Scientists brought endangered species back from the brink by simply building more ponds
Kanye West's social media accounts locked,https://www.bbc.com/news/entertainment-arts-63198991,Entertainment & Arts,The rapper posted anti-Semitic messages leading to his accounts being suspended
Rollercoasters trigger new iPhone emergency calls,https://www.bbc.com/news/technology-63157888,Technology,"Users say the rides triggered the phones' crash detection system, US media reports"
What if we had limitless clean energy?,/future/article/20221006-what-would-happen-if-we-had-limitless-green-energy,,
Will Venice succumb to the sea?,/future/article/20220927-italys-plan-to-save-venice-from-sinking,,
India's sustainable cooling solution,/future/article/20220920-how-indias-lattice-buildings-cool-without-air-con,,
Spending watchdog to investigate Unboxed Festival,/news/entertainment-arts-63203780,Entertainment & Arts,"The National Audit Office will assess costs and benefits after an MP called it ""a waste of money""."
Brazilian Butt Lift can be made safer say surgeons,/news/health-63199213,Health,
'Big and painful' cuts needed to fix budget - IFS,/news/business-63203095,Business,
Ticketmaster demand-based price system criticised,/news/entertainment-arts-62919634,Entertainment & Arts,
Community orchards saving Britain's 'lost' apples,/news/science-environment-63160292,Science & Environment,
Elon Musk wades into China and Taiwan tensions,/news/business-63196452,Business,
Gambia police probe deaths linked to Indian syrup,/news/world-africa-63191406,Africa,
Chris Killip: Retrospective for UK photographer,/news/in-pictures-63163667,In Pictures,
"A human tower, a hug and a cocktail: Photos of the week",/news/in-pictures-63171345,In Pictures,
Your pictures on the theme of 'skylines',/news/in-pictures-63143453,In Pictures,
Africa's top shots: Patriotic portraits and red afros,/news/world-africa-63155899,Africa,
India celebrates Dussehra festival with pomp,/news/world-asia-india-63113937,India,
