title,href,tag,summary
Four dead as Russia launches new attack on Ukraine,/news/world-europe-65036208,Europe,"Russian forces target several Ukrainian cities, while explosions are heard in Russian-occupied Crimea."
"If Trump is arrested, this is what happens next",https://www.bbc.com/news/world-us-canada-65012096,US,
Friend who inspired Begum mocks her as non-believer,https://www.bbc.com/news/uk-65031943,UK,
Europe's 'social security' for food,https://www.bbc.com/future/article/20230321-cost-of-living-europes-trials-in-social-security,Future,
Succession's 'jaw-dropping' finale ★★★★★,https://www.bbc.com/culture/article/20230321-succession-season-4-a-jaw-dropping-finale,Culture,
UN warns against 'vampiric' global water use,/news/world-65035041,World,"A new report warning of ""endemic"" water scarcity is released ahead of a three-day water summit."
"Boris Johnson could have shut down parties but didn't, No 10 official says in evidence",/news/live/uk-politics-65033262,UK Politics,"A panel investigating the former PM's statements has released a ""bundle"" of evidence this morning before questioning him later."
Trump says protest. His supporters say - stay home,/news/world-us-canada-65019136,US & Canada,"Donald Trump demanded protests over his possible arrest, but his supporters fear being set up."
"Ozil retires, build-up to Euro 2024 qualifiers & Conte latest",/sport/live/football/65030783,Football,"Spurs boss Antonio Conte's future remains in doubt, home nations prepare for Euro 2024 qualifiers, and former Arsenal and Germany midielder Mesut Ozil retires."
How a New York gang truce spawned an Olympic sport,/sport/olympics/64987866,Olympics,"When peace broke out among New York's gangs, breaking was born - but few foresaw it conquering the world and morphing into an Olympic sport."
Usyk walks away from Fury undisputed fight talks,/sport/boxing/65037833,Boxing,Talks for an undisputed heavyweight contest between Briton Tyson Fury and unified champion Oleksandr Usyk are on the verge of collapse.
"The art of taking the very, very long view of time",/reel/video/p0f7stl9/the-art-of-taking-the-very-very-long-view-of-time,,
What 'witches' reveal about our deepest fears,/reel/video/p0f9x668/what-horror-films-reveal-about-society-s-deepest-fears,,
The surprising truth about eating eggs,/reel/video/p08ngz2r/the-truth-about-eating-eggs,,
Why work drinking culture is fading,https://www.bbc.com/worklife/article/20230320-why-workplace-drinking-culture-is-fading-fast,Worklife,Alcohol is embedded in work culture. But it might not stay that way
Have we got Egyptian mummies all wrong?,https://www.bbc.com/culture/article/20230320-the-great-debate-about-mummies-should-we-unwrap-them,Culture,How a major new show is refusing to look at what's inside the Egyptian artefacts
Can we 'undo' climate change?,https://www.bbc.com/future/article/20230321-ipcc-the-rising-need-for-negative-emissions,Future,We may need to suck carbon back out of the atmosphere. Will it work?
The street that epitomises New York,https://www.bbc.com/travel/article/20230321-jackson-heights-the-neighbourhood-that-epitomises-new-york,Travel,It's one of the most diverse places on Earth
Johnson Partygate inquiry: The key clashes to expect,https://www.bbc.com/news/uk-politics-65032079,UK Politics,The former UK PM faces a several hour-long grilling by MPs
The struggle to find a home in a picture-postcard village,https://www.bbc.com/news/uk-scotland-highlands-islands-64785851,UK,Some people have spent years trying to find an affordable property
Marburg virus kills five people in Tanzania,https://www.bbc.com/news/world-africa-65037537,Africa,The health minister is confident the Ebola-like virus will not spread beyond the affected area
Shipping's wind power revolution,/future/article/20230310-will-shipping-return-to-its-ancient-roots,,
A better way to make concrete,/future/article/20230309-how-carbon-negative-concrete-can-help-the-climate,,
The clothes you can't recycle,/future/article/20230227-how-to-recycle-your-clothes,,
Whishaw and Freeman dramas lead Bafta nominations,/news/entertainment-arts-65026718,Entertainment & Arts,Ben Whishaw's This Is Going To Hurt and Martin Freeman's The Responder have six TV nominations each.
'My generation has a different view of alcohol',https://www.bbc.co.uk/news/av/business-65029392,Business,
Five things we've learned from UN climate report,/news/science-environment-65013560,Science & Environment,
California battles floods with more rain to come,/news/world-us-canada-64959807,US & Canada,
Teenager deaths hospital's care 'chaotic and unsafe',/news/uk-england-tees-65013550,Tees,
UN releases 'survival guide' to avert climate disaster,/news/science-environment-65000182,Science & Environment,
Google's rival to ChatGPT launches for over-18s,/news/technology-65018107,Technology,
England's high streets championed in photographs,/news/uk-england-65029453,England,
Recording a city's ghost signs before they vanish,/news/uk-england-leeds-64798380,Leeds & West Yorkshire,
Appeal made for photos for night out exhibition,/news/uk-england-derbyshire-64989782,Derby,
"Puppeteers, superstars and dinosaurs: Africa's top shots",/news/world-africa-64976952,Africa,
The 50 Paddy Irishmen banishing the stereotypes,/news/uk-northern-ireland-64913882,Northern Ireland,
