title,href,tag,summary
'I blame system that enabled abuse' - Simone Biles,/news/world-us-canada-58573887,US & Canada,Simone Biles and other gymnasts give powerful testimony at a Senate inquiry into how sexual abuse was handled.
California governor beats bid to oust him,/news/world-us-canada-58565271,US & Canada,
"In Trump country, Afghan chaos 'another betrayal'",https://www.bbc.com/news/world-us-canada-58441173,US,
The surprising power of daily rituals,https://www.bbc.com/future/article/20210914-how-rituals-help-us-to-deal-with-uncertainty-and-stress,Future,
Four companies doing remote work differently,https://www.bbc.com/worklife/article/20210915-how-companies-around-the-world-are-shifting-the-way-they-work,Worklife,
Truss replaces Raab in reshuffle as Williamson goes,/news/live/uk-politics-58564999,UK Politics,Liz Truss is the new foreign secretary as Dominic Raab moves to three new roles; Education Secretary Gavin Williamson is among those sacked.
North and South Korea test missiles hours apart,/news/world-asia-58554326,Asia,"The tests highlight an arms race on the peninsula, as nuclear talks with North Korea remain stalled."
Camel reliefs found to be oldest in the world,/news/world-middle-east-58570259,Middle East,A new study suggests the sculptures in Saudi Arabia are far older than previously thought.
PSG expect Mbappe to stay - Leonardo,/sport/football/58570048,European Football,Paris St-Germain are confident Kylian Mbappe will extend his contract with the club at the end of the season.
Raducanu 'hungry to improve' after rest,/sport/tennis/58570037,Tennis,"Britain's Emma Raducanu says she is ""hungry"" to improve after her US Open win but wants a few days' rest first."
Stenson named as Ryder Cup vice-captain,/sport/golf/58570029,Golf,Henrik Stenson is named Europe's fifth and final vice-captain for the Ryder Cup against the United States at Whistling Straits.
The 'eighth wonder of the world' that vanished in WW2,/reel/video/p09502wd/what-happened-to-russia-s-eighth-wonder-of-the-world-,,
The Caribbean island that embraces a deadly sin,/reel/video/p09ftqzh/the-paradise-island-with-a-lesson-about-pride,,
The cupboard-sized flats of Tokyo,/reel/video/p07hvm9d/the-cupboard-sized-flats-of-tokyo,,
A remote world of 23 deserts,https://www.bbc.com/travel/article/20210914-the-indigenous-keeper-of-the-outbacks-secrets,Travel,This is what all of inland Australia once looked like
TV's most bizarre new shows,https://www.bbc.com/culture/article/20210914-how-talent-shows-became-tvs-most-bizarre-programmes,Culture,How TV talent contests are getting an injection of weirdness
Has the office changed for the worse?,https://www.bbc.com/worklife/article/20210913-what-happens-when-your-office-has-changed-for-the-worse,Worklife,"""It's the same old office, but it's not the same at all"""
The far-reaching power of sea otters,https://www.bbc.com/future/article/20210914-how-sea-otters-help-fight-climate-change,Future Planet,These playful creatures manipulate their ecosystems to draw down carbon
How Covid-19 boosted a children's virus,https://www.bbc.com/future/article/20210913-the-little-known-virus-that-surged-in-children-this-summer,Future,"Before the coronavirus pandemic, RSV was mostly a winter problem"
'You can run a business and have a baby',https://www.bbc.com/news/business-58548789,Business,Planning for a maternity leave when you're the boss of a fast-growing company
The Champions League team from a disputed 'smugglers' haven',https://www.bbc.com/sport/football/58546814,European Football,Sheriff Tiraspol are the 'kings' of Moldovan football
The missing generation of ancient trees,/future/article/20210908-the-lost-generation-of-ancient-trees,,
Bangladesh's unusual use for oysters,/future/article/20210827-the-unlikely-protector-against-rising-seas-in-bangladesh,,
Can investors save the Amazon?,/future/article/20210825-can-investors-save-the-amazon,,
John Lewis to create thousands of Christmas jobs,/news/business-58570239,Business,"The partnership is looking to fill 7,000 temporary roles in shops, department stores and warehouses."
Alanis Morissette distances herself from new film,/news/entertainment-arts-58571545,Entertainment & Arts,
Covid booster jab rollout to begin in UK next week,/news/health-58550833,Health,
Amateur astronauts set for orbital spaceflight,/news/science-environment-58561621,Science & Environment,
Facebook under fire over secret teen research,/news/technology-58570353,Technology,
Unmanned submarine earmarked for Irish Sea freight,/news/uk-northern-ireland-58571143,Northern Ireland,
Sheeran: Awards shows are filled with resentment,/news/entertainment-arts-58569700,Entertainment & Arts,
Star-spangled celebrities welcome back Met Gala,/news/world-us-canada-58553594,US & Canada,
The nocturnal world of hedgehogs and foxes,/news/in-pictures-58327374,In Pictures,
Weather Watchers Pic of the Season summer vote,https://www.bbc.co.uk/programmes/articles/3ec395c0-0585-45e7-8d43-079a97f2548e,News,
Searching for the perfect shot of the NI landscape,/news/uk-northern-ireland-58447962,Northern Ireland,
The summer after September 2001,/news/in-pictures-58463538,In Pictures,
