title,href,tag,summary
Ukraine ready to discuss neutral status - Zelensky,/news/live/world-europe-60890199,Europe,The president says any such move would have to be guaranteed by third parties and put to a referendum.
Oscar winner Will Smith hits Chris Rock on stage,/news/entertainment-arts-60897004,Entertainment & Arts,
The moment Will Smith hit Chris Rock,/news/entertainment-arts-60896964,Entertainment & Arts,
Coda’s best picture win overshadowed by Smith slap,/news/live/entertainment-arts-60838175,Entertainment & Arts,
England slump to Test and series defeat,/sport/cricket/60893972,Cricket,
Oil prices fall after Shanghai starts lockdown,/news/business-60896794,Business,The nine-day lockdown of Shanghai is China's largest since the coronavirus outbreak began.
"Beatings, forced abortions: Life in a N Korea prison",/news/world-asia-60870739,Asia,A new investigation sheds more light on human rights violations in North Korean prisons.
Two police officers shot dead in Israel gun attack,/news/world-middle-east-60895393,Middle East,"The Islamic State group said it was behind the attack, in which six other people were injured."
Verstappen wins after late overtake,/sport/formula1/60895402,Formula 1,Max Verstappen wins an intense race-long battle with Charles Leclerc to take his first victory of the season in the Saudi Arabian Grand Prix.
Canada reach first World Cup since 1986,/sport/football/60896263,Football,Canada beat Jamaica 4-0 to qualify for their first men's World Cup in 36 years.
France earn bonus-point win against Italy,/sport/rugby-union/60894162,Rugby Union,France stifle a determined Italy to open their Women's Six Nations with a gritty bonus-point win in Grenoble.
How one of the world's most expensive spices is harvested,/reel/video/p0bpz9c7/how-one-of-the-world-s-most-expensive-foods-is-harvested,,
"A Nordic tale of 'sex, death, revenge and power'",/reel/video/p0bx78hx/why-we-are-still-living-in-an-old-norse-saga,,
The deadly toxin found in the world's oldest mummies,/reel/video/p0br366s/life-beyond-death-in-the-driest-place-on-earth,,
A secret return-to-work struggle,https://www.bbc.com/worklife/article/20220324-the-workers-with-social-anxiety-fearing-the-return-to-office,Worklife,"With social anxiety spiking, getting back to the office isn't always simple"
Oscars 2022: Who will win?,https://www.bbc.com/culture/article/20220324-oscars-2022-who-will-win-and-who-should,Culture,Our critics give their Academy Award predictions – and pick their favourites
How to fossilise yourself,https://www.bbc.com/future/article/20220324-how-to-maximise-your-chances-of-being-fossilised,Future,Here's how to maximise your chances of becoming a fossil.
Sri Lanka's last indigenous people,https://www.bbc.com/travel/article/20220327-sri-lankas-last-indigenous-people,Travel,They're Sri Lanka's earliest inhabitants – but most people haven't heard of them
The Meal Prep King’s guide to batch cooking,https://www.bbc.co.uk/food/articles/meal_prep_king,Food,How meal prep helped the cooking star improve his health and save money
Tracing my family's stolen ancestors,https://www.bbc.co.uk/ideas/videos/tracing-my-familys-stolen-ancestors/p09nyk44,Ideas,The legacies of slavery continue to connect people and places around the world
How do you get over dating app fatigue?,https://www.bbc.co.uk/bbcthree/article/eb9a8eff-9cab-4294-8a05-a2631eb7a07e,BBC Three,"""I tell my clients you need to be meeting within five messages"""
The alternatives to Russia's gas,/future/article/20220324-how-biogas-can-help-europe-cut-russian-gas,,
The town that got up and left,/future/article/20220310-the-illinois-town-valmeyer-could-be-a-model-for-relocation,,
The homes powered by a kite,/future/article/20220309-the-kites-flying-to-harness-the-worlds-strongest-winds,,
Deaf family drama Coda wins best film Oscar,/news/entertainment-arts-60896365,Entertainment & Arts,Apple TV's Coda makes history as the first streaming film to win best picture at the Hollywood...
Russia 'hacked Ukrainian satellite communications',/news/technology-60796079,Technology,
Wartime defiance from Chernobyl’s vodka producer,/news/science-environment-60879025,Science & Environment,
How is China's zero-Covid strategy changing?,/news/59882774,Reality Check,
Sound ideas - the tech battling noise pollution,https://www.bbc.co.uk/news/business-60858571,Business,
"1,000-year-old oaks used to create 'super forest'",/news/science-environment-60617810,Science & Environment,
Oscars red carpet fashion in pictures,/news/entertainment-arts-60896370,Entertainment & Arts,
'Ship of gold' photos recovered from ocean floor,/news/world-us-canada-60866212,US & Canada,
'Photography completely turned my life around',/news/uk-england-hampshire-60859905,Hampshire & Isle of Wight,
"Taylor Hawkins, a drummer who 'served the song'",/news/in-pictures-60885675,In Pictures,
Aerial photographs show city's past and present,/news/uk-england-derbyshire-60861843,Derby,
US photographer Dirck Halstead dies at 85,/news/in-pictures-60878983,In Pictures,
