title,href,tag,summary
"Gaza situation dire, UN says, as Israeli military admits security failures",/news/live/world-middle-east-67073970,Middle East,"Food and water are running out in the enclave, while the Israeli defence chief says the military fell short on Saturday."
France bans all pro-Palestinian demonstrations,https://www.bbc.com/news/world-europe-67088547,Europe,
'My ancestors were invisible. I want to be visible',https://www.bbc.com/news/world-australia-67086154,Australia,
New York Comic Con: The cost to attend,https://www.bbc.com/worklife/article/20231010-how-much-it-costs-to-attend-new-york-comic-con,Worklife,
The most influential hip-hop tracks,https://www.bbc.com/culture/article/20231012-hip-hop-tracks-that-changed-the-world,Culture,
Colorado officer found guilty in Elijah McClain death,/news/uk-67097118,US & Canada,The unarmed black man died after he was pinned down before a medic injected him with ketamine.
Steve Scalise drops out of US Speaker race,/news/world-us-canada-67097299,US & Canada,The Republican lawmaker failed to gain enough votes to secure an overall majority in the chamber.
US-Iran $6bn deal under scrutiny after Hamas attack,/news/world-us-canada-67084515,US & Canada,President Biden has faced pressure to hold the funds amid claims Tehran instigated the Hamas attack.
Agony for Scotland as Spain defeat delays Euro spot,/sport/football/67014324,Football,Scotland's bid to reach Euro 2024 is agonisingly prolonged as a frustrating defeat in Spain sends them to a first defeat of the campaign.
FA 'tried to make best decision' on Israel & Gaza - Southgate,/sport/football/67085498,Football,"The FA has ""tried to make the best decision with good intentions"" over tributes to those who have died in Israel and Gaza, according to Gareth Southgate."
All Blacks drop winger Telea over protocol breach,/sport/rugby-union/67096110,Rugby Union,Mark Telea is dropped by New Zealand for Saturday's Rugby World Cup quarter-final with Ireland after breaking team protocol.
The Israel-Palestinian conflict explained,https://www.bbc.com/news/newsbeat-44124396,Middle East,"Tensions between Israel and the Palestinians date back decades, but what are the key issues?"
Gaza hospitals risk turning into morgues - Red Cross,https://www.bbc.com/news/world-middle-east-67087035,Middle East,"There is no mains power and fuel for generators could run out in hours, the aid group says"
Hostage crisis is toughest Israel has ever faced,https://www.bbc.com/news/world-middle-east-67084408,Middle East,Israel has to decide whether to attempt a rescue of those in Gaza - or wait to strike a deal
The 1919 eclipse that changed the world,/reel/video/p0gkw3wb/the-eclipse-that-proved-einstein-right,,
The Latino doulas reshaping childbirth in the US,/reel/video/p0gjfgrs/the-latino-doulas-reshaping-childbirth-in-the-us,,
How the oldest sport in the world still flourishes in India,/reel/video/p0gjck4l/the-2-500-year-old-sport-that-still-flourishes-in-india,,
America's ancient sky watchers,https://www.bbc.com/travel/article/20231012-americas-ancient-sky-watchers,Travel,"On 14 October, a solar eclipse will sweep over North, Central and South America"
Veterinarians are not OK,https://www.bbc.com/worklife/article/20231010-the-acute-suicide-crisis-among-veterinarians-youre-always-going-to-be-failing-somebody,Worklife,"The suicide crisis among vets: ""You're always going to be failing somebody"""
Twenty of the best films of 2023,https://www.bbc.com/culture/article/20230402-8-of-the-best-films-of-2023-so-far,Culture,From Barbie and Oppenheimer to The Creator and Suzume
How eclipses have shaped history,https://www.bbc.com/future/article/20231012-how-solar-eclipses-have-shaped-history,Future,'Day turned into night and the fighting stopped'
TikTok latest firm warned by EU over Hamas videos,https://www.bbc.com/news/technology-67066871,Technology,The platform has been urged to step up efforts to stop the spread of disinformation
Cutting up Sycamore Gap tree 'like a funeral',https://www.bbc.com/news/uk-england-tyne-67087497,UK,"A crane has been brought in to take the trunk away, which has been cut into pieces"
Will and Jada Pinkett Smith separated in 2016,https://www.bbc.com/news/world-us-canada-67084335,US,"By the time they separated Pinkett Smith said that they were ""exhausted with trying"""
Cleaning Spain's 'green soup',/future/article/20231010-mar-menor-saving-europes-largest-saltwater-lagoon,,
The bird that sparked a mass clean-up,/future/article/20231002-the-photo-of-the-deepwater-horizon-bird-that-shocked-the-world,,
"A 2,000-year-old method to water crops",/future/article/20230922-the-ancient-sri-lankan-tank-cascade-systems-tackling-drought,,
Stranded boats and dead fish: Amazon drought,/news/in-pictures-67087949,In Pictures,"A severe drought in the Brazilian Amazon is disrupting transport, isolating communities and killing..."
Yvette Fielding says she was bullied on Blue Peter,/news/entertainment-arts-67091646,Entertainment & Arts,
US car strike expanded to Ford's biggest plant,/news/business-67085700,Business,
School and NHS caterers criticised on antibiotics,/news/science-environment-67054663,Science & Environment,
Mystery FTX thief cashes out millions during trial,/news/technology-67090501,Technology,
Gene-edited chickens partially resist bird flu,/news/science-environment-67066892,Science & Environment,
Taylor Swift joined by Beyoncé for Eras premiere,/news/world-us-canada-67085113,US & Canada,
In pictures: Homes and lives destroyed in Afghan quakes,/news/world-asia-67088231,Asia,
A tussle between two Nubian ibexes among photo award winners,/news/science-environment-67063835,Science & Environment,
Thames photographs reimagine historical events,/news/uk-england-london-67016295,London,
NHS worker wins competition with pic of elusive boar,/news/uk-england-gloucestershire-67029398,Gloucestershire,
"Stars, bars and beans: Africa’s top shots",/news/world-africa-67017528,Africa,
