title,href,tag,summary
Stansted suspends all flights due to bad weather,/news/business-63938958,Business,Heathrow and Gatwick also cancel flights after fog and snow sweeps the country.
Ukraine hits 'Wagner HQ' in weekend of unrest,https://www.bbc.com/news/world-europe-63933132,Europe,
The secrets shared by Afghan women,https://www.bbc.com/news/world-63638876,World,
Ronaldo coy about Portugal future,https://www.bbc.com/sport/football/63937916,World Cup,
The century's 'most important painting',https://www.bbc.com/culture/article/20221209-the-most-important-painting-of-the-21st-century,Culture,
Shooting of three women at cafe shocks Italy,/news/world-europe-63939426,Europe,A friend of Italian Prime Minister Giorgia Meloni is among three women killed in Sunday's attack.
One of Central America's most active volcanoes erupts,/news/world-latin-america-63939229,Latin America & Caribbean,Guatemala's Fuego forces authorities to close the country's largest airport and a major highway.
Nasa's Orion capsule makes safe return to Earth,/news/science-environment-63937345,Science & Environment,"After a 26-day flight around the Moon, Nasa's future astronaut ship parachutes into the Pacific."
England-Pakistan Test is '50-50' - Trescothick,/sport/cricket/63936212,Cricket,"England's second Test against Pakistan is ""50-50"", according to assistant coach Marcus Trescothick."
Southgate has unfinished business - Shearer,/sport/football/63934847,Football,Former England captain Alan Shearer says Gareth Southgate has shown he is the right man to take this exciting young team to the 2024 European Championship.
Golden State beat Boston in NBA Finals rematch,/sport/basketball/63933734,Basketball,Defending champions the Golden State Warriors beat the in-form Boston Celtics in a repeat of last season's NBA Finals.
The truth behind da Vinci's most mysterious masterpiece,/reel/video/p0dm69tw/what-s-behind-mona-lisa-s-indescribable-smile-,,
Is this the ultimate feminist phrase?,/reel/video/p0dj87k0/naag-nool-the-women-embracing-an-iconic-somali-phrase,,
What was Genghis Khan's 'secret weapon' on the battlefield?,/reel/video/p0dm7mrn/why-maggots-are-a-medical-marvel,,
Why are some kids' illnesses spiking?,https://www.bbc.com/future/article/20221206-why-are-some-childhood-illnesses-spiking,Future,Some once-familiar illnesses are now puzzling doctors and parents
The 21 best TV shows of 2022,https://www.bbc.com/culture/article/20220606-the-10-best-tv-shows-of-2022-so-far,Culture,From Better Call Saul and Abbott Elementary to Andor and Top Boy
The US' forgotten civil rights hero,https://www.bbc.com/travel/article/20221211-barbara-johns-the-us-forgotten-civil-rights-hero,Travel,"At just 16 years old, she stirred the nation to end segregation"
The silent struggles of ADHD workers,https://www.bbc.com/worklife/article/20221209-the-silent-struggles-of-workers-with-adhd,Worklife,Neurodiverse workers can find themselves judged and often lack help they need
The themes of two unexpected World Cup semi-finals,https://www.bbc.com/sport/football/63933719,World Cup,BBC Sport looks at the subplots before the World Cup semi-finals no-one predicted
Five things about women and addiction,https://www.bbc.co.uk/ideas/videos/five-things-about-women-and-addiction/p0dm7nnq,Ideas,Two women who have recovered from addiction talk about some of the challenges they faced
The last of the 'sworn virgins',https://www.bbc.com/news/world-europe-63904744,Europe,An ancient tradition where women take a celibacy oath and live as men is on the decline
What would a green World Cup look like?,/future/article/20221206-what-would-a-green-world-cup-look-like,,
The Alpine villages powered by streams,/future/article/20221129-the-alpine-villages-producing-their-own-power,,
Should air miles schemes be scrapped?,/future/article/20221122-should-we-get-rid-of-air-miles-for-climate-change,,
Twitter's paid blue tick re-launches after pause,/news/technology-63938566,Technology,Twitter will once again offer a blue tick badge and additional features for a monthly fee.
Would you switch your dog to eating lab-grown meat?,https://www.bbc.co.uk/news/business-63565576,Business,
Revolutionary therapy clears girl's incurable cancer,/news/health-63859184,Health,
They are K-pop's next stars… and they’re entirely virtual,/news/world-asia-63827838,Asia,
Webb telescope 'fingerprints' earliest galaxies,/news/science-environment-63919257,Science & Environment,
'I want people to ask about my burns',/news/uk-england-derbyshire-63835231,Derby,
Alert issued after volcano erupts in Chile,/news/world-latin-america-63932228,Latin America & Caribbean,
In pictures: Hundreds gather for Maasai Olympics,/news/world-africa-63932225,Africa,
"Birds, berries, a fox and fury: Photos of the week",/news/in-pictures-63915602,In Pictures,
"Africa's top shots: Afro puffs, icons and ballerinas",/news/world-africa-63902414,Africa,
Cold Moon captured by photographers,https://www.bbc.co.uk/news/articles/cqv47313vjlo,News,
The Meghan and Harry selfies we've never seen before,/news/in-pictures-63902679,In Pictures,
