title,href,tag,summary
"I went through hell, says 85-year-old hostage released by Hamas",/news/live/world-middle-east-67201465,Middle East,"Yocheved Lifschitz - one of two hostages freed by Hamas on Monday - describes being taken into a ""spider's web"" of underground tunnels."
Freed hostage says she was held in 'spider's web' of Gaza tunnels,/news/world-middle-east-67204479,Middle East,
The laidback Australian city key to countering China,/news/world-australia-67166799,Australia,
The masterpiece that became a meme,https://www.bbc.com/culture/article/20231019-the-laughing-cavalier-the-masterpiece-that-became-a-meme,Culture,
The dark side of touch-screen tipping,https://www.bbc.com/worklife/article/20231016-the-dark-side-of-touch-screen-tipping,Worklife,
Museum to fix waxwork smacked down by The Rock,/news/newsbeat-67203892,Newsbeat,Paris's Grevin Museum promises to address concerns over the skin tone of its life-sized figure.
'Super fog' kills seven in 158-car US pile-up,/news/world-us-canada-67204993,US & Canada,"A dense fog caused a pile-up of more than 150 vehicles near New Orleans, killing seven and wounding 25."
"Britney Spears' memoir: An angry, cautionary tale",/news/entertainment-arts-67193983,Entertainment & Arts,"The Woman In Me, which is published on Tuesday, lifts the lid on her 13-year conservatorship."
World Cup: South Africa v Bangladesh,/sport/live/cricket/66858469,Cricket,Follow live text updates as South Africa play Bangladesh in the Men's Cricket World Cup 2023
Best goal celebrations as Spurs go top,/sport/live/football/67201200,Football,"Reaction after Tottenham's 2-0 win over Fulham, plus news before Tuesday's Champions League matches."
England confirm first multi-year central contracts,/sport/cricket/67196886,Cricket,"Joe Root, Harry Brook and Mark Wood sign three-year deals as part of England awarding multi-year central contracts for the first time."
Veterinarian suicide rates are very high. Why?,/reel/video/p0gkmzb8/veterinarian-suicide-rates-are-very-high-why-,,
The butterfly effect: What is chaos theory?,/reel/video/p0gn8kps/the-butterfly-effect-what-is-chaos-theory-,,
Behind the scenes with Scorsese and his most iconic actors,/reel/video/p0gml9jl/behind-the-scenes-with-scorsese-and-his-most-iconic-actors,,
Europe's magnificent €50 train,https://www.bbc.com/travel/article/20231023-corsicas-trinicellu-europes-magnificent-50-train,Travel,It's one of the continent's best – and most affordable – rail journeys
Could we detect alien pollution?,https://www.bbc.com/future/article/20231023-could-we-find-alien-life-via-their-pollution,Future,Tell-tale chemicals could signal extraterrestrial societies
The 1982 case that divided Australia,https://www.bbc.com/culture/article/20231019-the-mother-wrongly-convicted-of-murder-who-always-insisted-a-dingo-killed-her-baby,Culture,The true story of Lindy Chamberlain and one of Australia's biggest controversies
The 'climate quitters' ditching jobs,https://www.bbc.com/worklife/article/20231016-the-climate-quitters-ditching-corporate-roles,Worklife,"At odds over company values, some workers are ditching their corporate roles"
"Skeletons discovered in rare 5,000-year-old tomb",https://www.bbc.com/news/uk-scotland-north-east-orkney-shetland-67195563,UK,Archaeologists say pottery and stone tools have also been found at the site in Orkney
BBC Women's Footballer of the Year - the contenders,https://www.bbc.com/sport/football/67088398,Women's Football,"Vote now for the BBC Women's Footballer of the Year 2023, with the winner announced on 28 November"
World's shift to clean energy is 'unstoppable',https://www.bbc.com/news/science-environment-67198206,Science & Environment,The IEA predicted that renewables would provide half of the world's electricity by 2030
Can we clean up forever chemicals?,/future/article/20231016-cleaning-up-pfas-forever-chemicals,,
Cleaning Spain's 'green soup',/future/article/20231010-mar-menor-saving-europes-largest-saltwater-lagoon,,
The bird that sparked a mass clean-up,/future/article/20231002-the-photo-of-the-deepwater-horizon-bird-that-shocked-the-world,,
West Antarctic ice shelf melt 'unavoidable',/news/science-environment-67171231,Science & Environment,"Future sea-level rise may have been underestimated, a new study warns, with more melt ""locked in""."
Mental health of under-fives overlooked - report,/news/health-67173008,Health,
Manchester University claims huge drone record,/news/technology-67196131,Technology,
Skulls and flowers: Mexico's 'skeleton' parade,/news/in-pictures-67193453,In Pictures,
Taiwan-based iPhone-maker Foxconn probed by China,/news/business-67186745,Business,
Abbington left Strictly for 'personal reasons',/news/entertainment-arts-67203953,Entertainment & Arts,
Rescue mission for UK rainforests’ weird treasures,/news/science-environment-66989115,Science & Environment,
Steely gaze of endangered tigress tops mangrove photo awards,/news/in-pictures-67155632,In Pictures,
"Poses, pouts and poles: Africa's top shots",/news/world-africa-67155786,Africa,
Sydney Opera House: The story of an icon in photos,/news/world-australia-67153713,Australia,
Stranded boats and dead fish: Amazon drought,/news/in-pictures-67087949,In Pictures,
Camels and cauliflowers in focus: Africa's top shots,/news/world-africa-67087727,Africa,
