title,href,tag,summary
Biden says war at critical point as he sends more weapons,/news/live/world-europe-61157670,Europe,"The US president sets out another £800m package for Ukraine, a refugee scheme and a Russian ship ban."
'Blood and fear everywhere' after deadly IS blast,https://www.bbc.com/news/world-asia-61174991,Asia,
Florida poised to strip Disney of special status,https://www.bbc.com/news/world-us-canada-61179262,US,
The Victorian attitudes to sex that remain today,https://www.bbc.com/culture/article/20220420-a-very-british-scandal-the-women-judged-for-their-sex-lives,Culture,
When Covid-19 and HIV meet,https://www.bbc.com/future/article/20220419-how-effective-are-covid-19-vaccines-for-people-with-hiv,Future,
Putin orders troops to seal off Mariupol defenders,/news/world-europe-61175675,Europe,The Russian leader drops plans to storm the Azovstal plant with fighters and civilians inside.
Queen celebrates 96th birthday in Sandringham,/news/uk-61167593,UK,Britain's longest-reigning monarch has been celebrating the occasion with family and friends.
Rare tiny Brontë book could set $1.25m sale record,/news/world-us-canada-61178869,US & Canada,The world's first tennis guide and Amy Winehouse's library are also on offer at the NY Antiquarian Book Fair.
Premier League: Burnley 2-0 Southampton - Collins doubles lead,/sport/live/football/60809966,Football,Follow live text updates and listen to BBC Radio 5 Live commentary as Burnley host Southampton in the Premier League.
La Liga: Real Sociedad v Barcelona,/sport/live/football/60915693,European Football,Follow live text updates as Barcelona travel to Real Sociedad in La Liga.
'A cruel painfest' - cycling's oldest & toughest classic turns 130,/sport/cycling/61160344,Cycling,"Liege-Bastogne-Liege rarely fails to test riders. In its 130th year, a legend of the race looks back on his most remarkable win."
How one sudden change could reshape the world,/reel/video/p0c2dcm9/what-if-we-stopped-all-mining-tomorrow-,,
The truth behind the legend of the 'sword in the stone',/reel/video/p0c1ymsq/the-truth-behind-the-legend-of-the-sword-in-the-stone-,,
The country with the happiest children in the world,/reel/video/p09z5rlp/how-societal-pressures-shape-motherhood,,
Bali's edible 'miracle tree',https://www.bbc.com/travel/article/20220408-the-return-of-balis-lost-superfood,Travel,It was once believed to have intense magical properties
The soaring cost of return-to-work,https://www.bbc.com/worklife/article/20220420-the-sky-high-cost-of-returning-to-the-office,Worklife,"""When I first went back to the office, I was shocked. It’s just crazy expensive"""
A love story with a horrifying end,https://www.bbc.com/culture/article/20220419-ins-de-castro-the-macabre-tale-of-the-skeleton-queen,Culture,The Portugese tale of King Pedro I and his 'skeleton queen' Inês De Castro
The sex myth that destroys lives,https://www.bbc.com/future/article/20220419-how-the-hymen-myth-destroys-lives,Future,"It's centuries old, but still believed around the world"
Rudy Giuliani revealed on Masked Singer TV show,https://www.bbc.com/news/entertainment-arts-61173811,Entertainment & Arts,The appearance of Donald Trump's former lawyer prompted one of the show's judges to walk off
Queen gets her own Barbie for Platinum Jubilee,https://www.bbc.com/news/uk-61171913,UK,The monarch has her likeness committed to plastic in time for her 96th birthday
Many protected areas do not help wildlife - study,https://www.bbc.com/news/science-environment-61164969,Science & Environment,"Designating an area as ""for nature"" does not mean it is beneficial for wildlife, researchers find"
The forest tended by an elusive giant,/future/article/20220414-how-africas-forest-elephants-help-fight-climate-change,,
What would happen if we stopped mining?,/future/article/20220413-how-ending-mining-would-change-the-world,,
The world's most polluted capital city,/future/article/20220405-the-fungi-cleaning-new-delhis-air,,
Tesla profits soar as customers pay more,/news/business-61170691,Business,Elon Musk's Tesla has raised prices for its electric cars as it faces higher costs.
OneWeb satellite firm will use Indian rockets,/news/science-environment-61175261,Science & Environment,
Depp says ex-wife abused and demeaned him,/news/world-us-canada-61168837,US & Canada,
Woman caught Covid twice within record 20 days,/news/health-61161529,Health,
'Sip and shop': The retailers tempting you in with alcohol,https://www.bbc.co.uk/news/business-61077756,Business,
Climate change and farming driving insect decline,/news/science-environment-61165279,Science & Environment,
A$AP Rocky arrested in connection with shooting,/news/entertainment-arts-61174333,Entertainment & Arts,
Reflective moments and unusual views,/news/in-pictures-61072096,In Pictures,
"Africa's top shots: Celestial bodies, pastries and greens",/news/world-africa-61092881,Africa,
Whip-wielding demons kick off Easter in El Salvador,/news/world-latin-america-61078955,Latin America & Caribbean,
Memorial to lost children wins global photo contest,/news/in-pictures-61014501,In Pictures,
"Africa's top shots: Prayers, pastries and portraits",/news/world-africa-61021573,Africa,
