title,href,tag,summary
Biden raises Khashoggi murder with Saudi prince,/news/world-us-canada-62186332,US & Canada,"The US president is attempting to rebuild ties having promised to make Saudi Arabia a ""pariah""."
Black man was shot 46 times by US police - autopsy,/news/world-us-canada-62184202,US & Canada,
Tearful Woods says goodbye to St Andrews Opens,/sport/golf/62181388,Golf,
Canada gunman's partner describes night of terror,/news/world-us-canada-62102201,US & Canada,
Tory rivals clash over tax and spending plans,/news/uk-politics-62186878,UK Politics,
National emergency declared after red heat warning,/news/uk-62177458,UK,Trains could be disrupted and schools are closing early as temperatures could hit 40C (104F).
Four-year-old Liza among victims of Russian strike,/news/world-europe-62181726,Europe,"Liza was one of three children killed in the attack on Vinnytsia, far from the front line."
Ivana Trump died of blunt impact injuries to torso,/news/world-us-canada-62187716,US & Canada,The death of Donald Trump's first wife is ruled accidental amid reports that she fell down stairs.
Man Utd sign free agent Eriksen on three-year deal,/sport/football/62172524,Football,Manchester United complete the signing of Denmark midfielder Christian Eriksen on a free transfer.
England finish group stage in style as NI bow out,/sport/football/62155093,Sport,England wrap up an impressive group stage at Euro 2022 as they comfortably beat Northern Ireland having already qualified for the quarter-finals.
Henderson and Salah score as Liverpool beat Palace,/sport/football/62183246,Football,Goals from Jordan Henderson and Mohamed Salah give Liverpool a 2-0 friendly win against Crystal Palace in Singapore.
The spin-off that bettered Breaking Bad,https://www.bbc.com/culture/article/20220708-how-better-call-saul-bettered-breaking-bad,Culture,How genius TV drama Better Call Saul improved on its forebear Breaking Bad
A Scottish beast isolated for centuries,https://www.bbc.com/travel/article/20220712-the-orkney-sheep-reared-on-seaweed,Travel,"These wild-eyed, short-legged sheep have been reared solely on seaweed"
Why prison cells were painted pink,https://www.bbc.com/future/article/20220713-the-hidden-meaning-of-your-favourite-colour,Future,Some colours can boost our concentration or change our mood
The British Prime Minister who underestimated Hitler,/reel/video/p0clns90/why-did-chamberlain-seek-to-appease-hitler-,,
Do blonde people have a happier and easier life?,/reel/video/p0clq1yy/do-blonde-people-have-a-happier-and-easier-life-,,
Why you may need less sleep than you think,/reel/video/p0ck62w1/why-do-some-people-need-less-sleep-,,
The pollution caused by rocket launches,https://www.bbc.com/future/article/20220713-how-to-make-rocket-launches-less-polluting,Future,Spaceflight fuel has a toxic legacy
The nations luring nomads with visas,https://www.bbc.com/worklife/article/20220707-the-digital-nomad-visas-luring-workers-overseas,Worklife,Why 25-plus countries are moving to let travelling workers put down roots
The empire the Aztecs couldn't conquer,https://www.bbc.com/travel/article/20220710-the-empire-the-aztecs-couldnt-conquer,Travel,"They were a powerful political force, yet they were still nearly lost to history"
The UFO-mania that swept the US,https://www.bbc.com/culture/article/20220714-the-ufo-sightings-that-swept-the-us,Culture,Why did America became obsessed with aliens?
News quiz: Where did a new Van Gogh turn up?,https://www.bbc.com/news/world-62163298,World,Test yourself on the week's headlines in our quiz
The unseen whale killer,https://www.bbc.com/future/article/20220712-how-to-fix-our-ocean-noise-pollution-problem,Future Planet,Ocean noise pollution is terrible for sealife
Fuss-free desserts to make at home,https://www.bbc.com/food/collections/easy_family_puddings,Food,Easy desserts that will impress the whole family for a special dinner
The ancient material that cools homes,/future/article/20220705-the-sustainable-cities-made-from-mud,,
Why the world's tallest trees are dying,/future/article/20220623-the-genetic-power-of-ancient-trees,,
The promise of a world without roads,/future/article/20220621-what-if-roads-went-underground,,
Happy Mondays bassist Paul Ryder dies at 58,/news/entertainment-arts-62184425,Entertainment & Arts,"His brother, singer Shaun, and other bandmates pay tribute to him as a ""true pioneer and legend""."
India starts giving free Covid booster jabs,/news/world-asia-india-56345591,India,
Could next Tory leader ditch key climate goal?,/news/science-environment-62168213,Science & Environment,
"Don't expect great summer experience, warns airport boss",/news/business-62149041,Business,
Shaking head and mean goose among new emojis,/news/technology-62177610,Technology,
"Count butterflies to help protect them, public urged",/news/uk-62170401,UK,
Covid: Sore throat and cough top symptoms,/news/health-62161604,Health,
Africa's top shots: Red roosters and supermoons,/news/world-africa-62163915,Africa,
In pictures: Buck Moon rises over England,/news/uk-england-hampshire-62163274,Hampshire & Isle of Wight,
In pictures: The rise and fall of a prime minister,/news/in-pictures-62085538,In Pictures,
Beaches and landscapes of an English summer,/news/in-pictures-61785703,In Pictures,
Pride at 50: Rare photos of early marches,/news/in-pictures-61813459,In Pictures,
