title,href,tag,summary
Three men guilty of murdering black jogger in US,/news/world-us-canada-59411030,US & Canada,Ahmaud Arbery was chased and shot in a case that became a rallying cry to racial justice protesters.
More people cross the Channel after deadliest day,https://www.bbc.com/news/uk-59412329,UK,
Sweden's first female PM resigns on day one,https://www.bbc.com/news/world-europe-59400539,Europe,
The 'remarkable' power of honey,https://www.bbc.com/future/article/20211122-bee-gold-why-honey-is-an-insect-superfood,Future,
The masterpieces stolen by the Nazis,https://www.bbc.com/culture/article/20211123-the-masterpieces-stolen-by-the-nazis,Culture,
What a young jogger's murder exposes about America,/news/world-us-canada-59410920,US & Canada,"Ahmaud Arbery died in a ""modern-day lynching"" - locals say the spectre of racism is always present."
The America I give thanks for (as I depart),/news/world-us-canada-59395804,US & Canada,"Thanksgiving is the best of America and here's why, writes Jon Sopel in his farewell column."
Man receives world's first 3D-printed eye,/news/uk-england-london-59410743,London,Steve Varze will be given the realistic eye at Moorfields Eye Hospital in London.
'Man City everything Pochettino's individuals are not',/sport/football/59411459,European Football,"Manchester City outplayed Paris St-Germain and with Mauricio Pochettino struggling to impose his style the Manchester United talk will not go away, writes Phil McNulty."
Returning James inspires Lakers,/sport/basketball/59413703,Basketball,LeBron James marks his return from suspension with 39 points as the Los Angeles Lakers beat the Indiana Pacers 124-116 in overtime.
Iyer impresses for India on Test debut,/sport/cricket/59416282,Cricket,Debutant Shreyas Iyer hits an unbeaten 75 as India reach 258-4 on day one of the first Test against New Zealand in Kanpur.
'The most interesting mathematical artifact of the ancient world',/reel/video/p0b69b9j/the-ancient-tablets-revealing-the-mysteries-of-babylonia,,
Is a vegan diet healthier than eating meat and dairy?,/reel/video/p0b5x2z7/is-a-vegan-diet-healthier-than-eating-meat-and-dairy-,,
The simple thing that instantly changes our social status,/reel/video/p09fr7s2/what-your-clothes-reveal-about-you,,
Georgia's forgotten wine region,https://www.bbc.com/travel/article/20211124-georgias-forgotten-wine-region,Travel,The community is harvesting wine for the first time in 400 years
How gender equality is moving backwards,https://www.bbc.com/worklife/article/20210518-the-hidden-load-how-thinking-of-everything-holds-mums-back,Worklife,How 'thinking of everything' at home leaves mothers behind
The worst Hollywood star makeovers,https://www.bbc.com/culture/article/20211123-house-of-gucci-and-the-trouble-with-extreme-actor-makeovers,Culture,From Jared Leto to Jessica Chastain: the controversy over actor transformations
Will Russia ever leave oil behind?,https://www.bbc.com/future/article/20211115-climate-change-can-russia-leave-fossil-fuels-behind,Future,"Fossil fuels are a source of not only wealth in Russia, but deep national pride"
"What I learned eating at 8,000 Chinese restaurants",https://www.bbc.com/news/world-us-canada-59356176,US,David R Chan's decades of dining has taught him about America and himself
What's being done to stop Channel crossings?,https://www.bbc.com/news/explainers-53734793,Explainers,Record numbers of migrants have been crossing the English Channel in boats in recent months
Remarkable Roman mosaic found in farmer's field,https://www.bbc.com/news/uk-england-leicestershire-59391650,UK,"The mosaic, part of a villa complex, is said to be one of the most significant found in Britain"
The living architecture of India,/future/article/20211117-how-indias-living-bridges-could-transform-architecture,,
A neglected protein-rich 'superfood',/future/article/20210420-the-protein-rich-superfood-most-europeans-wont-eat,,
Bangladesh's unusual use for oysters,/future/article/20210827-the-unlikely-protector-against-rising-seas-in-bangladesh,,
Tolkien estate blocks JRR Token crypto-currency,/news/technology-59373968,Technology,"Lawyers representing the estate said the product, launched in August, infringed the author's..."
Peter Jackson on how Tolkien stopped a Beatles LOTR film,/news/entertainment-arts-59387182,Entertainment & Arts,
Germany's Scholz seals deal to end Merkel era,/news/world-europe-59399702,Europe,
Europe's largest bike-maker sees sales soar as more of us cycle,https://www.bbc.co.uk/news/business-59386433,Business,
"Europe 'once again' epicentre of Covid, WHO warns",/news/live/world-59398909,World,
Dart asteroid-smashing mission launches,/news/science-environment-59327293,Science & Environment,
I'm a Celebrity star Madeley taken to hospital,/news/entertainment-arts-59414721,Entertainment & Arts,
Spellbinding photo of Welsh lighthouse wins award,/news/in-pictures-59403205,In Pictures,
Photographer sorry for 'small eyes' Dior picture,/news/world-asia-china-59397737,China,
Images of despair and hope from around the world,/news/uk-wales-59337844,Wales,
Bowie and Queen photographer Mick Rock dies,/news/uk-england-manchester-59344065,Entertainment & Arts,
"Africa's top shots: Horns, shields and bomb-proof suits",/news/world-africa-59333941,Africa,
