title,href,tag,summary
FBI warns of increased threats after Trump search,/news/world-us-canada-62553556,US & Canada,"A memo to law enforcement notes an uptick in ""threats and acts of violence"" since the Mar-a-Lago search."
No 10 defends PM's holiday as removal vans arrive,https://www.bbc.com/news/uk-politics-62554178,UK Politics,
'Starbucks fired me for being three minutes late',https://www.bbc.com/news/business-62426940,Business,
How mammals outlived the dinosaurs,https://www.bbc.com/future/article/20220812-dinosaur-extinction-why-did-mammals-survive,Future,
The greatest novel of the 20th Century?,https://www.bbc.com/culture/article/20220812-did-proust-write-the-greatest-novel-of-the-20th-century,Culture,
William Ruto wins Kenya election amid drama,/news/world-africa-62554210,Africa,"The announcement was marred by scuffles, allegations of vote-rigging and a divided electoral commission."
Ukraine hits Russian Wagner mercenary HQ in east,/news/world-europe-62547403,Europe,"The Luhansk base was targeted after a Russian journalist revealed its location online, Ukraine claims."
Holland takes social media break for mental health,/news/entertainment-arts-62546361,Entertainment & Arts,"The Spider-Man: Homecoming star says Instagram and Twitter can be ""detrimental"" to his mental health."
Premier League: Liverpool 0-1 Crystal Palace - Nunez hits post after Zaha opener,/sport/live/football/62498835,Football,Follow live text updates from as Liverpool host Crystal Palace in the Premier League.
Moeen blasts Phoenix towards victory over Rockets,/sport/live/cricket/60184775,The Hundred,"Follow live text, clips and radio commentary as Birmingham Phoenix host Trent Rockets in the Men's Hundred."
Tuchel and Conte charged by FA over post-match clash,/sport/football/62555380,Football,Thomas Tuchel and Antonio Conte are charged by the Football Association following their clash on Sunday after the Premier League match between Chelsea and Tottenham.
The musical genius Napoleon tried to erase from history,/reel/video/p0cry99y/joseph-boulogne-the-musical-genius-you-ve-never-heard-of,,
What does dying really feel like?,/reel/video/p0c59rmr/what-does-dying-really-feel-like-,,
How repeating mantras 'repairs' your brain,/reel/video/p0cqt0yc/mantra-meditation-the-ancient-practice-to-heal-our-minds,,
The end of the layoff taboo,https://www.bbc.com/worklife/article/20220812-how-layoffs-shed-their-taboo,Worklife,Some workers are posting about getting laid off – and it's paying off
The floating homes of Lake Titicaca,https://www.bbc.com/travel/article/20220814-the-floating-homes-of-lake-titicaca,Travel,These living engineering marvels were created out of necessity
The most sustainable way to eat fish,https://www.bbc.com/future/article/20220810-can-eating-fish-ever-be-sustainable,Future,Is sustainable seafood actually possible – or should we avoid fish altogether?
The puppet calling his creator racist,https://www.bbc.com/culture/article/20220811-meet-the-puppet-who-has-called-out-his-creator-for-racism,Culture,How a ventriloquist's dummy is taking on bigotry – wherever he sees it
Shanghai Ikea shoppers flee Covid lockdown attempt,https://www.bbc.com/news/world-asia-china-62547503,China,Video shows people running out of the store in Xuhui district as guards tried to shut them in
Setback for trapped miners as water levels rise,/news/world-latin-america-62491342,Latin America & Caribbean,Rescue attempts have been delayed again after the water level in the flooded shafts suddenly rose.
Why was British India partitioned 75 years ago?,https://www.bbc.com/news/world-south-asia-62467438,South Asia,"Britain left India 75 years ago and the country became two separate states, India and Pakistan"
The crab invading the Mediterranean,/future/article/20220809-how-the-mediterranean-became-the-worlds-most-invaded-sea,,
Scotland's most misunderstood landscape,/future/article/20220802-climate-change-the-promise-and-danger-of-scotlands-peat,,
How religion is saving species in India,/future/article/20220726-how-religious-worship-is-boosting-conservation-in-india,,
Heche organs donated as life support switched off,/news/entertainment-arts-62552076,Entertainment & Arts,The actress was declared dead last week but kept on life support until a suitable person was found.
NHS IT supplier held to ransom by hackers,/news/technology-62506039,Technology,
World leaders meet in attempt to protect oceans,/news/science-environment-62524611,Science & Environment,
UK first country to approve dual-strain Covid jab,/news/health-62548336,Health,
Tributes for India's 'stock market king' Jhunjhunwala,/news/world-asia-india-62538324,India,
Horse Whisperer author Nicholas Evans dies aged 72,/news/entertainment-arts-62548282,Entertainment & Arts,
Drought highlights dangers for electricity supply,/news/science-environment-62524551,Science & Environment,
In pictures: Stunning Sturgeon Moon lights up skies,/news/in-pictures-62518102,In Pictures,
"In pictures: Heatwaves, drought and wildfires",/news/in-pictures-62497772,In Pictures,
Artist makes patients scars 'glisten with gold',/news/uk-england-cambridgeshire-62490005,Cambridgeshire,
"Africa's top shots: Laughs, leaps and prickly pears",/news/world-africa-62503581,Africa,
Picture of wild cat hunting flamingo wins award,/news/in-pictures-62492855,In Pictures,
