title,href,tag,summary
Station master arrested after dozens killed in Greece train crash,/news/live/world-europe-64807384,Europe,"The two trains which collided early on Wednesday were left running on the same track, a government spokesman said."
Pictures show devastation after Greece train disaster,https://www.bbc.com/news/world-europe-64808123,Europe,
Ruling party wins Nigeria's presidential election,https://www.bbc.com/news/world-africa-64760226,Africa,
The problem confronting women of colour,https://www.bbc.com/worklife/article/20230228-the-perfect-storm-keeping-women-of-colour-behind-at-work,Worklife,
The 1991 video game phenomenon,https://www.bbc.com/culture/article/20230228-street-fighter-ii-the-1991-video-game-that-packs-a-punch,Culture,
Survivors describe 'nightmarish seconds' as trains crashed,/news/world-europe-64806678,Europe,Passengers smashed windows to escape burning carriages after two trains collided near Larissa.
Rescuers search wreckage of deadly Greece train crash,/news/world-europe-64808068,Europe,A passenger train hit a freight train travelling in the opposite direction in northern Greece.
Covid origin likely China lab incident - FBI chief,/news/world-us-canada-64806903,US & Canada,Other US agencies have come to different conclusions from the FBI on how the pandemic began.
Malan & Jacks rebuild with England in trouble chasing 210 v Bangladesh,/sport/live/cricket/64797494,Cricket,Follow live text updates as England face Bangladesh in the first of three one-day internationals in Mirpur.
"Premier League & FA Cup build-up, plus Fontaine tributes",/sport/live/football/64808173,Football,"Reaction as Blackburn, Brighton, Fulham and Manchester City make it through to the FA Cup quarter-finals, plus build-up to Wednesday's fifth-round ties and Premier League action."
Yorkshire racism hearing - follow day one live,/sport/live/cricket/64787519,Cricket,Follow live as day one of the Cricket Discipline Commission hearing into racism at Yorkshire CCC gets under way in London.
Huldufólk: The truth about Iceland's belief in hidden people,/reel/video/p0f5xqv0/hulduf-lk-iceland-s-mythical-world-of-hidden-people,,
The shocking legacy of the Dutch 'Hunger Winter',/reel/video/p0f5qzdq/the-harmful-legacy-of-poor-nutrition,,
Extreme Korean game stirs heated controversy,/reel/video/p0f56xr5/extreme-korean-game-stirs-heated-controversy,,
The controversy of 'marine weasels',https://www.bbc.com/future/article/20230228-how-alaskas-sea-otters-came-back,Future,"Once hunted almost to extinction, sea otters have seen a remarkable recovery"
The ultimate paragon of male beauty?,https://www.bbc.com/culture/article/20230227-the-original-and-most-iconic-male-model,Culture,The enduring figure of David has embodied masculinity throughout history
A new way to navigate work and life,https://www.bbc.com/worklife/article/20230227-what-does-work-life-balance-mean-in-a-changed-work-world,Worklife,"As barriers between home and job collapse, what does work-life balance mean now?"
The Greek meatballs packed with history,https://www.bbc.com/travel/article/20230228-soutzoukakia-the-greek-meatballs-packed-with-history,World's Table,Caroline Doriti's new cookbook shares the story behind this Greek comfort food
The return of the US' lost language,https://www.bbc.com/travel/article/20230228-kouri-vini-the-return-of-the-us-lost-language,Travel,"There are fewer than 6,000 speakers left"
Ed Sheeran says wife developed tumour in pregnancy,https://www.bbc.com/news/entertainment-arts-64809475,Entertainment & Arts,"The health scare and the death of his friend Jamal Edwards sent Sheeran ""spiralling"" into depression"
Why is Israel-Palestinian violence surging?,https://www.bbc.com/news/world-middle-east-64757995,Middle East,How come the Israel-Palestinian conflict seems to have suddenly got much worse
The clothes you can't recycle,/future/article/20230227-how-to-recycle-your-clothes,,
How longer weekends help the planet,/future/article/20230220-is-a-4-day-workweek-good-for-the-climate,,
Can the unborn have a say on climate?,/future/article/20230215-should-future-generations-have-climate-rights,,
Spectacular northern lights seen across UK,/news/uk-64782372,UK,The northern lights were so vibrant on Sunday night they were spotted in Kent and Cornwall.
Guilt-free flying not in easy reach - scientists,/news/science-environment-64788106,Science & Environment,
Twitter goes down with users unable to view tweets,/news/technology-64811286,Technology,
Bieber cancels remaining Justice world tour dates,/news/entertainment-arts-64808389,Entertainment & Arts,
Relief as Hong Kong lifts 945-day mask mandate,/news/world-asia-china-64806987,China,
What is carbon capture and can it fight climate change?,/news/science-environment-64723497,Science & Environment,
Blackpink lead top stars back on the road in Asia,https://www.bbc.co.uk/news/business-64286127,Business,
SAG Awards: The red carpet in pictures,/news/entertainment-arts-64781316,Entertainment & Arts,
Vigils and flags: Ukraine war anniversary in pictures,/news/in-pictures-64757068,In Pictures,
The 24-year photography project,/news/in-pictures-64723755,In Pictures,
Outlaw-themed parade triumphs at Rio carnival,/news/world-latin-america-64742729,Latin America & Caribbean,
"Chukkas, cats and candles: Africa's top shots",/news/world-africa-64726122,Africa,
