title,href,tag,summary
Zelensky denies Ukraine attacked Putin or Moscow,/news/world-europe-65471904,Europe,"""We don't attack Putin or Moscow. We fight on on our territory,"" the Ukrainain leader says."
US raises interest rates to highest in 16 years,https://www.bbc.com/news/business-65474456,Business,
Man dies after being put in chokehold on NYC subway,https://www.bbc.com/news/world-us-canada-65472810,US,
The rappers risking the death penalty,https://www.bbc.com/culture/article/20230502-hichkas-the-song-that-became-an-iranian-protest-anthem,Culture,
Can remote-work gossip backfire?,https://www.bbc.com/worklife/article/20230427-the-perks-and-perils-of-remote-work-gossip,Worklife,
Teen made 'kill list' for Serbia school attack,/news/world-europe-65468404,Europe,A 13-year-old schoolboy is arrested after at least nine are killed at a primary school in Belgrade.
Why the International Space Station is on its last legs,https://www.bbc.com/future/article/20230502-a-fiery-end-how-the-iss-will-end-its-life-in-orbit,News,What does it take to safely de-orbit a 400-tonne object from outer space?
Former world 100m champion Bowie dies aged 32,/sport/athletics/65471163,Athletics,"American sprinter Tori Bowie, a three-time Olympic medallist and former 100m world champion, has died aged 32."
"Premier League: Salah gives Liverpool lead, Man City twice hit woodwork",/sport/live/football/65428741,Football,Follow live text coverage and 5 Live commentary as Manchester City host West Ham and Liverpool take on Fulham in the Premier League.
Real Madrid in advanced talks to sign Bellingham,/sport/football/65473901,European Football,Real Madrid are in advanced talks with Borussia Dortmund to sign England midfielder Jude Bellingham for more than 100m euros.
"Garcia, Westwood & Poulter resign from DP World Tour",/sport/golf/65476846,Golf,"Sergio Garcia, Ian Poulter and Lee Westwood will be ineligible to play in this year's Ryder Cup after resigning from the DP World Tour."
In pictures: Night-time Coronation dress rehearsal,https://www.bbc.com/news/in-pictures-65467802,In Pictures,Pictures of the Coronation dress rehearsal in central London
A chicken dish made for the queen,https://www.bbc.com/travel/article/20230430-coronation-chicken-the-story-behind-the-royal-dish,World's Table,The famous dish has been reimagined by a variety of chefs over the years
Your full guide to how Coronation day will unfold,https://www.bbc.com/news/uk-65342840,UK,"Processions, ancient rituals, a fly-past and the crowning moment"
Why do French men pee on the street?,/reel/video/p0fg8f6z/why-do-french-men-pee-on-the-street-,,
Is this the real face of Elizabeth I?,/reel/video/p06npby0/is-this-the-real-face-of-elizabeth-i-,,
The secret lives of Saudi women,/reel/video/p075n0sy/the-secret-lives-of-saudi-women,,
A history of art in 7 colours,https://www.bbc.com/culture/article/20230428-a-history-of-art-in-7-colours,Culture,From Picasso and Hokusai's Prussian Blue to Vermeer's shade of red
The puzzle of Neanderthal culture,https://www.bbc.com/future/article/20230428-the-puzzle-of-neanderthal-culture-and-aesthetics,Future,They may have even had an appreciation of aesthetics
The town where England began,https://www.bbc.com/travel/article/20230502-kingston-upon-thames-londons-town-of-kings-and-queens,Travel,A humble London suburb's proud royal heritage
How are mums working without childcare?,https://www.bbc.com/worklife/article/20230426-the-mothers-working-from-home-without-childcare,Worklife,"Even as many kids have returned to care, not every mother has the help she needs"
Wanted: Someone to run 134-acre farm with sea views,https://www.bbc.com/news/articles/c1rl3yn59n7o,UK,The farmhouse is set in 134 acres of land on a cliff overlooking Carmarthen Bay
The 'dancing on the grave' murder that shook India,https://www.bbc.com/news/world-asia-india-65397222,India,"Shakereh Khaleeli was ""rich and beautiful"". But in 1991, the wealthy heiress went missing"
Scottish wildcat on brink of extinction - research,https://www.bbc.com/news/uk-scotland-highlands-islands-65473244,UK,There are likely too few pure-bred Scottish wildcats for the population to be viable
The revival of a historic Italian fruit,/future/article/20230424-how-agrivoltaics-helped-save-italys-citron-and-lemon-trees,,
The first climate-resilient nation?,/future/article/20230418-how-caribbean-island-dominica-is-fighting-climate-impacts,,
A major positive climate tipping point,/future/article/20230414-climate-change-why-2023-is-a-clean-energy-milestone,,
Row over Met Gala's Karl Lagerfeld tribute,/news/entertainment-arts-65469466,Entertainment & Arts,Actress Jameela Jamil criticises the A-list event for honouring the controversial designer.
AI chatbots 'may soon be more intelligent than us',/news/world-us-canada-65452940,US & Canada,
Riding the 'vomit comet' with first disabled astronaut,/news/science-environment-65380263,Science & Environment,
New Alzheimer's drug slows disease by a third,/news/health-65471914,Health,
The 17 most eye-catching looks at the Met Gala,/news/entertainment-arts-65413976,Entertainment & Arts,
Australia to ban recreational vaping,/news/world-australia-65446352,Australia,
George Michael and Kate Bush to join Hall of Fame,/news/entertainment-arts-65467456,Entertainment & Arts,
Parasols and prayers: Africa's top shots,/news/world-africa-65409697,Africa,
The photos that chronicle the cost of dying,/news/uk-scotland-65354687,Scotland,
Len Goodman obituary: From the East End to Strictly stardom,/news/entertainment-arts-58929590,Entertainment & Arts,
Penarth: Nofio gyda'r wawr yn y môr // Sea swimming at dawn,/newyddion/65372997,Cylchgrawn,
In pictures: Muslims around the world celebrate Eid,/news/in-pictures-65346964,In Pictures,
