title,href,tag,summary
China urges calm over 'spy' balloon in US airspace,/news/world-us-canada-64521570,US & Canada,The US condemns China's intrusion as the Pentagon reports a second Chinese balloon over Latin America.
Ukraine to get long-range missiles in latest US aid,/news/world-europe-64518532,Europe,
Elon Musk not guilty of fraud over Tesla tweet,/news/world-us-canada-64520157,US & Canada,
'I escaped abusive jungle cult - then rescued my son',/news/world-middle-east-63942615,Middle East,
Fernandez makes debut as Chelsea held by Fulham,/sport/football/64421607,Football,
Agony and ecstasy of writing the president's big speech,/news/world-us-canada-64493028,US & Canada,It's often the US president's most important address of the year - but for speechwriters it's the assignment from hell.
Canadian teen wins $48m lotto jackpot on first try,/news/world-us-canada-64519968,US & Canada,"Sensible Juliette Lamour, 18, immediately turned to a financial planner, or Dad, as she calls him."
Coldest wind chill ever recorded in continental US,/news/world-us-canada-64485092,US & Canada,The cold on Mount Washington in New Hampshire on Friday was producing a wind chill of -108F (-77C).
Six Nations set for blockbuster opening weekend,/sport/rugby-union/64500376,Rugby Union,All you need to know as one of the most competitive Six Nations tournaments in recent years begins with a blockbuster day of action on Saturday.
ECB racism process 'failed everybody' - Hoggard,/sport/cricket/64487851,Sport,"Former England cricketer Matthew Hoggard says the Yorkshire historical racism investigation and disciplinary process has failed everyone involved, including Azeem Rafiq."
Haaland eyes 95-year record - can he 'walk on water'?,/sport/football/64373064,Football,Erling Haaland looks certain to break Premier League scoring records - but can he challenge Dixie Dean's all-time tally?
Italy's ancient homes for dodging taxes,https://www.bbc.com/travel/article/20230202-italys-ancient-conical-homes,Travel,They're a Unesco World Heritage site – but many people have never heard of them
The 90s star who became a Gen Z icon,https://www.bbc.com/culture/article/20230201-how-country-pop-superstar-shania-twain-became-a-gen-z-icon,Culture,Why the country-pop superstar is riding higher than ever
Secrets of the lost dinosaur continent,https://www.bbc.com/future/article/20230202-the-weird-dinosaurs-of-americas-lost-continent,Future,Hidden within North America is a continent once ruled by bizarre dinosaurs
The unspeakable barbarity committed against Niger,/reel/video/p0f0pvg8/the-unspeakable-barbarity-committed-against-niger,,
The truth behind your favourite flavours,/reel/video/p0f0cw07/the-truth-behind-your-favourite-flavours,,
The benefits of a 'weekend marriage',/reel/video/p0dztrm5/is-separation-marriage-key-to-a-healthy-relationship-,,
Ireland's tasty new holiday,https://www.bbc.com/travel/article/20230203-recipe-boxty-pancakes-and-bacon-for-st-brigids-day,Travel,It marks the beginning of spring in the ancient Celtic calendar
The unruly ancient rituals for now,https://www.bbc.com/culture/article/20230203-the-unruly-ancient-rituals-still-practised-today,Culture,A revival of interest in chaotic folk customs can tell us a lot about life now
Why women with UTIs are frustrated,https://www.bbc.com/future/article/20230126-why-arent-there-better-treatments-for-cystitis,Future,Women are often dismissed when they report symptoms of urinary tract infections
The Gen Z friendship problem,https://www.bbc.com/worklife/article/20230201-can-gen-z-make-friends-in-the-pandemic-era,Worklife,Why young adults are struggling to make friends – and needing to get creative
Celebrated designer Paco Rabanne dies aged 88,https://www.bbc.com/news/world-europe-64515027,Europe,"Paco Rabanne, best known for his perfumes and fashion designs, dies at his home in France"
Why do celebrities sometimes wear offensive outfits?,https://www.bbc.com/news/newsbeat-64503224,Newsbeat,"Sometimes, outfits can be remembered for the wrong reasons"
Cancer as a young person: 'A blood test saved me',https://www.bbc.com/news/health-64505734,Health,Research suggests many 18-24 year-olds do not know the five major things to look for
Are ski trips coming to an end?,/future/article/20230124-how-climate-change-threatens-to-close-ski-resorts,,
Why Italy's olive trees are dying,/future/article/20230111-the-super-sniffer-dogs-saving-italys-dying-olive-trees,,
How far can vertical farming go?,/future/article/20230106-what-if-all-our-food-was-grown-in-indoor-vertical-farms,,
Sam Smith 'overwhelmed' by number one album Gloria,/news/entertainment-arts-64518168,Entertainment & Arts,"The 30-year-old singer scores their third number one album, thanking fans for supporting them."
Interpol working out how to police the metaverse,/news/technology-64501726,Technology,
Infected blood inquiry: Five things we have learned,/news/health-64497868,Health,
Africa's top shots: Yellow disguises and bird chasers,/news/world-africa-64497630,Africa,
Fraud claims against Adani group spark political row,/news/world-asia-india-64508129,India,
Bird flu 'spills over' to otters and foxes in UK,/news/science-environment-64474594,Science & Environment,
Canada experiments with decriminalising hard drugs,/news/world-us-canada-64461983,US & Canada,
In pictures: Up Helly Aa,/news/uk-scotland-64464271,Scotland,
Heavy snow disrupts life in India's Himalayan states,/news/world-asia-india-64462193,India,
The defiant low-lying island 70 years after floods,/news/uk-england-essex-64255567,Essex,
Survivors and leaders mark Holocaust Memorial Day,/news/in-pictures-64425194,In Pictures,
'Fen skating is a great metaphor for life',/news/uk-england-cambridgeshire-64399819,Cambridgeshire,
