title,href,tag,summary
"Russians failed three times in bloody river battle, says Ukraine",/news/live/world-europe-61404062,Europe,Photos show dozens of burnt-out tanks after Russia's temporary bridges were shelled in eastern Ukraine.
Ukraine tries first Russian soldier for war crimes,https://www.bbc.com/news/world-europe-61441907,Europe,
Village pub asked to change name by Vogue magazine,https://www.bbc.com/news/uk-england-cornwall-61435596,Cornwall,
The people who 'danced themselves to death',https://www.bbc.com/culture/article/20220512-the-people-who-danced-themselves-to-death,Culture,
The 'forever chemicals' in your blood,https://www.bbc.com/future/article/20220512-the-chemicals-that-linger-for-decades-in-your-blood,Future,
US basketball star has Russian detention extended,/news/world-us-canada-61417928,US & Canada,"Russian media says Moscow wishes to ""swap"" Griner for the arms trafficker Viktor Bout."
Elon Musk puts $44bn Twitter deal on hold,/news/business-61433724,Business,"The billionaire wants more data on fake accounts, prompting speculation over the deal's future."
Eleven migrants drown trying to reach US territory,/news/world-us-canada-61417926,US & Canada,"Almost 40 people, mostly from Haiti, were rescued after their boat capsized near Puerto Rico."
Alexander-Arnold or James - who gets your vote?,/sport/football/61302842,Football,"Trent Alexander-Arnold or Reece James? The two provide plenty of debate when it comes to who is the better full-back, and will go head-to-head in Saturday's FA Cup final."
"Flo-Jo, Elaine & the 100m world record",https://www.bbc.co.uk/sport/extra/qoop28e78d/flo-jo,Sport,Will Flo-Jo's women's 100m world record finally be broken this summer? And will Olympic champion Elaine Thompson-Herah be the person to do it?
De Bruyne & Salah up for top Premier League award,/sport/football/61433663,Football,Manchester City's Kevin de Bruyne and Liverpool's Mohamed Salah are among eight nominees for the Premier League player of the season award.
The forgotten genius who invented our future,/reel/video/p0c6k16c/the-forgotten-genius-who-invented-our-future,,
What Marvel got wrong about the God of Thunder,/reel/video/p0c664wj/was-thor-really-an-all-conquering-hero-,,
How the rebirth of supersonic flight could change everything,/reel/video/p0c5mvlh/can-supersonic-flight-ever-be-sustainable-,,
A 20th-Century city à la ancient Athens,https://www.bbc.com/travel/article/20220512-ljubljana-the-ancient-athens-of-modern-europe,Travel,It was recently inscribed on Unesco's World Heritage List
Why women file for divorce more,https://www.bbc.com/worklife/article/20220511-why-women-file-for-divorce-more-than-men,Worklife,Women may be more likely to call it quits than their male partners – why?
The Earth 'blobs' no one understands,https://www.bbc.com/future/article/20220510-why-are-there-continent-sized-blobs-in-the-deep-earth,Future,They're among the planet's largest structures – and they're a total mystery.
Top Gun 2: Better than the original,https://www.bbc.com/culture/article/20220512-top-gun-maverick-hits-its-target-with-explosive-force,Culture,Top Gun: Maverick is better than the original
Moon soil used to grow plants for first time,https://www.bbc.com/news/science-environment-61434295,Science & Environment,The research is an important step towards making long-terms stays on the moon possible
The enduring intrigue and theories around crop circles,https://www.bbc.com/news/entertainment-arts-61332202,Entertainment & Arts,A new novel follows the men who owned up to making crop circles - but some of the mystery remains
Lemon and amaretti trifle to be Jubilee pudding,https://www.bbc.com/news/uk-61428970,UK,Jemma Melvin's creation is inspired by a lemon posset served at the Queen's wedding to Prince Philip
The UK’s disappearing village,/future/article/20220506-the-uk-climate-refugees-who-wont-leave,,
The hidden volcano beneath a city,/future/article/20220427-how-taiwan-discovered-an-active-volcano-on-its-doorstep,,
The forest tended by an elusive giant,/future/article/20220414-how-africas-forest-elephants-help-fight-climate-change,,
Stablecoin collapse sends crypto tokens tumbling,/news/technology-61425209,Technology,The sudden demise of TerraUSD sends other crypto-coins into a downward spiral.
Coleen Rooney: My online post was a last resort,/news/entertainment-arts-61433801,Entertainment & Arts,
Tech Tent: Learning the lessons of Wannacry,https://www.bbc.co.uk/sounds/play/w3ct3751,Technology,
First picture of monster black hole in our galaxy,/news/science-environment-61412463,Science & Environment,
North Korea announces first death from Covid-19,/news/world-asia-61432084,Asia,
Watchdog highlights 'precarious state' of nature,/news/science-environment-61414475,Science & Environment,
Ireland fail to make Eurovision Song Contest final,/news/entertainment-arts-61428830,Entertainment & Arts,
Mythological family photos win top prize,/news/in-pictures-61073684,In Pictures,
Africa's top shots: Big knits and giant gems,/news/world-africa-61399819,Africa,
From India to UK: An immigrant's snapshots from 1950s,/news/world-asia-india-61389834,India,
Archive sheds new light on Tutankhamun discovery,/news/world-middle-east-61394416,Middle East,
Photo map of Queen's visits released to mark jubilee,/news/uk-england-61377866,England,
