title,href,tag,summary
US lawmakers line up to attack TikTok at CEO hearing,/news/live/world-us-canada-65042782,US & Canada,Members of Congress tell Shou Zi Chew they think the app should be banned due to China privacy concerns.
World Athletics bans transgender female athletes,https://www.bbc.com/sport/athletics/65051900,Athletics,
Parents of Michigan school shooter to stand trial,https://www.bbc.com/news/world-us-canada-65058523,US,
A clam as large as a human hand,https://www.bbc.com/travel/article/20230322-toheroa-a-fabled-shellfish-that-nearly-vanished,Travel,
New giant spider species found in Australia,https://www.bbc.com/news/world-australia-65048226,Australia,
'Yes or no?' US politicians grill TikTok boss,/news/world-us-canada-65058744,US & Canada,The TikTok CEO faced US lawmakers during a Congressional hearing on the app's practices.
The front line where Russian eyes are always watching,/news/world-europe-65028217,Europe,"The Ukrainian stronghold where, despite months of vicious attacks, the Russians have gained just 10 metres."
"Dad changed after Paltrow ski crash, daughter says",/news/entertainment-arts-65050951,Entertainment & Arts,Terry Sanderson is suing Hollywood actress Gwyneth Paltrow over an accident in Utah in 2016.
"Rice gives England lead against Italy, Ronaldo breaks appearance record",/sport/live/football/64995743,Football,"Follow live BBC 5 Live commentary & text updates as Italy face England in the Euro 2024 qualification rounds at the Diego Armando Maradona Stadium, Naples."
Euro 2024 qualifiers: Northern Ireland take on San Marino,/sport/live/football/65028436,Football,Live audio and text coverage as Northern Ireland kick off their 2024 European Championship qualifying campaign away to San Marino.
Finnish entrepreneur bids to buy Man Utd with fans,/sport/football/65054294,Football,Finnish entrepreneur Thomas Zilliacus says he has submitted a bid to buy Manchester United.
The first woman labelled with Stockholm syndrome,/reel/video/p0fbc3fl/is-this-the-true-origin-of-stockholm-syndrome-,,
"The art of taking the very, very long view of time",/reel/video/p0f7stl9/the-art-of-taking-the-very-very-long-view-of-time,,
What 'witches' reveal about our deepest fears,/reel/video/p0f9x668/what-horror-films-reveal-about-society-s-deepest-fears,,
Hollywood's most extreme actors,https://www.bbc.com/culture/article/20230322-jeremy-strong-and-hollywoods-most-extreme-actors,Culture,The controversial style of 'method acting' that divides the industry
Why work drinking culture is fading,https://www.bbc.com/worklife/article/20230320-why-workplace-drinking-culture-is-fading-fast,Worklife,Alcohol is embedded in work culture. But it might not stay that way
The street that epitomises New York,https://www.bbc.com/travel/article/20230321-jackson-heights-the-neighbourhood-that-epitomises-new-york,Travel,It's one of the most diverse places on Earth
Why the Alps are crumbling,https://www.bbc.com/future/article/20230322-how-climate-change-is-melting-permafrost-in-the-alps,Future,Ancient permafrost deep in the rock is melting with dangerous consequences
Why does the US want to ban TikTok?,https://www.bbc.com/news/technology-65042762,Technology,The US government is threatening to ban TikTok - how would that work?
Bundchen says Brady split was 'death of my dream',https://www.bbc.com/news/world-us-canada-65047375,US,The Brazilian supermodel and US football star split after 13 years of marriage
Who do you think will qualify for Euro 2024?,https://www.bbc.com/sport/football/64934994,European Championship,Qualifying for Euro 2024 gets under way this week as 53 nations battle for 24 places
Shipping's wind power revolution,/future/article/20230310-will-shipping-return-to-its-ancient-roots,,
A better way to make concrete,/future/article/20230309-how-carbon-negative-concrete-can-help-the-climate,,
The clothes you can't recycle,/future/article/20230227-how-to-recycle-your-clothes,,
John Wick's fourth film lands its best reviews,/news/entertainment-arts-65049818,Entertainment & Arts,"Keanu Reeves' John Wick: Chapter Four ""outdoes its formidable predecessors"", one critic says."
Ikea told to tackle sexual harassment after complaint,/news/business-65037239,Business,
Gene-edited food now legal to be sold in England,/news/science-environment-64596453,Science & Environment,
Living with water pollution in Guatemala,/news/world-latin-america-65047381,Latin America & Caribbean,
Deadly fungal infection spreading in US,/news/world-us-canada-65027557,US & Canada,
What is gene-edited food and is it safe to eat?,/news/science-environment-64559210,Science & Environment,
Organ-trafficking plot politician and wife guilty,/news/uk-england-london-65013545,London,
California battles deadly storm and flooding,/news/world-us-canada-64959807,US & Canada,
England's high streets championed in photographs,/news/uk-england-65029453,England,
Recording a city's ghost signs before they vanish,/news/uk-england-leeds-64798380,Leeds & West Yorkshire,
Appeal made for photos for night out exhibition,/news/uk-england-derbyshire-64989782,Derby,
"Puppeteers, superstars and dinosaurs: Africa's top shots",/news/world-africa-64976952,Africa,
