title,href,tag,summary
Zelensky denies Ukraine attacked Putin or Moscow,/news/world-europe-65471904,Europe,"""We don't attack Putin or Moscow. We fight on on our territory,"" the Ukrainian leader says."
US raises interest rates to highest in 16 years,https://www.bbc.com/news/business-65474456,Business,
Man City regain top spot as Haaland makes history,/sport/football/64929885,Football,
The true story of the Kentucky Derby,https://www.bbc.com/travel/article/20230503-the-kentucky-derbys-forgotten-black-past,Travel,
What a king's personal style reveals,https://www.bbc.com/culture/article/20230503-what-a-kings-personal-style-reveals,Culture,
Teen made 'kill list' for Serbia school attack,/news/world-europe-65468404,Europe,A 13-year-old schoolboy is arrested after at least nine are killed at a primary school in Belgrade.
US approves world's first RSV vaccine,/news/world-us-canada-65477747,US & Canada,Officials say the vaccine against the deadly virus could be rolled out for older adults by August.
Man dies on subway after rider put him in chokehold,/news/world-us-canada-65472810,US & Canada,"A medical examiner has ruled the cause of death to be homicide, from ""compression of neck""."
"A tour of a lost world, before football changed forever",https://www.bbc.co.uk/sport/extra/DqkhZA6FP7/around-the-92-in-the-1980s,Sport,"Thirty-five years ago, a father and son set off to tour every Football League ground. They brought back a record of a disappearing era and a lasting relationship."
Haaland breaks Premier League goal record for season,/sport/football/65474843,Football,Manchester City striker Erling Haaland scores against West Ham to break the record for goals in a Premier League season.
"Garcia, Westwood & Poulter resign from DP World Tour",/sport/golf/65476846,Golf,"Sergio Garcia, Ian Poulter and Lee Westwood will be ineligible to play in this year's Ryder Cup after resigning from the DP World Tour."
"Coronation protests allowed, security minister says",https://www.bbc.com/news/uk-65466825,UK,Campaign groups have received letters reminding them about penalties under new protest laws
A chicken dish made for the queen,https://www.bbc.com/travel/article/20230430-coronation-chicken-the-story-behind-the-royal-dish,World's Table,The famous dish has been reimagined by a variety of chefs over the years
Your full guide to how Coronation day will unfold,https://www.bbc.com/news/uk-65342840,UK,"Processions, ancient rituals, a fly-past and the crowning moment"
Why do French men pee on the street?,/reel/video/p0fg8f6z/why-do-french-men-pee-on-the-street-,,
Is this the real face of Elizabeth I?,/reel/video/p06npby0/is-this-the-real-face-of-elizabeth-i-,,
The secret lives of Saudi women,/reel/video/p075n0sy/the-secret-lives-of-saudi-women,,
A quintessentially British scone recipe,https://www.bbc.com/travel/article/20230503-marthas-collisons-coronation-crown-scones,World's Table,"Shaped into a crown, they're infused with Darjeeling and honey"
Do you own too many clothes?,https://www.bbc.com/future/article/20230502-how-to-make-your-wardrobe-sustainable,Future,The 'sufficient' wardrobe
Can remote-work gossip backfire?,https://www.bbc.com/worklife/article/20230427-the-perks-and-perils-of-remote-work-gossip,Worklife,Why venting about your boss just became much riskier
The rappers risking the death penalty,https://www.bbc.com/culture/article/20230502-hichkas-the-song-that-became-an-iranian-protest-anthem,Culture,How hip-hop has soundtracked Iran's protest era
The town where England began,https://www.bbc.com/travel/article/20230502-kingston-upon-thames-londons-town-of-kings-and-queens,Travel,A humble London suburb's proud royal heritage
New Alzheimer's drug slows disease by a third,https://www.bbc.com/news/health-65471914,Health,The second such drug in a year raises hopes we can start treating dementia
The 'dancing on the grave' murder that shook India,https://www.bbc.com/news/world-asia-india-65397222,India,"Shakereh Khaleeli was ""rich and beautiful"". But in 1991, the wealthy heiress went missing"
The revival of a historic Italian fruit,/future/article/20230424-how-agrivoltaics-helped-save-italys-citron-and-lemon-trees,,
The first climate-resilient nation?,/future/article/20230418-how-caribbean-island-dominica-is-fighting-climate-impacts,,
A major positive climate tipping point,/future/article/20230414-climate-change-why-2023-is-a-clean-energy-milestone,,
Branson feared 'losing everything' in pandemic,/news/uk-65458395,UK,"Sir Richard Branson says the pandemic left his businesses near collapse and him ""a little..."
Air travel chaos looms as US keeps 5G deadline,/news/world-us-canada-65465512,US & Canada,
Life in ocean ‘twilight zone' at risk from warming,/news/science-environment-65460128,Science & Environment,
Australia to ban recreational vaping,/news/world-australia-65446352,Australia,
The 17 most eye-catching looks at the Met Gala,/news/entertainment-arts-65413976,Entertainment & Arts,
Covid whistleblower returns home to Wuhan after jail,/news/world-asia-china-65454824,China,
Can Morocco solve Europe’s energy crisis?,https://www.bbc.co.uk/news/business-65415529,Business,
Parasols and prayers: Africa's top shots,/news/world-africa-65409697,Africa,
The photos that chronicle the cost of dying,/news/uk-scotland-65354687,Scotland,
Len Goodman obituary: From the East End to Strictly stardom,/news/entertainment-arts-58929590,Entertainment & Arts,
Penarth: Nofio gyda'r wawr yn y môr // Sea swimming at dawn,/newyddion/65372997,Cylchgrawn,
In pictures: Muslims around the world celebrate Eid,/news/in-pictures-65346964,In Pictures,
