title,href,tag,summary
US to review response to Texas school shooting,/news/world-us-canada-61622797,US & Canada,The Justice Department will investigate amid criticism that police waited to tackle the shooter.
Zelensky makes first front-line trip to Kharkiv,/news/world-europe-61625512,Europe,
'Too many mistakes' - how Ferrari lost out in Monaco,/sport/formula1/61627668,Formula 1,
UK urges investigation into Paris football chaos,/news/uk-61626746,UK,
French jetpack inventor injured in lake crash,/news/world-europe-61622794,Europe,
Israeli nationalists march in Jerusalem amid tension,/news/world-middle-east-61611304,Middle East,Thousands of flag-waving youth dance and sing in a Muslim district in the face of Palestinian anger.
Landslides and floods kill dozens in Brazil,/news/world-latin-america-61626912,Latin America & Caribbean,Landslides caused by heavy rains kill at least 44 people in the region of Recife in Brazil.
Russia says 'liberation' of Donbas its key priority,/news/world-europe-61628473,Europe,Foreign Minister Sergei Lavrov defends the ongoing invasion of Ukraine in a French TV interview.
Gujarat crowned IPL champions in debut tournament,/sport/cricket/61625647,Cricket,Gujarat Titans beat Rajasthan Royals by seven wickets to be crowned Indian Premier League champions in their first year of the tournament.
Nadal wins thriller to set up Djokovic quarter-final,/sport/tennis/61619569,Tennis,Rafael Nadal will play long-time rival Novak Djokovic in the French Open quarter-finals after winning an absorbing five-set battle with Canada's Felix Auger-Aliassime.
Forest return to Premier League after 23-year wait,/sport/football/61539298,Football,Nottingham Forest end their 23-year wait for Premier League football with a narrow win over Huddersfield Town in the Championship play-off final at Wembley.
Have scientists discovered how to read our thoughts?,/reel/video/p0c9j6wm/have-scientists-discovered-how-to-read-our-thoughts-,,
The shocking discovery that turned archaeologists into ‘terrorists’,/reel/video/p09kw6r2/trypillia-7000-year-old-civilisation-silenced-by-communists,,
"The 3,000-year-old martial art that terrified the British",/reel/video/p0c7trtc/kalaripayattu-india-s-martial-art-and-the-world-s-oldest,,
Why some animals appreciate art,https://www.bbc.com/future/article/20220527-the-animals-with-an-artistic-eye,Future,Art may not just be a human impulse
The greatest political drama ever,https://www.bbc.com/culture/article/20220526-borgen-the-greatest-political-drama-ever,Culture,How a Danish TV series depicts politics with a rare 'clear-eyed realism'
The unretiring workers jumping back in,https://www.bbc.com/worklife/article/20220526-is-this-the-end-of-retirement-as-we-know-it,Worklife,"Many older people are foregoing ""playing golf"" and taking up new jobs"
Switzerland's ingenious cooling caves,https://www.bbc.com/travel/article/20220529-switzerlands-ingenious-cooling-caves,Travel,"When fridges didn't exist, locals had to find other ways to keep food cool"
From blunk to brickfielder: Wonderful words for weather,https://www.bbc.com/programmes/articles/1gnSbXqRYSybzRHbCZX03C3/from-blunk-to-brickfielder-our-wonderful-words-for-weather,Radio 4,"Explore the ways we describe the climate, from snell winds to dreich days"
'I felt like crying about calories being on menus',https://www.bbc.com/news/uk-england-norfolk-61220500,UK,Some people with eating disorders worry about setbacks and anxiety attacks
The secrets of the deep ocean,https://www.bbc.com/ideas/videos/the-secrets-of-the-deep-ocean/p0c8gybb,Ideas,Take a dive down to the bottom of the ocean to see what creatures lurk
What if we all stopped flying?,/future/article/20220519-what-if-we-all-stopped-flying,,
The batteries powered by gravity,/future/article/20220511-can-gravity-batteries-solve-our-energy-storage-problems,,
The UK’s disappearing village,/future/article/20220506-the-uk-climate-refugees-who-wont-leave,,
Porridge actress Patricia Brake dies aged 79,/news/entertainment-arts-61624478,Entertainment & Arts,"The ""soap stalwart"" died following a long illness, her family confirms."
English 'rainforests' illegally burned - campaigners,/news/science-environment-61607510,Science & Environment,
The new airlines betting that we all want to start flying again,https://www.bbc.co.uk/news/business-61575429,Business,
Tech Tent: Another setback for facial recognition,https://www.bbc.co.uk/sounds/play/w3ct3753,Technology,
Monkeypox wasn’t created in a lab - and other claims debunked,/news/health-61580089,Health,
Why scientists are also watching animal YouTube videos,/news/science-environment-61609679,Science & Environment,
In pictures: BBC Radio 1's Big Weekend,/news/newsbeat-61592569,Newsbeat,
"Celebs, sandstorms and striking photos this week",/news/in-pictures-61607954,In Pictures,
Fangs a lot! 'Vampire' gathering smashes record,/news/uk-england-york-north-yorkshire-61597097,York & North Yorkshire,
Africa's top shots: Beaded beekeepers and salt mounds,/news/world-africa-61591198,Africa,
Your pictures of Scotland,/news/uk-scotland-61556530,Scotland,
City of art: From red swimmers to floating teapots,/news/world-africa-61549269,Africa,
