title,href,tag,summary
Iraqi PM survives drone attack on his home,/news/world-middle-east-59195399,Middle East,Mustafa al-Kadhimi says he was not hurt in the attack by a drone carrying explosives in Baghdad.
Police investigate crowd surge at Texas festival,/news/world-us-canada-59194819,US & Canada,
"T20 World Cup: NZ lose Mitchell but start well, needing 125 to beat Afghanistan and reach semis - clips, radio & text",/sport/live/cricket/58260665,Cricket,
Row over attempt to suspend Libya's foreign minister,/news/world-africa-59196814,Africa,
PM's actions over Paterson corrupt - Starmer,/news/uk-59196404,UK Politics,
US Navy launches ship named for gay rights leader,/news/world-us-canada-59196462,US & Canada,The USNS Harvey Milk is one of six new ships named after famous civil rights leaders.
Fleeing passengers shut down busy Spanish airport,/news/world-europe-59191108,Europe,Palma de Mallorca Airport closes for four hours after 21 people run from a plane across the tarmac.
Dozens convicted as Italy begins huge Mafia trial,/news/world-europe-59196463,Europe,More than 350 alleged mobsters will face court in the biggest mafia trial in decades.
Alvarez makes history by beating Plant,/sport/boxing/59196322,Boxing,Saul 'Canelo' Alvarez makes history in Las Vegas by becoming the first undisputed world super-middleweight champion.
'Something simply has to change at Man Utd',/sport/football/59190589,Football,"An Eric Bailly own goal and Bernardo Silva strike gave City victory in the Manchester derby, but their dominance wasn't reflected by the two-goal margin."
How did Red Bull miss out on the front row?,/sport/formula1/59195054,Formula 1,"For all the talk about tyres and downforce, it's still a bit of a mystery how Red Bull lost out to Mercedes in qualifying in Mexico."
Great Resignation: Could we be wrong?,https://www.bbc.com/worklife/article/20211028-what-were-getting-wrong-about-the-great-resignation,Worklife,What we're getting wrong about the mass worker exodus
China's 'death knell' for coal overseas,https://www.bbc.com/future/article/20211028-how-chinas-climate-decisions-affect-the-world,Future,The world's largest emitter of CO2 is turning its back on coal abroad
The village that tamed a 100ft wave,https://www.bbc.com/travel/article/20211031-how-a-portuguese-fishing-village-tamed-a-100ft-wave,Travel,The skyscraper-sized waves are caused by Europe's largest underwater canyon
The man-made Greek forest that mimics the Amazon,/reel/video/p0b24z7f/the-man-made-greek-forest-that-mirrors-the-amazon,,
The simple Australian habit that boosts your fitness,/reel/video/p0b22fj1/why-australians-love-going-barefoot,,
The mythical 'miracle' rings lost for centuries,/reel/video/p0b1mn5r/the-legendary-miracle-rings-of-ourense,,
Why it's wrong to dismiss demisexuality,https://www.bbc.com/worklife/article/20211101-why-demisexuality-is-as-real-as-any-sexual-orientation,Worklife,No attraction without connection? Understanding this sexual orientation
Why Hollywood is shunning sex,https://www.bbc.com/culture/article/20211029-why-hollywood-is-shunning-sex,Culture,"With fewer sex scenes than ever, has film entered a Puritan age?"
The wind farms that float on the ocean,https://www.bbc.com/future/article/20211103-can-renewables-replace-fossil-fuels,Future,Could deep sea wind turbines and green hydrogen be the future of energy?
The city where you can't serve meat,https://www.bbc.com/travel/article/20211101-varanasi-where-its-forbidden-to-serve-meat,Travel,A meat ban has fostered creativity among a new generation of chefs
The foods with the same carbon footprint as 5 miles in an SUV,https://www.bbc.co.uk/food/articles/carbon_cost_food,Food,Food production is responsible for about a quarter of the world's greenhouse gas emissions
Mary Berry says she's 'never too old to learn',https://www.bbc.com/food/articles/mary_love_to_cook,Food,"One her ""greatest pleasures, when it comes to food, is that there are always new ideas to discover"""
Does the skyscraper still have a future?,https://www.bbc.com/news/world-us-canada-59139998,US,China is limiting the number of tall buildings
Bangladesh's unusual use for oysters,/future/article/20210827-the-unlikely-protector-against-rising-seas-in-bangladesh,,
The ancient Persian way to keep cool,/future/article/20210810-the-ancient-persian-way-to-keep-cool,,
California's last-chance butterfly lab,/future/article/20211013-the-race-to-save-californias-endangered-butterflies,,
"Global food prices hit fresh 10-year high, UN says",/news/business-59172665,Business,Reduced harvests and supply chain disruptions are helping to push up the cost of food.
UB40 former member Astro dies after illness,/news/entertainment-arts-59195024,Entertainment & Arts,
"Time for bold compromises at COP26, says PM",/news/science-environment-59191376,Science & Environment,
Instagram: A blessing or a curse?,/news/technology-59180946,Technology,
"Antiviral Covid pill 89% effective, Pfizer says",/news/health-59178291,Health,
National Trust calls for ban on peat in compost,/news/uk-59195535,UK,
Brazil singer Mendonca dies in plane crash at 26,/news/world-latin-america-59186654,Latin America & Caribbean,
Striking pictures from around the world this week,/news/in-pictures-59174460,In Pictures,
Africa's top shots: Gazing veterans and ancient skulls,/news/world-africa-59161935,Africa,
Northern Lights splendour captured across Cumbria,/news/uk-england-cumbria-59153902,Cumbria,
In pictures: Scotland's young climate activists,/news/uk-scotland-59109736,Scotland,
In pictures: Leaders gather for COP26,/news/in-pictures-59118673,In Pictures,
