title,href,tag,summary
What China's economic problems mean for the world,/news/business-66840367,Business,Problems faced by the world's second-largest economy include a property market crisis and slow growth.
Gunman kills three in twin Rotterdam shootings,https://www.bbc.com/news/world-europe-66954233,Europe,
Sweden summons army chief after surge in gang killings,https://www.bbc.com/news/world-europe-66952421,Europe,
Potter stars among tributes to Sir Michael Gambon,https://www.bbc.com/news/entertainment-arts-66949848,Entertainment & Arts,
The city charging visitors to enter,https://www.bbc.com/travel/article/20230928-venices-new-5-entry-fee-explained,Travel,
Anxious Chinese home buyers reel from Evergrande crisis,/news/world-asia-china-66956769,China,"As China's housing crisis grows, so have fears that dreams of home ownership have been bulldozed."
Republicans lay out case at Biden impeachment inquiry,/news/world-us-canada-66954626,US & Canada,"Witnesses, called by Republicans, cautioned that evidence is lacking for impeaching the president."
Canada Nazi row puts spotlight on Ukraine's WWII past,/news/world-us-canada-66914756,US & Canada,"For decades, Jewish groups have criticised monuments that celebrate Ukrainian veterans in Canada."
Ryder Cup day one: Europe v United States - live text,https://www.bbc.co.uk/sport/golf/live/cdrqdnyw3qrt,Sport,Follow live text commentary from day one of the Ryder Cup at the Marco Simone Golf and Country Club in Rome.
"Premier League, WSL build-up & news conferences",/sport/live/football/66954908,Football,Premier League build-up and news conferences before a huge weekend with big games including Liverpool's trip to Tottenham.
How England qualified for World Cup quarter-finals,/sport/rugby-union/66956208,Rugby Union,"After a troubled build-up to the World Cup, England have secured their place in the quarter-finals with a game to spare."
How I rewired my brain in six weeks,/reel/video/p0ggy0fn/how-i-rewired-my-brain-in-six-weeks,,
The world's quickest electric vehicle,/reel/video/p0gh2kvj/the-world-s-quickest-electric-vehicle,,
The unsolved problem as urgent as climate change,/reel/video/p0gfyls0/are-we-at-the-brink-of-a-bug-pocalypse-,,
10 films to watch in October,https://www.bbc.com/culture/article/20230928-from-killers-of-the-flower-moon-to-the-exorcist-believer-10-of-the-best-films-to-watch-in-october,Culture,From Killers of the Flower Moon and The Exorcist: Believer to Dicks: The Musical
Four of the best countries for women,https://www.bbc.com/travel/article/20230927-the-worlds-most-gender-equal-countries,Travel,What's it really like to live in these top-rated places?
The secrets of Earth's eighth continent,https://www.bbc.com/future/article/20230928-the-mysteries-of-the-worlds-eighth-continent,Future,A new map of Zealandia is revealing how it formed – and why it sank
Why the US embraced 'strike culture',https://www.bbc.com/worklife/article/20230927-how-strike-culture-took-hold-in-the-us-in-2023,Worklife,How US labour stoppages have become so popular and effective
Weekly quiz: Who was Taylor Swift cheer captain for?,https://www.bbc.com/news/world-66948416,World,How closely have you been paying attention to what's been going on over the past seven days?
Europe's oldest shoe found in Spanish bat cave,https://www.bbc.com/news/world-europe-66956483,Europe,"The 6,000-year-old woven sandals are among dozens of prehistoric objects being analysed by..."
Cher accused of hiring men to kidnap her son,https://www.bbc.com/news/world-us-canada-66946652,US,The claims are contained in court documents filed by the estranged wife of Cher's son
"A 2,000-year-old method to water crops",/future/article/20230922-the-ancient-sri-lankan-tank-cascade-systems-tackling-drought,,
The goats fighting fires in LA,/future/article/20230922-these-la-goats-help-stop-wildfires,,
The city that went green to keep cool,/future/article/20230922-how-medellin-is-beating-the-heat-with-green-corridors,,
Sir Michael Gambon: A career in pictures,/news/in-pictures-66950664,In Pictures,A look back at the work of the award-winning star of stage and screen
X scraps feature to report electoral fake news,/news/business-66944123,Business,
"UK unready as wildfires surge, warn firefighters",/news/science-environment-66948836,Science & Environment,
Millions wrongly labelled with penicillin allergy,/news/health-66934909,Health,
PlayStation boss Jim Ryan to retire next year,/news/technology-66925559,Technology,
GB News boss 'appalled' by Laurence Fox comments,/news/entertainment-arts-66957385,Entertainment & Arts,
My Dad Wrote a Porno enters podcasting Hall of Fame,/news/entertainment-arts-66934970,Entertainment & Arts,
The day sea-dipping elephants stunned a Welsh town,/news/uk-wales-66855122,Wales,
Ploughing: A snapshot of a disappearing skill,/news/uk-england-norfolk-66869691,Norfolk,
"Glasses, goats and goodbyes: Africa’s top shots",/news/world-africa-66877589,Africa,
Historic scenes for King and Queen on their French visit,/news/in-pictures-66867649,In Pictures,
Adeiladau anghofiedig Cymru // Wales' forgotten buildings,/newyddion/66858159,Cylchgrawn,
