title,href,tag,summary
Afghan protesters defy Taliban intimidation,/news/world-asia-58497904,Asia,Demonstrators are on the streets again as pictures emerge showing injuries inflicted on journalists.
The birth of a new Taliban order,https://www.bbc.com/news/world-asia-58495112,Asia,
'Havana syndrome' and the mystery of the microwaves,https://www.bbc.com/news/world-58396698,World,
Films showing the reality of marriage,https://www.bbc.com/culture/article/20210907-films-showing-the-reality-of-marriage,Culture,
"'For the first time in my life, I was doing meaningful work'",https://www.bbc.com/worklife/article/20210906-are-we-becoming-less-ambitious,Worklife,
Canadian party leaders spar in national debate,/news/world-us-canada-58482596,US & Canada,Justin Trudeau and other party leaders clashed over climate - and the election call - in the debate.
Smoke alarms go off on International Space Station,/news/world-europe-58497899,Europe,"The alarm went off as the space station's batteries were being charged, Russia's space agency says."
A country plunged into darkness,/news/world-middle-east-58494832,Middle East,"Lebanon’s ongoing crisis has plunged the country into darkness, with some experiencing power cuts for 20 hours a day."
World Cup qualifiers reaction & Premier League build-up,/sport/live/football/58497787,Football,"Reaction to Wednesday's World Cup qualifiers as England, Wales and Northern Ireland draw, plus build-up to the weekend's Premier League games."
India cancel training after Covid case,/sport/cricket/58500916,Cricket,India cancel Thursday's optional training session after another positive Covid-19 test result among their coaching staff.
Raducanu 'didn't expect to be here',/sport/tennis/58495531,Tennis,"British teenager Emma Raducanu expresses her surprise at her run to the US Open semi-finals, having had flights back to the UK booked a fortnight ago."
The new discovery that rewrites the story of how we evolved,/reel/video/p09vcnzv/newly-found-ancient-human-rewrites-story-of-evolution,,
A simple exercise that gives your brain an unexpected boost,/reel/video/p09v8wyh/how-squats-can-boost-your-brain,,
Why you're being manipulated by your own guts,/reel/video/p09v7djs/the-myth-behind-food-cravings,,
The lost generation of ancient trees,https://www.bbc.com/future/article/20210908-the-lost-generation-of-ancient-trees,Future Planet,When today's veteran trees die they may take entire miniature worlds with them
The people 'rage quitting' their jobs,https://www.bbc.com/worklife/article/20210903-why-rage-quitting-is-all-the-rage-this-year,Worklife,How workplace tensions are leading to angry resignations
The book that shaped a Nordic identity,https://www.bbc.com/culture/article/20210907-seven-brothers-the-book-that-shaped-a-nordic-identity,Culture,How a story about living in nature captures the spirit of Finland
The clever science behind frozen ramen,https://www.bbc.com/future/article/20210907-the-clever-science-behind-frozen-ramen,Future,The chewy noodles that survive the office microwave
The woman saving Palestinian food,https://www.bbc.com/travel/article/20210908-the-woman-saving-palestinian-heirloom-seeds,Travel,"The ""seed queen"" is reviving heirloom varietals one seed at a time"
The Kenyans who are helping students to cheat,https://www.bbc.com/news/blogs-trending-58465189,BBC Trending,Some Kenyans try to escape poverty by helping foreign students to fake their academic work
Facebook accused of allowing sexist job advertising,https://www.bbc.com/news/technology-58487026,Technology,An investigation by Global Witness suggests its algorithm is biased in choosing who sees which ads
Bangladesh's unusual use for oysters,/future/article/20210827-the-unlikely-protector-against-rising-seas-in-bangladesh,,
Can investors save the Amazon?,/future/article/20210825-can-investors-save-the-amazon,,
The controversial plan to rewild death,/future/article/20210817-rewilding-death-germanys-plan-to-restore-the-necrobiome,,
Hubble successor given mid-December launch date,/news/science-environment-58498676,Science & Environment,The $10bn James Webb Space Telescope is expected to ride its Ariane rocket to orbit on 18 December.
Jonathan Strange author wins Women's Fiction Prize,/news/entertainment-arts-58488849,Entertainment & Arts,
Mexico decriminalises abortion in landmark ruling,/news/world-latin-america-58482850,Latin America & Caribbean,
Why supermodels had to turn social media into a catwalk,https://www.bbc.co.uk/news/business-58474185,Business,
PayPal raises fees between UK and Europe,/news/technology-58492953,Technology,
"Fossil fuels must stay underground, scientists say",/news/science-environment-58494391,Science & Environment,
Who could win the 2021 Mercury Prize?,/news/entertainment-arts-58499065,Entertainment & Arts,
Turning flies into food for pets - and maybe people,/news/world-africa-58384761,Africa,
Hidden lives of those who call a derelict building home,/news/world-africa-58348750,Africa,
"A community over 50 years and 6,000 photos",/news/uk-england-humber-58422888,Humberside,
"Africa's top shots: Power, prayer and pig masks",/news/world-africa-58420508,Africa,
A singing baboon and a giggling seal,/news/in-pictures-58402306,In Pictures,
