title,href,tag,summary
Hunter Biden charged with tax and gun offences,/news/world-us-canada-65965473,US & Canada,President Biden's son is set to plead guilty to tax crimes and admit illegally owning a gun while a drug user.
Search for missing Titanic sub expanded into deeper waters,/news/live/world-us-canada-65953941,US & Canada,
Andrew Tate charged with rape and human trafficking,https://www.bbc.com/news/world-europe-65959097,Europe,
What did the Vikings eat?,https://www.bbc.com/travel/article/20230619-what-did-the-vikings-eat,World's Table,
Seven cleverly-designed emergency homes,https://www.bbc.com/culture/article/20230619-seven-cleverly-designed-emergency-homes-around-the-world,Culture,
Titan sub has heated walls and curtained-off toilet,/news/world-us-canada-65960217,US & Canada,"We take a look at the missing submersible, which has a unique design and some surprising features."
Japan outrage as child sterilisations revealed,/news/world-asia-65958119,Asia,Parliament discloses for the first time children as young as nine were victims of an eugenics law.
Hunting the monkey torturers,https://www.bbc.co.uk/news/extra/Iot1dIWVS5/hunting-the-monkey-torturers,News,A global network of sadistic monkey torture has been exposed through a BBC investigation.
England strive for wickets as Australia slowly inch towards target,/sport/live/cricket/64958488,Cricket,"Follow live text, Test Match Special commentary and in-play clips from day five of the first Ashes Test between England and Australia at Edgbaston."
Chelsea sign France striker Nkunku for £52m,/sport/football/64013875,Football,"Christopher Nkunku, who scored 16 goals in 25 games for RP Leipzig in the Bundesliga last season, agrees a six-year deal at Stamford Bridge."
West Ham reject Arsenal's second bid for Rice,/sport/football/65963180,Football,West Ham United reject a second bid from Arsenal for England midfielder Declan Rice.
What we know so far about the missing Titanic sub,https://www.bbc.com/news/world-us-canada-65934887,US & Canada,"With a massive search under way, what do we know about the Titanic sub that has gone missing?"
"British father, his son and explorer among missing",https://www.bbc.com/news/uk-65955554,UK,An adventurer and a British businessman travelling with his son are among those on the Titanic sub.
My trip aboard the Titanic tourist sub,https://www.bbc.com/news/world-us-canada-65957709,US,CBS journalist David Pogue says it will be challenging for rescuers to find the vessel in time
Titanic sub: Why it's so hard to find,/reel/video/p0fw7qsp/titanic-sub-why-it-s-so-hard-to-find,,
How modern tech is helping scientists talk to animals,/reel/video/p0fw36yv/how-artificial-intelligence-is-helping-us-talk-to-animals,,
This is what Stonehenge really sounded like,/reel/video/p0frkb7n/what-did-stonehenge-sound-like-,,
Do you have an end-of-history illusion?,https://www.bbc.com/future/article/20230619-how-the-end-of-history-illusion-shapes-your-life-choices,Future,Why we struggle to picture our future selves
America's black national anthem,https://www.bbc.com/culture/article/20230619-lift-every-voice-and-sing-the-black-national-anthem-born-from-a-birthday-party,Culture,How Lift Every Voice and Sing changed a nation
A big job-market problem for women,https://www.bbc.com/worklife/article/20230615-why-its-getting-harder-for-some-women-to-report-harassment,Worklife,"""I was especially not prepared to put my neck on the line"""
The Black farmer who inspired a US park,https://www.bbc.com/travel/article/20230618-sir-lancelot-jones-the-black-farmer-who-inspired-a-us-park,Travel,He lived alone on an island for 94 years and refused to sell it
A daytime nap is good for the brain,https://www.bbc.com/news/health-65950168,Health,Those prone to napping had brains that looked up to six years younger than everyone else
Teenage Anglo-Saxon girl's face revealed,https://www.bbc.com/news/uk-england-cambridgeshire-65919518,UK,"The face of a 16-year-old girl who died more than 1,300 years ago is revealed"
Why is Reddit full of pictures of John Oliver?,https://www.bbc.com/news/technology-65949412,Technology,Some of the biggest subreddits are now only allowing posts featuring the British comedian
The homes built from cannabis,/future/article/20230614-the-buildings-constructed-from-cannabis,,
Finland's plan to bury nuclear waste,/future/article/20230613-onkalo-has-finland-found-the-answer-to-spent-nuclear-fuel-waste-by-burying-it,,
Could hosepipe drones tackle wildfires?,/future/article/20230609-can-we-use-firefighting-drones-put-out-wildfires,,
Beauty of insects revealed in photo competition,/news/in-pictures-65876963,In Pictures,The winning images from the Royal Entomological Society Insect Week photographic competition.
Fan told police throwing phone at star 'would be funny',/news/entertainment-arts-65959685,Entertainment & Arts,
Global monkey torture ring exposed by BBC,/news/world-65951188,World,
Why Spotify's big bet on Meghan fell flat,/news/business-65936228,Business,
Ex-medical officer close to tears over Covid deaths,/news/uk-politics-65962091,UK Politics,
Sudden heat increase in seas around UK and Ireland,/news/science-environment-65948544,Science & Environment,
Ministers to block plans to ban new coal mines,/news/uk-politics-65950291,UK Politics,
Dazzling ancient bronze sword found in Germany,/news/world-europe-65936594,Europe,
Burna Boy bling and high flyers: Africa's top shots,/news/world-africa-65919659,Africa,
Man trots globe blending scenes into film locations,/news/uk-england-essex-65786652,Essex,
In pictures: Nottingham attack shakes city to core,/news/uk-65899897,UK,
Surreal skies grip New Yorkers - in pictures,/news/in-pictures-65843841,In Pictures,
