title,href,tag,summary
Johnson reshuffling Cabinet after Sunak and Javid quit,/news/live/uk-politics-62048657,UK Politics,The chancellor and health secretary tell Boris Johnson they cannot serve in his government after months of pressure on the PM.
PM apologises for giving Pincher government job,https://www.bbc.com/news/uk-politics-62054067,UK Politics,
"British Airways cancels 1,500 more flights",https://www.bbc.com/news/business-62038929,Business,
"Hitchcock's most brutal film, 50 years on",https://www.bbc.com/culture/article/20220704-frenzy-at-50-the-most-violent-film-hitchcock-ever-made,Culture,
Does hard grind buy work-life balance?,https://www.bbc.com/worklife/article/20220701-does-grinding-hard-now-earn-work-life-balance-later,Worklife,
Can Boris Johnson survive these resignations?,/news/uk-politics-62055371,UK Politics,"Two of his cabinet say his government lacks integrity, but the PM is not expected to go easily."
Chicago suspect planned attack for weeks - US police,/news/world-us-canada-62054883,US & Canada,"Police believe the gunman targeted victims at random, with no clear racial or religious motive."
"Sole survivor of a Russian shooting, he lived by playing dead",https://www.bbc.co.uk/news/world-europe-62011689,News,The extraordinary story of the sole survivor from a group of Ukrainians captured by Russian soldiers.
England complete incredible record win over India,/sport/cricket/62031210,Cricket,England nonchalantly complete a record chase of 378 to beat India in rapid time on the final morning of the fifth Test at Edgbaston.
Galtier replaces Pochettino at Paris St-Germain,/sport/football/62050054,European Football,Christophe Galtier is named Paris St-Germain manager after the departure of Mauricio Pochettino.
Premier League player questioned over more rape claims,/sport/football/62055175,Football,A player arrested in north London on Monday on suspicion of rape has been questioned over two further rape allegations.
The extraordinary 'lightning capital' of the world,/reel/video/p0cjxx9x/earth-s-spectacular-and-remote-capital-of-lightning,,
The world's most expensive nannies,/reel/video/p0chln6s/norland-college-the-world-s-most-expensive-nannies,,
The hidden hospital the Nazis could never find,/reel/video/p08phw0p/the-hospital-the-nazis-could-never-find,,
A mystery cult that predates Stonehenge,https://www.bbc.com/travel/article/20220704-a-mysterious-cult-that-predates-stonehenge,Travel,The vast archaeological site could change our understanding of prehistory
How big will cargo ships really get?,https://www.bbc.com/future/article/20220629-why-container-ships-probably-wont-get-bigger,Future,Physics – and economics – might set some limits to the world's biggest vessels
The problem with being over-qualified,https://www.bbc.com/worklife/article/20220705-the-over-qualified-workers-struggling-to-find-a-job,Worklife,"Having experience should make you a great candidate. Not always, say companies"
Thor: Love and Thunder is enormous fun,https://www.bbc.com/culture/article/20220705-thor-love-and-thunder-review-a-romcom-with-epic-battles,Culture,Taika Waititi's latest Thor is 'thundering and sensitive'
New particles hold clues to Universe's make-up,https://www.bbc.com/news/science-environment-62027238,Science & Environment,"They hope they will help us understand the ""strong force"" that holds the insides of atoms together"
Quiz versus the clock: Name Diaz's comeback movie,https://www.bbc.com/news/world-us-canada-62035972,US,"Test your knowledge of the news - 10 questions, 10 seconds each"
How the US Supreme Court is reshaping America,https://www.bbc.com/news/world-us-canada-62000677,US,Recent rulings by the US' top court have divided the country and challenged lawmakers
Why the world's tallest trees are dying,/future/article/20220623-the-genetic-power-of-ancient-trees,,
The promise of a world without roads,/future/article/20220621-what-if-roads-went-underground,,
The English town that welcomed the dark,/future/article/20220614-the-crusade-for-darker-night-skies,,
New giant water lily found hiding in plain sight,/news/science-environment-61725827,Science & Environment,Scientists discover the first new species of giant water lily in more than a century.
Sainsbury's customers switching to own-brand items,/news/business-62047475,Business,
"""Camo-cropping"" colour trial to fool hungry beasties",/news/uk-england-norfolk-62040807,Norfolk,
Trailblazing EastEnders actress Mona Hammond dies,/news/entertainment-arts-62048413,Entertainment & Arts,
Weekend burst of exercise can be enough to stay fit,/news/health-62040665,Health,
Army's YouTube and Twitter accounts hacked,/news/uk-62030644,UK,
Biden vows to protect women travelling for abortion,/news/world-us-canada-62018206,US & Canada,
Return of Africa's most fashionable horse race,/news/world-africa-62020414,Africa,
Pride at 50: Rare photos of early marches,/news/in-pictures-61813459,In Pictures,
Have teenage kicks changed over the years?,/news/entertainment-arts-61968340,Entertainment & Arts,
"Africa's top shots: Tasting, dancing and baking",/news/world-africa-61993604,Africa,
Photographers showcase Sutton Park's beauty,/news/uk-england-birmingham-61956587,Birmingham & Black Country,
