title,href,tag,summary
Belarus sprinter given Polish humanitarian visa,/news/world-europe-58052144,Europe,Olympian Krystina Timanovskaya says she was almost forced on a plane home after criticising coaches.
"Day 10 round-up: Hassan wins gold, Biles back & defeat for USA",https://www.bbc.com/sport/olympics/58052804,Olympics,
US TikToker dies in 'unprovoked' cinema shooting,https://www.bbc.com/news/newsbeat-58054216,Newsbeat,
The rise of extreme job interviews,https://www.bbc.com/worklife/article/20210727-the-rise-of-never-ending-job-interviews,Worklife,
The oldest life on the planet?,https://www.bbc.com/travel/article/20210801-mexicos-three-billion-year-old-underwater-lifeforms,Travel,
Watch: Tokyo 2020 - Equestrian individual & badminton replays,/sport/live/olympics/50974151,Olympics,Watch BBC coverage from day 10 of the Tokyo 2020 Olympics.
Canada upset USA to set up Sweden final,/sport/olympics/58054953,Olympics,Canada secured a 1-0 victory over world champions the United States to set up a women's Olympic football final against Sweden at Tokyo 2020.
What's behind Olympian Raven Saunders' X protest,/news/world-us-canada-58048727,US & Canada,The US shot-putter defies a ban on podium gestures after taking silver at the Tokyo Games.
Kane absent from Spurs' training ground,/sport/football/58053653,Sport,"Harry Kane, a transfer target for Manchester City, fails to return to the Tottenham training ground as expected on Monday morning amid speculation over his future."
Biles to compete in beam final,/sport/olympics/58054200,Olympics,Simone Biles will compete in the beam final as she takes up her final chance of an individual medal at an Olympics where she has withdrawn from four other finals.
I just want my friend to be OK - Root,/sport/cricket/58059554,Cricket,"Ben Stokes has ""an opportunity to put himself first"", says England Test captain Joe Root as the all-rounder takes an indefinite break from cricket."
Playing with FIRE: The millennial movement to quit work,/reel/video/p09qwdp6/playing-with-fire-the-millennial-movement-to-quit-work,,
How the Soviets accidentally discovered the 'Gates of Hell',/reel/video/p08vxl52/how-the-soviets-accidentally-discovered-the-gates-of-hell-,,
The words that reveal if you are an introvert or an extrovert,/reel/video/p09hg3dd/why-extroverts-have-their-own-extreme-language,,
The ancient origins of the new nomads,https://www.bbc.com/culture/article/20210730-the-ancient-origins-of-the-new-nomads,Culture,Itinerant lifestyles feel new but the idea goes back millennia
The shipwreck that changed the world,https://www.bbc.com/travel/article/20210729-the-british-shipwreck-that-changed-the-world,Travel,It led to two acts of parliament and the establishment of longitude
Why New Yorkers pay $15 for a salad,https://www.bbc.com/worklife/article/20210728-why-new-yorkers-pay-15-for-sad-desk-salads,Worklife,Many workers in New York are obsessed with high-end salads – why?
The largest active volcano in Europe,https://www.bbc.com/future/article/20210730-the-enigma-of-europes-largest-active-volcano,Future,A vast submerged volcano could trigger a tsunami on Italy's coasts
Then and now: The burning issue of wildfires,https://www.bbc.com/news/science-environment-57946155,Science & Environment,Scientists are increasingly concerned climate change is making fires more frequent and more intense
The perfect storm striking World of Warcraft,https://www.bbc.com/news/technology-58017429,Technology,"All of a sudden, WoW players are in revolt, and its competitors are having a boom"
The top hip-hop dancer who can’t count the beats,https://www.bbc.com/news/stories-57905243,Stories,"Dancer Yami Lofvenberg was labelled ""stupid"" at school. Now she's returned - as a lecturer"
How to invite wildlife into your home,/future/article/20210727-how-to-boost-biodiversity-and-attract-wildlife-to-your-home,,
The neglected 'Galapagos of Europe',/future/article/20210720-europes-museum-of-living-fossils,,
The beavers returning to Utah's desert,/future/article/20210713-the-beavers-returning-to-the-desert,,
Matt Damon's daughter stopped him using a gay slur,https://www.bbc.com/news/entertainment-arts-58053709,Entertainment & Arts,The actor vowed to never use term again after his daughter explained to him why it was unacceptable
Flagship UK telecommunications satellite launches,/news/science-environment-58032592,Science & Environment,
Comedian Griffin reveals lung cancer diagnosis,/news/entertainment-arts-58061672,Entertainment & Arts,
Anti-Semitic social posts 'not taken down',/news/technology-58058428,Technology,
China battles worst Covid outbreak since Wuhan,/news/world-asia-china-58021911,China,
UK military opens first space command centre,/news/uk-politics-58029083,UK Politics,
Beyond Meat boss backs tax on meat consumption,/news/business-58032552,Business,
Shire horses help harvest at Cambridge University,/news/uk-england-cambridgeshire-58057800,Cambridgeshire,
Africa's top shots: Giant leaves and Olympic tattoos,/news/world-africa-58012834,Africa,
Global Tiger Day highlights decline of species,/news/in-pictures-58012200,In Pictures,
Knitting photo wins science-photography prize,/news/in-pictures-57989254,In Pictures,
In pictures: Summer storms over Scotland,/news/uk-scotland-south-scotland-57998429,South Scotland,
