title,href,tag,summary
UN official says 'no safe place in Gaza' as fighting rages,/news/live/world-middle-east-67305304,Middle East,"There is increasingly little the UN can do to protect Gazans trying to shelter from the fighting, says the UN's Thomas White."
Five new realities after four weeks of Israel-Gaza war,/news/world-middle-east-67306902,Middle East,
What a Trump second term would look like,/news/world-us-canada-67272569,US & Canada,
England clinch inaugural WXV1 title with win over New Zealand - reaction,/sport/live/rugby-union/67189097,Rugby Union,
Deadly earthquake strikes remote western Nepal,/news/world-asia-67317442,Asia,
Extra accuses Brand of film set sexual assault,/news/world-us-canada-67318813,US & Canada,The actor is accused of exposing himself and sexually assaulting a woman on set in a US lawsuit.
Space telescope records baby star's first screams,/news/science-environment-67243772,Science & Environment,The James Webb observatory records the giant jets and shocks created by a birthing star in Orion.
Biden meets families in Maine after mass shooting,/news/world-us-canada-67313370,US & Canada,The attack at a bowling alley and bar in Lewiston was the deadliest shooting in the state's history.
Rashford birthday party 'unacceptable' - Ten Hag,/sport/football/67314370,Football,"Marcus Rashford's birthday celebrations after Manchester United's 3-0 derby defeat were ""unacceptable"" and the forward has apologised, says Erik ten Hag."
Leicester winning run ended by impressive Leeds,/sport/football/67235729,Football,Leeds United end Leicester City's nine-game winning run in the Championship with an impressive victory at the King Power Stadium.
FA investigating if Tonali broke betting rules at Newcastle,/sport/football/67313204,Football,The FA is investigating whether banned midfielder Sandro Tonali breached betting rules after joining Newcastle in the summer.
Did American History X predict the future?,https://www.bbc.com/culture/article/20231102-how-american-history-x-foreshadowed-the-resurgence-of-white-nationalism-in-the-us,Culture,The 1998 indie film portrayed a chilling vision of extremism in the US
How bison are restoring US grasslands,https://www.bbc.com/future/article/20231102-why-grazing-bisoncould-be-good-for-the-planet,Future,The giant grazers transform the landscape for the better
Why surge pricing is spreading,https://www.bbc.com/worklife/article/20231101-why-surge-pricing-is-coming-at-restaurants-online-retailers-and-more,Worklife,Why you'll soon spend more at restaurants and retailers during peak hours
Sign up to our new climate newsletter,/future/article/20231103-introducing-future-earth-newsletter-get-bbc-climate-updates-to-your-inbox,,
A frosty day at a Finnish forest school,/future/article/20231031-how-forest-schools-boost-childrens-immune-systems,,
The Danish island eliminating trash,/future/article/20231025-bornholm-the-danish-island-aiming-for-zero-waste,,
Tuning into indigenous climate science,https://www.bbc.com/future/article/20231102-climate-scientists-are-working-with-indigenous-tribes,Future,Western scientists are using indigenous knowledge to study climate change
Why ads are hitting streaming services,https://www.bbc.com/worklife/article/20231101-why-some-streaming-companies-are-leaning-into-adverts-and-raising-prices,Worklife,The adverts consumers hoped to escape through media subscriptions are returning
How Britney's book reveals the truth,https://www.bbc.com/culture/article/20231103-britney-spearss-the-woman-in-me-the-celebrity-memoirs-that-reveal-the-truth,Culture,A new wave of celebrity memoirs are raw and personal
Japan's most unique accommodation?,https://www.bbc.com/travel/article/20231103-shukubo-the-japanese-temples-where-you-can-sleep-alongside-monks,Travel,Spending the night with Buddhist monks allows for an immersive experience
Palestinian-American family finally escapes Gaza,https://www.bbc.com/news/world-us-canada-67301742,US,The war shattered a joyful reunion with the grandparents the couple's one-year-old had never met
The king-size creation on display at cake show,https://www.bbc.com/news/uk-england-birmingham-67301315,UK,The snackable sovereign is made from marshmallows and chocolate
Thieves cut through museum floor to steal silverware,https://www.bbc.com/news/uk-england-nottinghamshire-67303974,UK,"Detectives say the theft of historical military items was ""audacious"" and well organised"
Finland's inspiring sub-zero education,/reel/video/p0gpz6cd/finland-s-inspiring-sub-zero-education,,
The 400-year-old nude self-portrait censored for centuries,/reel/video/p0gq3vps/the-naked-portrait-covered-up-for-centuries,,
The truth about supplements and who should be taking them,/reel/video/p0c5mwdb/the-truth-about-supplements-and-who-should-be-taking-them,,
What it's like to go clubbing in an abandoned Ikea?,/news/entertainment-arts-67273621,Entertainment & Arts,"A new 15,000-capacity clubbing space has opened in what was formerly Ikea's flagship UK store."
Cough syrup maker boss jailed after child deaths,/news/business-67294106,Business,
AI bot 'capable of covering up illegal trading',/news/technology-67302788,Technology,
"Maersk cuts 10,000 jobs as shipping demand falls",/news/business-67307248,Business,
Boom in unusual jellyfish spotted in UK waters,/news/science-environment-67301074,Science & Environment,
How to Have Sex: The film tackling consent head-on,/news/entertainment-arts-67203958,Entertainment & Arts,
"Storms, singing and silence: Photos of the week",/news/in-pictures-67308202,In Pictures,
Damage and disruption: Storm Ciarán in pictures,/news/in-pictures-67298061,In Pictures,
"Clouds, crowns and crews: Africa's top shots",/news/world-africa-67295807,Africa,
Elton John photography collection to go on display,/news/uk-england-london-67205468,London,
Skulls and flowers: Mexico's 'skeleton' parade,/news/in-pictures-67193453,In Pictures,
Steely gaze of endangered tigress tops mangrove photo awards,/news/in-pictures-67155632,In Pictures,
