title,href,tag,summary
Wales follows Scotland with measures from Boxing Day,/news/live/uk-59752835,UK,Wales limits size of groups in pubs among other measures and Northern Ireland's ministers are also discussing further action.
Why is there uproar over this driver's jail term?,/news/world-us-canada-59750154,US & Canada,
Carabao Cup quarter-finals build-up & news conferences,/sport/live/football/59739133,Football,
Dozens missing in deadly Myanmar mine landslide,/news/world-asia-59723344,Asia,
Film review: The Matrix Resurrections ★★★☆☆,https://www.bbc.com/culture/article/20211215-film-review-the-matrix-resurrections,Culture,
Five big questions about Trump and the riot,/news/world-us-canada-59703761,US & Canada,The inquiry into the 6 January riot is underway with over 250 interviews conducted and 45 subpoenas issued.
Perfectly preserved dinosaur embryo found in China,/news/world-asia-china-59748281,Science & Environment,Researchers say the fossil is at least 66 million years old and was about to hatch just like a chicken.
BBC team on island ravaged by Super Typhoon Rai,/news/world-asia-59753026,Asia,Take a look at the damage on Siargao Island after a powerful storm kills hundreds in the Philippines.
England given 'kick up the bum' - Wood,/sport/cricket/59754587,Cricket,"England's players had a ""brutally honest chat"" with coach Chris Silverwood after defeat by Australia in the second Ashes Test, says seamer Mark Wood."
Henderson concern over player welfare,/sport/football/59750312,Football,"Liverpool captain Jordan Henderson says he is ""concerned"" that ""nobody really takes player welfare seriously""."
Djokovic still in doubt for Australia,/sport/tennis/59745818,Tennis,Australian Open organisers are still unsure if defending men's champion Novak Djokovic will play at next month's Grand Slam.
The once-popular dogs that vanished,https://www.bbc.com/future/article/20211105-the-bizarre-dog-breeds-time-forgot,Future,The world was once home to a kaleidoscopic array of outlandish dogs
The X-rated 70s film that still shocks,https://www.bbc.com/culture/article/20210802-why-x-rated-masterpiece-the-devils-is-still-being-censored,Culture,Why erotic horror masterpiece The Devils is still being censored
"The US' lost, ancient megacity",https://www.bbc.com/travel/article/20210412-the-us-lost-ancient-megacity,Travel,"At its peak, it was larger than Paris"
The explosive mystery hidden under northern Russia,/reel/video/p097w5p3/the-mystery-of-siberia-s-exploding-craters,,
An ingenious way to run faster,/reel/video/p09r61yk/an-ingenious-way-to-run-faster,,
The prehistoric stone circles baffling experts,/reel/video/p0bbrfm1/the-mysteries-of-portugal-s-7-000-year-old-stonehenge-,,
Why being rich is no longer glamorous,https://www.bbc.com/culture/article/20211215-succession-and-the-rich-on-tv-have-we-stopped-ogling-wealth,Culture,"From Succession to The White Lotus, the TV shows refusing to idolise wealth"
The Christmas rituals under threat,https://www.bbc.com/future/article/20211206-how-climate-change-has-altered-christmas,Future,How the climate crisis hit one of the world's favourite celebrations
A world heritage city of tolerance,https://www.bbc.com/travel/article/20211213-as-salt-the-middle-easts-city-of-tolerance-and-generosity,Travel,Interfaith harmony is what makes As-Salt so special
Why bosses still want us in the office,https://www.bbc.com/worklife/article/20210604-why-presenteeism-always-wins-out-over-productivity,Worklife,Bosses still cling to outdated notions of presenteeism – why?
The 'real' Scrooge who inspired Charles Dickens,https://www.bbc.co.uk/programmes/articles/4y78YB9vVMG1xYrW8CmzjPw/a-life-wasted-who-was-the-real-ebenezer-scrooge,Arts,Where did Charles Dickens get the idea for curmudgeonly old miser Ebenezer Scrooge?
Save time with shortcut Christmas recipes,https://www.bbc.co.uk/food/collections/shortcut_christmas_recipes,Food,There's no shame in cheating with these delicious recipes
13 of the strangest concept cars,https://www.topgear.com/car-news/best-2021/here-are-strangest-concept-cars-you-might-not-know-about,Top Gear,Some of the weirdest concept cars you might not know about
The new use for abandoned oil rigs,/future/article/20210126-the-richest-human-made-marine-habitats-in-the-world,,
The sector behind a third of our waste,/future/article/20211215-the-buildings-made-from-rubbish,,
The new weapon against climate change,/future/article/20211207-the-legal-battle-against-climate-change,,
"Cancel culture could wipe out comedy, says Lipman",/news/entertainment-arts-59703257,Entertainment & Arts,The actress says comedians fear being cancelled as a poll finds Britons often censor their opinions.
Inside the clinic helping game-addicted teens,/news/technology-59744569,Technology,
Mother seals 'tune in' to pup's voice,/news/science-environment-59744280,Science & Environment,
"CEO Secrets: 'Don't overthink, fail fast'",https://www.bbc.co.uk/news/av/business-59654421,Business,
European nations reinstate Covid restrictions,/news/world-europe-59747689,Europe,
Israel plans to give fourth Covid-19 vaccine dose,/news/world-middle-east-59749967,Middle East,
Europe spat will weaken research - science leaders,/news/science-environment-59729638,Science & Environment,
In pictures: Seven days of isolation,/news/in-pictures-59740104,In Pictures,
'Ghost rainbows' thrill coastal weather watchers,/news/uk-england-norfolk-59728244,Norfolk,
Night drone captures pre-Christmas town splendour,/news/uk-england-norfolk-59680508,Norfolk,
'Competition celebrates best wildlife in county',/news/uk-england-essex-59653351,Essex,
US photographer Sally Mann wins Prix Pictet award,/news/in-pictures-59682234,In Pictures,
