title,href,tag,summary
Family of killed black jogger angry over plea deal,/news/60201894,Home,US prosecutors may have reached a plea deal in federal hate crimes charges in Ahmaud Arbery case.
Trudeau calls trucker protest 'insult to truth',https://www.bbc.com/news/world-us-canada-60202050,Canada,
Publisher apologises over Anne Frank book,https://www.bbc.com/news/world-europe-60204868,Europe,
The tiny nation fighting disinformation,https://www.bbc.com/future/article/20220128-the-country-inoculating-against-disinformation,Future,
The tussle over location-based pay,https://www.bbc.com/worklife/article/20220127-location-based-salary,Worklife,
Johnson grilled by MPs after Gray finds 'failures of leadership',/news/live/uk-politics-60147988,UK Politics,"The PM says he is sorry after a report into parties in Downing Street finds behaviour that ""is difficult to justify"" as the Met Police investigate 12 events."
Chinese New Year of Tiger,/news/60198659,Reality Check,More than a billion people are celebrating the Chinese New Year.
Cheslie Kryst: Former Miss USA dead at 30,/news/world-us-canada-60173504,US & Canada,"Attorney, TV personality and pageant winner Cheslie Kryst is believed to have taken her own life"
"Transfer deadline day latest: Ramsey set for Rangers, Everton sign De Beek and want Alli & Aubameyang close to Barca move",/sport/live/football/60140816,Football,Follow live text updates as the January transfer window closes across Europe.
Deadline-day done deals as they happen,/sport/football/60193035,Football,Check out all the done deals on transfer deadline day.
Barca agree Aubameyang free transfer,/sport/football/60186125,Football,Pierre-Emerick Aubameyang will have a medical at Barcelona after the club agreed a free-transfer signing from Arsenal.
How ancient food was more nutritious than what we eat now,/reel/video/p0bfh31s/why-we-should-care-about-what-our-food-eats,,
The surprising trick to boost your sex appeal,/reel/video/p09jg3zy/why-we-re-so-attracted-to-the-non-conformists,,
Why did the Templars mark this mysterious spot on the map?,/reel/video/p08q45rj/why-did-the-templars-mark-this-mysterious-spot-on-the-map-,,
The artists fighting racism,https://www.bbc.com/culture/article/20220128-black-british-experience-laid-bare,Culture,How the stark reality of Caribbean-British life has been reflected in art
The meats that are hard to make vegan,https://www.bbc.com/future/article/20220127-the-reason-some-vegan-alternatives-dont-taste-like-meat,Future,"Some of the qualities that make meat ""meaty"" are hard to reproduce."
Why people settle for romantic partners,https://www.bbc.com/worklife/article/20220124-why-people-arent-as-picky-in-love-as-they-think,Worklife,The surprising truth about how we pursue relationships
North Africa's ancient convenience food,https://www.bbc.com/travel/article/20220130-bsissa-north-africas-newest-breakfast-trend,Travel,It's becoming increasingly popular as a health food
Iguanas fall from trees as cold snap hits Florida,https://www.bbc.com/news/world-us-canada-60090861,US,Warnings are issued as unusually cold temperatures in the US state cause the lizards to freeze
"'Winning £127,000 was the worst day of my life'",https://www.bbc.com/news/health-60152759,Health,A campaign is launched to support women at risk of harmful gambling
Is Nadal the greatest male tennis player?,https://www.bbc.com/sport/tennis/60183689,Tennis,Rafael Nadal won in Melbourne to land his 21st major title
How a desert city holds back its sand,/future/article/20220125-how-dubai-is-pushing-back-its-encroaching-deserts,,
The 'outrageous' green plan for coal,/future/article/20220118-the-environmental-case-for-buying-a-coal-mine,,
The rhino that became an icon for peace,/future/article/20220111-the-rhinos-bringing-peace-in-india,,
EastEnders' Dr Legg actor Leonard Fenton dies,/news/entertainment-arts-60197349,Entertainment & Arts,He played Dr Harold Legg and appeared in the first episode of the long-running BBC soap.
True story? Lie detection systems go high-tech,https://bbc.co.uk/news/business-60153129,Business,
Scientist's 'once-in-a-lifetime' new insect find,/news/uk-england-cambridgeshire-60154018,Cambridgeshire,
Epic backed by 35 US states in Apple legal rematch,/news/technology-60156679,Technology,
Beijing sees Covid cases spike as Olympics near,/news/world-asia-china-60187630,China,
Period changes after Covid jab are short-lived,/news/health-60139091,Health,
Musk's SpaceX rocket on collision course with moon,/news/science-environment-60148543,Science & Environment,
In Pictures: US cities clear up after big freeze,/news/world-us-canada-60190444,US & Canada,
Photographs capture city's Covid-19 response,/news/uk-england-tyne-60131496,Tyne & Wear,
Africa's top shots: Weighty matters and cartwheels,/news/world-africa-60156013,Africa,
In Pictures: Holocaust Memorial Day,/news/in-pictures-60154892,In Pictures,
Photos show lockdown life for shielding residents,/news/uk-england-tyne-60125941,Tyne & Wear,
