title,href,tag,summary
Russia’s Shoigu in rare North Korea visit,/news/world-asia-66309231,Asia,Russian and Chinese delegations are the first to visit after the country shut borders due to the pandemic.
UK accused of underestimating Russia's Wagner group,https://www.bbc.com/news/uk-66308864,UK,
Speculation rife after China foreign minister removed,https://www.bbc.com/news/world-asia-china-66299379,China,
Women's World Cup: Spain v Zambia,https://www.bbc.com/sport/live/football/65565257,Football,
Who doesn't want a 'lazy girl job'?,https://www.bbc.com/worklife/article/20230725-how-the-lazy-girl-job-took-over-work-tiktok,Worklife,
Deadly Mediterranean wildfires kill more than 40,/news/world-europe-66308728,Europe,"Wildfires have claimed most lives in Algeria, but blazes are also widespread in Greece and Italy."
'It's crazy' - the USA teen living the World Cup dream,/sport/football/66286563,Football,Alyssa Thompson was 14 when she watched the 2019 Women's World Cup final on television at her aunt's house - now the United States forward is playing at the tournament.
US lawmaker in thirst strike over Texas heat law,/news/world-us-canada-66308450,US & Canada,Greg Casar's protest comes ahead of a rule change that will end some protection for outdoor workers.
Transfer latest and pre-season updates with Man City and Spurs in action,/sport/live/football/66305230,Football,"Kylian Mbappe latest, Kyle Walker's Man City future remains uncertain as his side face Bayern Munich in a pre-season friendly, plus more transfer news and gossip."
Spurs owner charged over alleged insider trading,/news/world-us-canada-66274633,US & Canada,British billionaire Joe Lewis is indicted in the US over an alleged insider trading scheme.
Japan on brink of last 16 after beating Costa Rica,/sport/football/66290694,Football,Japan are on the verge of qualifying for the Fifa Women's World Cup round of 16 after a routine win over Costa Rica in Dunedin.
A foodie pilgrimage around Auckland,https://www.bbc.com/travel/article/20230719-best-places-to-eat-in-auckland-according-to-chef-peter-gordon,Travel,"Chef Peter Gordon shares his top food picks for Auckland, one of the Women's World Cup host cities"
'Historic' - the World Cup's first out trans player,https://www.bbc.com/sport/football/66299441,Football,Canadian midfielder Quinn has been helping drive their country's bid for World Cup glory
Spain and Japan eye knockout stages,https://www.bbc.com/sport/football/66269327,Football,Spain and Japan can secure their places in the last 16 of the Women's World Cup on Wednesday
The Oppenheimer dilemma: H-bomb vs A-bomb,/reel/video/p0g2wfwh/the-oppenheimer-dilemma-h-bomb-vs-a-bomb,,
A 'smart' way to improve your sex life,/reel/video/p0g25ht5/a-smart-way-to-improve-your-sex-life,,
Alkaline water: Worth the hype or waste of money?,/reel/video/p0g27l49/is-alkaline-water-good-for-you-,,
The Scottish loch being 'seawilded',https://www.bbc.com/future/article/20230725-seawilding-the-scottish-community-reviving-a-loch,Future Planet,Is it time for rewilding to spread to the oceans?
World's most liveable cities for 2023,https://www.bbc.com/travel/article/20230725-the-worlds-most-liveable-cities-for-2023,Travel,Residents in the top-ranked cities explain why they choose to call it home
The ultimate heroes of children's books,https://www.bbc.com/culture/article/20230724-what-our-childhood-heroes-teach-us,Culture,The fictional outsiders who fight authority are the most memorable – why?
Is it time to end the corporate ladder?,https://www.bbc.com/worklife/article/20230711-a-real-sense-of-chaos-ensued-is-it-time-to-embrace-the-corporate-ladder,Worklife,"As organisations flatten their structures, is less hierarchy always best?"
Why I 'rebuilt' a deadly atomic device,https://www.bbc.com/future/article/20230725-making-the-blue-flash-how-i-reconstructed-a-fatal-atomic-accident,Future,It killed a scientist in the Manhattan Project
"Why fans dress up for Taylor Swift, Beyoncé and Harry Styles",https://www.bbc.com/news/entertainment-arts-66244480,Entertainment & Arts,"As Taylor Swift's UK Eras tour sells out, fans share their outfits for when they see her in concert"
"Rare Apple computer trainers on sale for $50,000",https://www.bbc.com/news/technology-66290382,Technology,The iconic pair were a limited edition made in the 1990s only for employees
What if we stopped all fishing?,/future/article/20230721-what-would-happen-if-we-stopped-fishing,,
How Texas is heat-proofing its cities,/future/article/20230714-how-texas-is-fighting-back-against-heatwaves,,
The ancient Chinese way to cool homes,/future/article/20230712-how-ancient-skywells-are-keeping-chinese-homes-cool,,
S Club release new single in tribute to Paul,/news/entertainment-arts-66304106,Entertainment & Arts,These Are The Days has been released three months after the death of Paul Cattermole.
Er...Twitter left with half a sign as police arrive,/news/technology-66300107,Technology,
In Pictures: Wildfires in Greece,/news/in-pictures-66289156,In Pictures,
Deborah Meaden: 'Climate problem is here and now',https://www.bbc.co.uk/news/business-66293289,Business,
July heat near 'impossible' without climate change,/news/science-environment-66289489,Science & Environment,
Surge in ill health will have major impact on NHS,/news/health-66295170,Health,
Hugh Grant role criticised by actor with dwarfism,/news/uk-england-derbyshire-66302072,Derby,
See Africa unmasked through its own lens,/news/world-africa-66257772,Africa,
In pictures: A dramatic 24 hours in politics,/news/in-pictures-66268013,In Pictures,
Whistle-blowers and rainbows: Africa's top shots,/news/world-africa-66256175,Africa,
In pictures: Europe's scorching heatwave,/news/in-pictures-66226313,In Pictures,
Hilarious pictures of pets in comedy photographs,/newsround/66210126,Newsround,
