title,href,tag,summary
Militia leader sentenced to 18 years for Capitol riot,/news/world-us-canada-65651998,US & Canada,"Oath Keepers founder Stewart Rhodes gets the longest sentence yet for his part on January 6, 2021."
Petito family release 'burn after reading' letter,https://www.bbc.com/news/world-us-canada-65678974,US,
Doctor faces hearing over story of child's abortion,https://www.bbc.com/news/world-us-canada-65714672,US,
A drive into the 'cradle of civilisation',https://www.bbc.com/travel/article/20230524-a-road-trip-across-the-cradle-of-civilisation,Travel,
Will lentil pasta replace wheat pasta?,https://www.bbc.com/future/article/20230524-are-flours-made-with-pulses-better-for-us,Future,
New superbug-killing antibiotic discovered using AI,/news/health-65709834,Health,"The drug can target one of the three most dangerous bacterial superbugs, say researchers."
Biden names history-making pilot as top US general,/news/world-us-canada-65692015,US & Canada,"Gen Brown would become the first black joint chiefs chairman in three decades, after Colin Powell."
"'What did I do?' Boy, aged 11, shot by police",/news/world-us-canada-65692016,US & Canada,Aderrien Murry has been released from hospital and is recovering from his injuries.
Premier League: Man Utd 2-0 Chelsea - hosts set for Champions League,/sport/live/football/65448502,Football,Follow live score & text updates as Manchester United host Chelsea with United needing one point to secure a top-four finish.
'Mikel was born a manager' - the nature and nurture of Arteta,/sport/football/65646318,Football,"Moulded by La Masia, forged by the Old Firm, now celebrated in north London. Mikel Arteta's long journey was always focused on one destination: the top."
Hamilton and Mercedes close to agreeing new deal,/sport/formula1/65713386,Formula 1,"Lewis Hamilton says he has not been in talks with Ferrari, adding he and Mercedes are close to a deal to keep him at the team beyond this season."
The number one children's book revealed,https://www.bbc.com/culture/article/20230522-where-the-wild-things-are-the-best-childrens-book-ever,Culture,Why the book that tops BBC Culture's poll holds such appeal 60 years on
The 100 greatest children's books - the list in full,https://www.bbc.com/culture/article/20230522-the-100-greatest-childrens-books-of-all-time,Culture,BBC Culture polled 177 books experts from 56 countries to find the greatest children's books
The dark side of Roald Dahl,https://www.bbc.com/culture/article/20160912-the-dark-side-of-roald-dahl,Culture,Why children around the world adore the author's macabre world
The surprising pitfalls of the most common career advice,/reel/video/p0fq5w2r/graduation-the-surprising-pitfalls-of-your-passions,,
The secret tunnel that saved a besieged city,/reel/video/p0fq0wgn/the-secret-tunnel-that-saved-a-besieged-city,,
Why do we find gold so mesmerising?,/reel/video/p0f1b3cz/why-do-we-value-gold-so-much-,,
The profile of an 'ideal' job candidate,https://www.bbc.com/worklife/article/20230522-how-the-perfect-job-candidate-has-changed,Worklife,Why recruiters aren't necessarily requiring a pedigree and hard skills now
The power of Cannes hit How to Have Sex,https://www.bbc.com/culture/article/20230524-how-to-have-sex-and-the-cannes-films-showing-sexual-assault-is-still-endemic,Culture,How the film is one of many festival entries zoning in on predatory behaviour
Why El Niño may cost the US billions,https://www.bbc.com/future/article/20230525-what-will-an-el-nino-in-2023-mean-for-you,Future,The arrival of an El Niño late in 2023 could affect food prices and the economy
The Chinese BBQ luring millions,https://www.bbc.com/travel/article/20230523-the-chinese-bbq-luring-millions,Travel,The city of Zibo is at the centre of a social media frenzy
"France destroys 35,000 'champagne' soda bottles",https://www.bbc.com/news/world-europe-65707792,Europe,"The ""bright orange liquid"" infringes laws protecting sparkling wine from the French region"
Deep-sea mining hotspot teems with mystery animals,https://www.bbc.com/news/science-environment-65708806,Science & Environment,"Thousands of ""otherworldly"" animals live beneath the ocean in an area that may be mined for metals"
'My brother saved my life - but lost his own',https://www.bbc.com/news/world-europe-65626413,Europe,"Maksym saved Ivan's life in Bakhmut, then stayed to lead their men"
Where the sound of nature is too quiet,/future/article/20230519-the-sound-recordings-used-to-coax-back-species,,
Lebanon's unexpected solar boom,/future/article/20230517-how-solar-power-is-keeping-lebanons-lights-on,,
The 1968 photo that changed the world,/future/article/20230511-earthrise-the-photo-that-sparked-an-environmental-movement,,
How Tina Turner 'broke the silence' on domestic abuse,/news/entertainment-arts-65673196,Entertainment & Arts,The singer's decision to reveal the details of her violent marriage still helps inspire other women.
The chip maker that became an AI superpower,https://www.bbc.co.uk/news/business-65675027,Business,
Branson's rocket plane returns to spaceflight,/news/science-environment-65714340,Science & Environment,
High lead and nickel levels found in illegal vapes,/news/health-65614078,Health,
Government defends oil boss to head climate talks,/news/science-environment-65708328,Science & Environment,
ChatGPT-maker warns it might leave EU over AI law,/news/technology-65708114,Technology,
Tina Turner: A life in pictures,/news/entertainment-arts-65669988,Entertainment & Arts,
Ray Stevenson's film and TV career in pictures,/news/entertainment-arts-65679323,Entertainment & Arts,
Picnics and blooms: The Chelsea Flower Show in pictures,/news/in-pictures-65669737,In Pictures,
"Showers, shopping and soccer: The best of British press photography",/news/in-pictures-65645239,In Pictures,
"Dancers, divers and film-makers: Africa's top shots",/news/world-africa-65622722,Africa,
Slurping Spaghetti and other food photo contest winners,/news/in-pictures-65549869,In Pictures,
