title,href,tag,summary
Hollywood icon Sidney Poitier dies aged 94,/news/entertainment-arts-59907931,Entertainment & Arts,"The US-Bahamian star was the first black man to win a best actor Oscar, and also a humanitarian."
'Like something from an apocalypse film',/news/world-asia-59912794,Asia,
"Australia extend lead after England bowled out for 294 - Ashes clips, radio & text",/sport/live/cricket/57164765,Cricket,
Ahmaud Arbery killers to serve life in prison,/news/world-us-canada-59912361,US & Canada,
Bitcoin prices fall to lowest in months,/news/technology-59907864,Technology,
Canada party plane 'idiots' fly home to face music,/news/world-us-canada-59917300,US & Canada,"The group of fun-loving travellers have been branded ""barbarians"" by Prime Minister Justin Trudeau."
Supreme Court scrutinises Biden's vaccine mandates,/news/world-us-canada-59916467,US & Canada,The eventual ruling by the court could have an impact on some 80 million workers.
Truck spends three days dangling over China cliff,/news/world-asia-china-59906706,China,The driver is said to have tried to reverse on a narrow mountain road.
Covid-hit Man City too strong for Swindon,/sport/football/59911307,Football,Covid-19-hit Manchester City brush aside League Two Swindon Town to reach the FA Cup fourth round.
Djokovic thanks fans amid row over vaccination,/news/world-australia-59912704,Australia,The men's tennis star is awaiting a decision on his deportation from Australia over a vaccination row.
Salah and Kerr on Best Fifa shortlists,/sport/football/59913891,Football,Liverpool forward Mohamed Salah and Chelsea striker Sam Kerr are among the Best Fifa Football Awards' player of the year nominees.
What existed before the Big Bang?,https://www.bbc.com/future/article/20220105-what-existed-before-the-big-bang,Future,Where did the material that forms the Universe come from?
The incredible show you missed in 2021,https://www.bbc.com/culture/article/20211223-why-the-north-water-is-the-best-tv-series-you-missed-in-2021,Culture,"Why the brutal, one-of-a-kind period drama The North Water deserves attention"
The frothy drink that unified a nation,https://www.bbc.com/travel/article/20220104-teh-tarik-malaysias-frothy-national-drink,Travel,"Pouring it is a theatrical, gravity-defying display"
Who is the one man that Putin fears the most?,/reel/video/p0bftt7v/inside-the-social-media-empire-of-a-kremlin-critic,,
Why this man believes he will live to 180 years old,/reel/video/p093919p/can-science-reverse-the-ageing-process-,,
A marvel of engineering in the world's highest mountain range,/reel/video/p0bf49jv/a-close-look-at-the-highest-railway-bridge-in-the-world,,
The UK's most challenging road?,https://www.bbc.com/travel/article/20211213-the-hardknott-pass-britains-wildest-road,Travel,Should this extraordinary pass be closed or treated as a national treasure?
Are Gen Z the most pragmatic about sex?,https://www.bbc.com/worklife/article/20220104-are-gen-z-more-pragmatic-about-love-and-sex,Worklife,"Why younger people aren't ""committed to being committed"""
22 films to watch in 2022,https://www.bbc.com/culture/article/20220106-22-films-to-watch-in-2022,Culture,Including The Batman and a Buzz Lightyear origin story
Why we're in 'the age of fake islands',https://www.bbc.com/future/article/20220105-why-were-in-the-age-of-artificial-islands,Future,A visual tour of humanity's bold attempts to create artificial land
The big question for lithium batteries,https://www.bbc.com/future/article/20220105-lithium-batteries-big-unanswered-question,Future Planet,Time is growing short to figure out how to recycle lithium batteries effectively
News quiz: What was 007's New Year Honour?,https://www.bbc.com/news/world-59884655,World,How closely have you been paying attention to the headlines?
Why you don't need to go on a 'sugar detox',https://www.bbc.co.uk/food/articles/sugar_detox,Food,"Sugar is the simplest form of energy our body uses, but it’s somehow the most complicated"
The new use for abandoned oil rigs,/future/article/20210126-the-richest-human-made-marine-habitats-in-the-world,,
The sector behind a third of our waste,/future/article/20211215-the-buildings-made-from-rubbish,,
The new weapon against climate change,/future/article/20211207-the-legal-battle-against-climate-change,,
Ladbrokes £102m furlough claim despite online lift,/news/business-59900249,Business,Entain revenues rose in the pandemic as online betting made up for trade lost at betting shops.
Grange Hill movie to take a look at Britain now,/news/entertainment-arts-59907925,Entertainment & Arts,
Colour-changing cars and remotes that eat wi-fi,/news/technology-59895079,Technology,
"Deadly Omicron should not be called mild, warns WHO",/news/world-59901547,World,
Kew scientists name new tree after Leonardo DiCaprio,/news/science-environment-59888755,Science & Environment,
"No need for a fourth Covid jab yet, say UK advisers",/news/health-59915560,Health,
Farmers could be paid for post-Brexit land changes,/news/science-environment-59886350,Science & Environment,
Africa's top shots: Trumpeting Tutu and the New Year,/news/world-africa-59896920,Africa,
In pictures: Orthodox Christians celebrate Christmas,/news/in-pictures-59907964,In Pictures,
Astronomer hones star photo skills in lockdown,/news/uk-england-cambridgeshire-59820361,Cambridgeshire,
Photographer captures unique bird spoon image,/news/world-middle-east-59748062,Middle East,
Legend of street photography Sabine Weiss dies at 97,/news/world-europe-59816052,Europe,
