title,href,tag,summary
Ukrainians told to flee eastern region immediately,/news/live/world-europe-61032786,Europe,"The governor of Luhansk urges civilians to leave, saying Russian forces are ""amassing for an offensive""."
Johnson travels to Kyiv for Zelensky talks,/news/uk-61052643,UK,
Inside Chernobyl: We stole Russian fuel to prevent disaster,/news/world-europe-61048256,Europe,
"Premier League: Chelsea thrash Saints 6-0, Leeds and Brighton both win",/sport/live/football/60515216,Football,
Imran Khan on brink as confidence vote looms,/news/world-asia-61047585,Asia,
FBI's Michigan governor kidnap plot case collapses,/news/world-us-canada-60999431,US & Canada,Jurors acquit two of the defendants and fail to reach a verdict on two others.
'This means the world for every little black girl',/news/world-us-canada-61018765,US & Canada,Black female law students celebrate a historic confirmation to the US Supreme Court.
Katty Kay: The most exciting thing about becoming Swiss,/news/world-us-canada-61033126,US & Canada,My new passport means I can vote for the first time in years - it's never been as important as now.
Grand National: Tension building for big race - radio & text,/sport/live/horse-racing/59813720,Horse Racing,Follow live radio and text commentary from the 174th Grand National at Aintree.
Rampant Chelsea hit Southampton for six,/sport/football/60963798,Football,Chelsea put a terrible week behind them to return to winning ways in devastating style as they score four times in the opening 31 minutes against Southampton.
Everton beat Man Utd to boost survival hopes,/sport/football/60963791,Football,Everton claim a vital win in their battle to stay in the Premier League as Anthony Gordon's deflected strike beats Manchester United.
"The entry-level workers making $100,000",https://www.bbc.com/worklife/article/20220401-the-entry-level-workers-earning-six-figure-salaries,Worklife,"In some sectors, new graduates are on six-figure salaries many people never hit"
How Earth will look in 200 million years,https://www.bbc.com/future/article/20220401-how-the-next-supercontinent-will-form,Future,What will happen when the world reassembles
TV shows to watch in April,https://www.bbc.com/culture/article/20220401-13-of-the-best-tv-shows-to-watch-this-april,Culture,Including the return of Derry Girls and a new show from The Wire's creator
The sex scandal that rocked the core of the Murdoch empire,/reel/video/p0bzxfjf/one-of-america-s-most-infamous-sex-scandals,,
The incredible transgender spy who fascinated 18th Century Europe,/reel/video/p0bzwxqy/the-chevalier-d-on-the-18th-century-transgender-spy,,
Why a forgotten 90s car should have changed the world,/reel/video/p0bkrk32/how-an-electric-car-dream-was-crushed,,
An icy mystery deep in Arctic Canada,https://www.bbc.com/travel/article/20220403-an-icy-mystery-deep-in-arctic-canada,Travel,"It's known as the ""Crystal Eye"" to the Inuit"
The big 'single shaming' problem,https://www.bbc.com/worklife/article/20220405-single-shaming-why-people-jump-to-judge-the-un-partnered,Worklife,Why the stigma that singletons will 'find their person soon' endures
The 14 best books of the year so far,https://www.bbc.com/culture/article/20220407-the-best-books-of-the-year-2022,Culture,"Thrillers, essays and family sagas are among the BBC Culture picks"
How to escape from modern life,https://www.bbc.com/culture/article/20220404-what-makes-the-perfect-escapist-retreat,The Collection,How ultra-escapist retreats around the world offer sanctuary from modern life
'I was diagnosed autistic at 60',https://www.bbc.com/future/article/20220405-the-life-changing-diagnosis-of-autism-in-later-life,Future,One doctor said I was the oldest diagnosis he'd ever come across
Weekly quiz: What was named song of the year?,https://www.bbc.com/news/world-61026335,World,How closely have you been paying attention to this week's headlines?
What’s the best oil to use for cooking?,https://www.bbc.com/food/articles/best_oils,Food,What are the best alternatives to problematic oils?
The world's most polluted capital city,/future/article/20220405-the-fungi-cleaning-new-delhis-air,,
The mangrove that defied destruction,/future/article/20220329-how-a-caribbean-community-restored-its-dying-mangrove,,
The alternatives to Russia's gas,/future/article/20220324-how-biogas-can-help-europe-cut-russian-gas,,
Will Smith banned from Oscars for 10 years,/news/world-us-canada-61018821,US & Canada,The Academy voted on Friday to sanction Smith after he slapped Chris Rock at the awards show.
Scientists rejuvenate skin cells by 30 years,/news/science-environment-60991675,Science & Environment,
Amazon secures rockets for broadband project,/news/technology-61009163,Technology,
Thousands have PTSD symptoms after miscarriage,/news/health-60941650,Health,
Why France's daily baguette is costing so much dough,https://www.bbc.co.uk/news/business-61015290,Business,
First all-private crew launches to space station,/news/science-environment-61044759,Science & Environment,
Harry Styles unseats Dave at the top of the charts,/news/entertainment-arts-61043741,Entertainment & Arts,
"Pandas, protests and other photos from this week",/news/in-pictures-61038961,In Pictures,
Memorial to lost children wins global photo contest,/news/in-pictures-61014501,In Pictures,
"Africa's top shots: Prayers, pastries and portraits",/news/world-africa-61021573,Africa,
Bird family sets up home in photographer's bicycle,/news/uk-england-derbyshire-61015521,Derby,
In pictures: Behind the shop facade,/news/in-pictures-60905538,In Pictures,
