title,href,tag,summary
Extremist under surveillance stabs six in New Zealand,/news/world-asia-58405213,Asia,Videos circulating online show panicked shoppers running out of the Countdown supermarket at LynnMall.
Storm Ida kills dozens across US north-east,/news/world-us-canada-58429853,US & Canada,
Afghan boy who ate wild mushrooms dies in Poland,/news/world-europe-58421631,Europe,
"Tokyo Paralympics: Three golds so far for GB on day 10, plus Reid & Hewett in doubles final",/sport/live/disability-sport/55509737,Disability Sport,
The mysterious tunnel found in Wales,https://www.bbc.com/travel/article/20210902-the-mysterious-medieval-tunnel-found-by-accident,Travel,
Flash floods cause New York City state of emergency,/news/world-us-canada-58418627,US & Canada,"NYC Mayor Bill de Blasio said the city was ""enduring an historic weather event""."
How Europe's relationship with Joe Biden turned sour,/news/world-europe-58416848,Europe,"In many EU circles, the honeymoon period for Donald Trump's successor may be coming to an end."
Clashes as Taliban attack holdout Afghan valley,/news/live/world-58279900,World,Thousands of Taliban take on resistance forces in the last province resisting the Islamist takeover.
World Cup qualifying reaction,/sport/live/football/58431603,Football,"Reaction as England and Northern Ireland claim big World Cup qualifying wins, plus other football news."
GB win three golds and pass 100-medal mark - day 10 so far,/sport/disability-sport/58431290,Disability Sport,Great Britain win golds in canoeing and athletics and pass the 100-medal mark on day 10 at the Tokyo Paralympics.
Teenage boxer dies days after knockout,/sport/boxing/58432013,Boxing,"Mexican welterweight boxer Jeanette Zacarias Zapata, 18, dies five days after being knocked out in a fight."
How pirates destroyed the capital of the Roman slave trade,/reel/video/p09tvctz/how-pirates-destroyed-the-capital-of-the-roman-slave-trade,,
Why Swedes won't talk about wealth,/reel/video/p07qgx5d/jantelagen-why-swedes-won-t-talk-about-wealth,,
The surprising truth about eating eggs,/reel/video/p08ngz2r/the-truth-about-eating-eggs,,
Why emails always seem negative,https://www.bbc.com/worklife/article/20210830-why-emails-often-read-more-negative-than-they-actually-are,Worklife,How 'negative intensification bias' makes innocent messages feel offensive
How the future was predicted in 1921,https://www.bbc.com/culture/article/20210902-the-100-year-old-fiction-that-predicted-today,Culture,"The parallel lives of two cult authors, whose work still resonates 100 years on"
The Asian capital you've never heard of,https://www.bbc.com/travel/article/20210901-putrajaya-the-capital-city-youve-never-heard-of,Travel,It's located in the shadow of one of the world's most-visited cities
How our digits reveal our nationalities,https://www.bbc.com/future/article/20210902-how-finger-counting-gives-away-your-nationality,Future,Could other cultures have a better way to count on their fingers?
The implications of Supreme Court’s abortion ruling,https://www.bbc.com/news/world-us-canada-58426145,US,The court's refusal to block a Texas law that bans abortions for most women will be felt across the...
"The 9,000 child abuse cases filed decades late",https://www.bbc.com/news/world-us-canada-58322592,US & Canada,Thousands of child sex abuse claims have been filed thanks to a change in New York law
Do Abba's new songs live up to their hits?,https://www.bbc.com/news/entertainment-arts-58423458,Entertainment & Arts,The band have released their first new music since 1982 - but is it a hit or a miss?
Can investors save the Amazon?,/future/article/20210825-can-investors-save-the-amazon,,
The controversial plan to rewild death,/future/article/20210817-rewilding-death-germanys-plan-to-restore-the-necrobiome,,
The ancient Persian way to keep cool,/future/article/20210810-the-ancient-persian-way-to-keep-cool,,
"Food production in the UK at risk, warns industry",/news/business-58425516,Business,"A retail group says shortages of drivers and other staff mean the sector is ""just on the edge of..."
Ex-BBC employee reports alleged fashion sex assault,/news/entertainment-arts-58425154,Entertainment & Arts,
Global warming linked to colder winters in the US,/news/science-environment-58425526,Science & Environment,
Coronavirus vaccine halves risk of long Covid,/news/health-58410354,Health,
WhatsApp issued second-largest GDPR fine,/news/technology-58422465,Technology,
Climate-above-all plea by US fails to stir China,/news/world-asia-58427519,Asia,
Discarded festival tents to be sent to refugees,/news/uk-england-berkshire-58424375,Berkshire,
"Africa's top shots: Power, prayer and pig masks",/news/world-africa-58420508,Africa,
A singing baboon and a giggling seal,/news/in-pictures-58402306,In Pictures,
Majestic birds caught by the camera,/news/in-pictures-58396228,In Pictures,
Hurricane Ida: Before and after images,/news/world-us-canada-58409267,US & Canada,
The best of British press photography,/news/in-pictures-58392452,In Pictures,
