title,href,tag,summary
US avoids government shutdown in last-minute deal,/news/world-us-canada-66973976,US & Canada,President Biden signs a bill to keep the government funded for 45 days - but Ukraine aid is not included.
Congressman set off fire alarm ahead of vote,/news/world-us-canada-66975448,US & Canada,
Nightclub fire in south-eastern Spain kills 11,/news/world-europe-66976171,Europe,
Suicide bomb attack targets Turkey ministry,/news/world-europe-66975452,Europe,
"Ryder Cup: Europe make fast start, needing four more points for win",/sport/live/golf/66894042,Golf,
Populist pro-Moscow party wins Slovak vote,/news/world-europe-66972984,Europe,"Former PM Robert Fico, who opposes military support for Ukraine, will try to form a government."
Tiny Caribbean island’s incredible eco transformation,/news/world-latin-america-66922735,Latin America & Caribbean,"Once a desolate rock, the island of Redonda is now a protected area bursting with biodiversity."
Bears versus robot wolves in ageing Japan,/news/world-asia-66737051,Asia,"As bear attacks rise in Japan's sparsely populated villages, robot wolves have become a solution."
Premier League: Nottingham Forest v Brentford - radio & text,/sport/live/football/66509777,Football,Follow live text & BBC Radio 5 Live commentary as Nottingham Forest host Brentford in the Premier League at the City Ground.
Alvarez beats Charlo to retain undisputed title,/sport/boxing/66972135,Boxing,Saul 'Canelo' Alvarez defends his undisputed super-middleweight title by beating Jermell Charlo on points in Las Vegas.
PGMOL replaces official England after Liverpool error,/sport/football/66976232,Football,Darren England is replaced as the fourth official for Sunday's match between Nottingham Forest and Brentford after his VAR error during Liverpool's defeat at Tottenham.
Six of the year's most striking images,https://www.bbc.com/culture/article/20230925-trumps-mugshot-to-burning-man-six-of-the-most-striking-images-of-2023,Culture,The photos that shocked or moved us so far this year
Space travel's heavy toll on health,https://www.bbc.com/future/article/20230927-what-a-long-term-mission-in-space-does-to-the-human-body,Future,Astronaut Frank Rubio spent 371 days in space – what affect will it have on him?
The return of a divisive lingerie brand,https://www.bbc.com/culture/article/20230926-can-victorias-secret-fix-its-image,Culture,A new film aims to re-cast the famous lingerie brand's problematic image
How I rewired my brain in six weeks,/reel/video/p0ggy0fn/how-i-rewired-my-brain-in-six-weeks,,
The world's quickest electric vehicle,/reel/video/p0gh2kvj/the-world-s-quickest-electric-vehicle,,
The unsolved problem as urgent as climate change,/reel/video/p0gfyls0/are-we-at-the-brink-of-a-bug-pocalypse-,,
A sci-fi with a 'shocking twist',https://www.bbc.com/culture/article/20230929-foe-review-sci-fi-thriller-starring-saoirse-ronan-and-paul-mescal-is-endlessly-engaging,Culture,Psychological thriller evokes the sense of apocalypse slowly creeping up on us
The man who transformed a barren island,https://www.bbc.com/travel/article/20230926-lady-elliot-island-a-paradise-island-where-you-make-a-pledge,Travel,It's one of the best places in the world to swim with manta rays
"A 2,000-year-old method to water crops",https://www.bbc.com/future/article/20230922-the-ancient-sri-lankan-tank-cascade-systems-tackling-drought,Future,How an ancient hydraulic system is harvesting rainwater
US auto strike: Eye-popping CEO pay,https://www.bbc.com/worklife/article/20230925-uaw-auto-strike-why-us-automotive-ceos-make-more-than-global-competition,Worklife,Why American executives earn so much more than their global counterparts
He admitted to abducting politicians - but a Swiss court acquitted him,https://www.bbc.com/news/world-europe-66865795,Europe,A Belarusian is released despite giving a detailed account of disappearing opposition members
The pioneering woman surfer in a sea of men,https://www.bbc.com/news/uk-wales-66593450,UK,"Linda Sharp made her own wetsuit out of rubber gloves, a rugby shirt and jeans when she started"
Danny Robins: Paranormal activity can bring people comfort,https://www.bbc.com/news/entertainment-arts-66427476,Entertainment & Arts,The Uncanny presenter on how his trawl for ghost stories revealed positive tales among the terror
The goats fighting fires in LA,/future/article/20230922-these-la-goats-help-stop-wildfires,,
The city that went green to keep cool,/future/article/20230922-how-medellin-is-beating-the-heat-with-green-corridors,,
Why heat is a 'silent killer',/future/article/20230918-how-community-maps-can-protect-children-from-extreme-heat,,
Mirren speaks of 'delicate balance' in playing Israeli PM,/news/entertainment-arts-66966705,Entertainment & Arts,The Oscar-winning actor has faced criticism for playing Israel's first female PM Golda Meir in a new...
Sir Michael Gambon: A career in pictures,/news/in-pictures-66950664,In Pictures,
UK economy grew faster than estimated since Covid,/news/business-66957412,Business,
Why finding alien life is now 'only a matter of time',/news/science-environment-66950930,Science & Environment,
Millions wrongly labelled with penicillin allergy,/news/health-66934909,Health,
Apple to buck layoff trend by hiring UK AI staff,/news/technology-66954267,Technology,
Charges over Tupac murder 'pivotal moment',/news/entertainment-arts-66969851,Entertainment & Arts,
Vintage style and bonfires: Africa’s top shots,/news/world-africa-66947006,Africa,
The day sea-dipping elephants stunned a Welsh town,/news/uk-wales-66855122,Wales,
Ploughing: A snapshot of a disappearing skill,/news/uk-england-norfolk-66869691,Norfolk,
Historic scenes for King and Queen on their French visit,/news/in-pictures-66867649,In Pictures,
Adeiladau anghofiedig Cymru // Wales' forgotten buildings,/newyddion/66858159,Cylchgrawn,
