title,href,tag,summary
First foreigners fly out of Kabul since US pull-out,/news/world-asia-58497904,Asia,"Dozens of people, including 13 UK citizens, take a plane from Kabul to Qatar's capital Doha."
Inspirational Afghan robotics team begin new chapter,/news/world-asia-58496148,Asia,
The birth of a new Taliban order,https://www.bbc.co.uk/news/world-asia-58495112,News,
Matrix trailer offers first taste of sci-fi sequel,https://www.bbc.com/news/entertainment-arts-58500875,Entertainment & Arts,
Films showing the reality of marriage,https://www.bbc.com/culture/article/20210907-films-showing-the-reality-of-marriage,Culture,
‘Havana syndrome’ and the mystery of the microwaves,/news/world-58396698,World,"The BBC investigates a mystery illness dubbed ""Havana syndrome"" that has affected American diplomats and spies."
Biden administration challenges Texas abortion law,/news/world-us-canada-58507206,US & Canada,The Texas law effectively bans abortions from as early as six weeks into a pregnancy.
$3m payout for rough arrest caught on camera,/news/world-us-canada-58503095,US & Canada,Bodycam footage shows the moment Colorado City officers detained and injured 75-year-old Karen Garner.
Weird to be in US Open semis - Raducanu,/sport/tennis/58496167,Tennis,"Emma Raducanu says it is a ""weird feeling"" to be one of the few remaining players in the locker room after reaching the US Open semi-finals."
England v India Test set to go ahead,/sport/cricket/58500916,Cricket,The fifth Test between England and India is set to go ahead after no further positive Covid-19 tests were returned by the tourists.
"England rebuild, chasing 145 to win women's T20 series against NZ - clips, TMS & text",/sport/live/cricket/56388806,Sport,"Follow in-play clips, Test Match Special commentary and live text from the third women's Twenty20 international between England and New Zealand at Taunton."
The new discovery that rewrites the story of how we evolved,/reel/video/p09vcnzv/newly-found-ancient-human-rewrites-story-of-evolution,,
A simple exercise that gives your brain an unexpected boost,/reel/video/p09v8wyh/how-squats-can-boost-your-brain,,
How your gut is manipulating you,/reel/video/p09v7djs/the-myth-behind-food-cravings,,
The woman saving Palestinian food,https://www.bbc.com/travel/article/20210908-the-woman-saving-palestinian-heirloom-seeds,Travel,Vivien Sansour is reviving heirloom varietals one seed at a time
Why food insecurity is rising again,https://www.bbc.com/future/bespoke/follow-the-food/the-race-to-improve-food-security/,Follow The Food,Why we still haven't solved global food insecurity
The lost generation of ancient trees,https://www.bbc.com/future/article/20210908-the-lost-generation-of-ancient-trees,Future Planet,When today's veteran trees die they may take entire miniature worlds with them
Is our definition of ambition changing?,https://www.bbc.com/worklife/article/20210906-are-we-becoming-less-ambitious,Worklife,Workers still want professional success – but what that means is evolving
The book that shaped a Nordic identity,https://www.bbc.com/culture/article/20210907-seven-brothers-the-book-that-shaped-a-nordic-identity,Culture,How a story about living in nature captures the spirit of Finland
The clever science behind frozen ramen,https://www.bbc.com/future/article/20210907-the-clever-science-behind-frozen-ramen,Future,The chewy noodles that survive the office microwave
Tube staff warned of anti-mask razor blade posters,https://www.bbc.com/news/uk-england-london-58499899,London,"The Rail, Maritime and Transport (RMT) union says its members are at risk"
Bangladesh's unusual use for oysters,/future/article/20210827-the-unlikely-protector-against-rising-seas-in-bangladesh,,
Can investors save the Amazon?,/future/article/20210825-can-investors-save-the-amazon,,
The controversial plan to rewild death,/future/article/20210817-rewilding-death-germanys-plan-to-restore-the-necrobiome,,
In Pictures: On the red carpet at the NTAs,/news/entertainment-arts-58509115,Entertainment & Arts,Thursday marked the first National Television Awards ceremony since January 2020.
Hubble successor given mid-December launch date,/news/science-environment-58498676,Science & Environment,
Mexico decriminalises abortion in landmark ruling,/news/world-latin-america-58482850,Latin America & Caribbean,
UK to lose spot in Germany's top trading partners,/news/business-58484454,Business,
Facebook reveals video camera glasses,/news/technology-58488235,Technology,
"Fossil fuels must stay underground, scientists say",/news/science-environment-58494391,Science & Environment,
Janey Godley dropped from Covid ads over tweets,/news/uk-scotland-58505151,Scotland,
Turning flies into food for pets - and maybe people,/news/world-africa-58384761,Africa,
Hidden lives of those who call a derelict building home,/news/world-africa-58348750,Africa,
"A community over 50 years and 6,000 photos",/news/uk-england-humber-58422888,Humberside,
"Africa's top shots: Power, prayer and pig masks",/news/world-africa-58420508,Africa,
A singing baboon and a giggling seal,/news/in-pictures-58402306,In Pictures,
