title,href,tag,summary
Fresh evacuation attempt in besieged city Mariupol,/news/live/world-europe-60635927,Europe,Ukrainian officials say they are trying to evacuate trapped civilians via a new route agreed with Russian forces.
"Mariupol: Fires, no water, and bodies in the street",/news/world-europe-60637338,Europe,
Russia attacking schools and hospitals - Ukraine,/news/world-europe-60638042,Europe,
At least 22 injured in Mexico violence,/sport/football/60637196,Football,
Zelensky urges Ukrainians to 'drive this evil out',/news/world-europe-60636337,Europe,
Visa and Mastercard suspend Russian operations,/news/business-60637429,Business,The payments giants are pulling out of the Russian market in protest at its invasion of Ukraine.
"'Ukraine is united, don't be afraid of Putin'",/news/world-europe-60637840,Europe,This couple in Kyiv tells the BBC they are confident that Ukraine will survive Russia's invasion.
Russia's Ukraine war fuels Finnish support for Nato,/news/world-europe-60626536,Europe,President Putin's devastating attack on Ukraine leaves countries in the region worried about their future.
Scottish Premiership: Livingston 0-0 Celtic - will leaders end 15-year wait for win?,/sport/live/football/60561442,Football,Listen to Sportsound and follow live text updates as Livingston take on Scottish Premiership leaders Celtic.
WSL: Watch Arsenal 0-0 Birmingham - will bottom side cause a shock?,/sport/live/football/60354564,Football,"Watch live coverage as Arsenal face Birmingham in the Women's Super League, plus text and radio commentary from Reading v Tottenham."
Tuchel criticises fans' Abramovich chants,/sport/football/60634597,Football,Thomas Tuchel criticises Chelsea supporters' vocal backing for owner Roman Abramovich during their 4-0 win over Burnley at Turf Moor.
A paradise with too many palm trees,https://www.bbc.com/travel/article/20220302-seychelles-bird-island-a-paradise-with-too-many-palm-trees,Travel,Cutting them down had a surprising result
The writer who foresaw the future,https://www.bbc.com/culture/article/20220301-philip-k-dick-the-writer-who-witnessed-the-future,Culture,How sci-fi great Philip K Dick anticipated today's world
The rise of 'solo polyamory',https://www.bbc.com/worklife/article/20220301-does-solo-polyamory-mean-having-it-all,Worklife,"""I felt like monogamy would deny me something of myself"""
The 'shocking' male sacrifice made for a Roman goddess,/reel/video/p0bsfp1y/the-goddess-who-changed-the-course-of-roman-history,,
The deadly toxin found in the world's oldest mummies,/reel/video/p0br366s/life-beyond-death-in-the-driest-place-on-earth,,
Why pleasure is key to losing weight,/reel/video/p0brtrb1/why-pleasure-is-key-to-losing-weight,,
What happens when mindfulness backfires,https://www.bbc.com/worklife/article/20220302-how-mindfulness-can-make-you-a-darker-person,Worklife,"How meditation can derail your ""moral compass"" and make you darker"
Why this iconic monster is so scary,https://www.bbc.com/culture/article/20220303-nosferatu-the-monster-who-still-terrifies-100-years-on,Culture,"How the vampire from silent horror Nosferatu still terrifies, 100 years on"
The best age to learn to read,https://www.bbc.com/future/article/20220228-the-best-age-for-learning-to-read,Future,How early literacy can have lifelong consequences
Is this Britain's 'Atlantis'?,https://www.bbc.com/travel/article/20220227-dunwich-the-british-town-lost-to-the-sea,Travel,Scientists have discovered that it's more than just a legend
How your diet can treat diseases,https://www.bbc.com/future/bespoke/follow-the-food/how-your-diet-can-treat-diseases/,Follow The Food,The food we eat is one of the leading causes of illness
A master chef's tips for a bountiful kitchen garden,https://www.bbc.co.uk/food/articles/marcus_wareing_kitchen_garden,Food,The thought process of the garden chain changes the way you think and cook
'I went from prisoner to PhD',https://www.bbc.com/ideas/videos/i-went-from-prisoner-to-phd/p08mpxtt,Ideas,Stephen Akpabio-Klementowski's extraordinary story of how he transformed his life through education
The puzzle of Mexico's ageing oaks,/future/article/20220222-the-mystery-of-mexicos-vanishing-stream-oaks,,
The animal 'sixth sense' for disaster,/future/article/20220211-the-animals-that-predict-disasters,,
The country embracing life on water,/future/article/20220202-floating-homes-the-benefits-of-living-on-water,,
India TV host yells at wrong man on Ukraine debate,https://www.bbc.com/news/world-asia-india-60614274,India,Rahul Shivshankar only realised his mistake when his perplexed guest spoke up
Microsoft stops selling products in Russia,/news/technology-60621205,Technology,
Director Campion on her thrilling Hollywood comeback,/news/entertainment-arts-60562041,Entertainment & Arts,
Abandoned rocket 'hits the Moon' - scientists,/news/science-environment-60596449,Science & Environment,
The TikToker spreading viral Ukraine war videos,/news/technology-60613331,Technology,
Another life-saving Covid drug identified,/news/health-60601750,Health,
Oxygen stocks running dangerously low in Ukraine,/news/health-60555228,Health,
"Destruction, demos and other photos from this week",/news/in-pictures-60619314,In Pictures,
In pictures: Russia intensifies attacks on Ukraine,/news/in-pictures-60601185,In Pictures,
"Africa's top shots: Bikes, blocks and borders",/news/world-africa-60599941,Africa,
In pictures: Kyiv under attack,/news/in-pictures-60536824,In Pictures,
In pictures: Destruction and fear as war hits Ukraine,/news/in-pictures-60505277,In Pictures,
