title,href,tag,summary
Ukraine conflict settling into 'WW1-style trench warfare',/news/live/world-europe-61701807,Europe,Heavy fighting continues in Donbas with a military analyst saying Russia is struggling to make major gains.
Migrant caravan heads to US as key summit begins,https://www.bbc.com/news/world-us-canada-61685118,US,
Recount due in bid to oust 'last pro-life Democrat',https://www.bbc.com/news/world-us-canada-61569648,US,
The 10 best TV shows of 2022 so far,https://www.bbc.com/culture/article/20220606-the-10-best-tv-shows-of-2022-so-far,Culture,
The double standard of the return-to-office,https://www.bbc.com/worklife/article/20220602-the-double-standard-of-the-return-to-office,Worklife,
Mariupol defenders' bodies in Kyiv - families,/news/world-europe-61723282,Europe,The soldiers' families say they were returned as part of a swap with Russia - 160 bodies on each side.
Pitt says Jolie sought to harm him with vineyard sale,/news/entertainment-arts-61716949,Entertainment & Arts,The actor is suing his ex-wife for selling her stake in the French vineyard they bought together.
Matthew McConaughey: Guns 'a nonpartisan issue',/news/world-us-canada-61726841,US & Canada,"The actor spoke at the White House to advocate for ""responsible gun ownership""."
Nations League: England trail Germany in second half - radio & text,/sport/live/football/59822329,Football,Follow live text and BBC Radio 5 Live commentary as England travel to Germany in the Uefa Nations League.
'My body needs more time' - Woods to miss US Open,/sport/golf/61723195,Golf,"Tiger Woods confirms he will not play at next week's US Open, but still plans to compete at the 150th Open Championship at St Andrews next month."
"'Putin took everything from us, and we just let him'",/sport/football/61681972,Football,Nadya Karpova is one of very few Russian sportspeople to speak out against the war in Ukraine. She does so almost every day.
The secret planet under the Mediterranean,/reel/video/p0c7d16y/the-mediterranean-s-hidden-wonders,,
The tiny Scottish island still inhabited by Vikings,/reel/video/p0cbfd0z/why-the-vikings-never-left-scotland,,
The surprising reality of what it may feel like to die,/reel/video/p0c59rmr/what-does-dying-really-feel-like-,,
How psychedelics might treat depression,https://www.bbc.com/future/article/20220606-psilocybin-how-psychedelic-drugs-might-treat-depression,Future,We are beginning to understand the medical benefits of hallucinogens
Is this the next smoothie trend?,https://www.bbc.com/travel/article/20220606-belizes-sweet-sustainable-seaweed-shakes,Travel,It's a heritage food with a surprising ingredient
The depression men shrug off,https://www.bbc.com/worklife/article/20220601-male-postnatal-depression-why-men-struggle-in-silence,Worklife,"""What sort of man gets depressed after they've had a baby?"""
The mysterious ancient culture for now,https://www.bbc.com/culture/article/20220601-the-mysterious-ancient-civilisation-that-resonates-now,Culture,Why the first great Greek civilisation continues to inspire us today
EU sets date for common phone charge cable,https://www.bbc.com/news/technology-61720276,Technology,"The EU has provisionally agreed new mobile devices must, by autumn 2024, use the same type of..."
Why I risk my life to provide aid in Ukraine,https://www.bbc.com/news/world-europe-61720402,Europe,The British volunteers helping Ukrainians escape Russian attacks
Was newly unearthed Roman road used to trade gold?,https://www.bbc.com/news/uk-wales-61712158,Wales,"Oxford tutor Dr Mark Merrony believes the highway could be Pembrokeshire's real ""golden road"""
Predicting famine before it strikes,/future/article/20220525-how-scientists-predict-famine-before-it-hits,,
What if we all stopped flying?,/future/article/20220519-what-if-we-all-stopped-flying,,
The batteries powered by gravity,/future/article/20220511-can-gravity-batteries-solve-our-energy-storage-problems,,
"Jamal Edwards died after taking drugs, mum says",/news/entertainment-arts-61716950,Entertainment & Arts,"His mum Brenda says she was in a ""state of shock"" after finding out how her son died."
"China's plans to go to the Moon, Mars and beyond",/news/world-asia-china-61511546,China,
India's loan scams leave victims scared for their lives,https://www.bbc.co.uk/news/business-61564038,Business,
New UK centre will help fight information war,/news/technology-61718097,Technology,
Monkeypox cases outside Africa rise to 780,/news/health-61696974,Health,
Jackdaw gas field given go-ahead by regulators,/news/uk-scotland-scotland-business-61666693,Scotland business,
Crowds watch as Pixie Lott weds at cathedral,/news/uk-england-cambridgeshire-61716984,Cambridgeshire,
Weather Watchers Spring Pic of the Season,https://www.bbc.co.uk/programmes/articles/11FRdLnrnXctMMFVk3ZQKnm/pic-of-the-season-spring-2022,News,
In pictures: Platinum Jubilee pageant,/news/uk-61698428,UK,
In pictures: Stars throw party for Jubilee,/news/entertainment-arts-61693645,Entertainment & Arts,
In pictures: Street parties and celebrations,/news/in-pictures-61689516,In Pictures,
In pictures: Harry and Meghan join royals for service,/news/uk-61681180,UK,
