title,href,tag,summary
WHO declares highest alert over monkeypox,/news/health-62279436,Health,"More than 16,000 cases have been reported from 75 countries, the organisation says."
Missile strike puts Ukraine grain deal in doubt,/news/world-europe-62278010,Europe,
Watch: Euro 2022 quarter-final: France 0-0 Netherlands,/sport/live/football/58889032,Sport,
Trump and Pence host rival rallies in Arizona,/news/world-us-canada-62278002,US & Canada,
$1bn Lord of the Rings TV show wows at Comic-Con,/news/entertainment-arts-62276842,Entertainment & Arts,
Steve Bannon found guilty of contempt of Congress,/news/world-us-canada-62259034,US & Canada,"An unofficial adviser to Donald Trump, Mr Bannon refused to co-operate with the 6 January committee."
Biden has 'improved' since Covid diagnosis - doctor,/news/world-us-canada-62271499,US & Canada,"The 79-year-old president still has only mild symptoms, his White House physician says."
The audacious PR plot that spread climate change doubt,https://www.bbc.co.uk/news/science-environment-62225696,News,"Thirty years ago, a bold plan was hatched to persuade people that climate change was not a problem."
England overcome improved SA to win second T20,/sport/cricket/62278846,Cricket,England overcame an improved performance from South Africa to comfortably win the second Twenty20 by six wickets at Worcester.
Mercedes' qualifying pace 'a slap in the face',/sport/formula1/62280271,Formula 1,Lewis Hamilton and Mercedes say they were surprised to be so far off the pace at the French Grand Prix and are at a loss to explain why.
Van Aert beats Vingegaard to win stage 20 time trial,/sport/cycling/62279048,Cycling,Wout van Aert wins the stage 20 time trial as team-mate Jonas Vingegaard all but seals Tour de France victory on the penultimate day.
Why we brush our teeth wrong,https://www.bbc.com/future/article/20220718-the-best-way-to-brush-your-teeth,Future,"For something we do everyday, most of us don't know how to properly clean our teeth"
Delhi's opulent 'snack of wealth',https://www.bbc.com/travel/article/20220717-the-beloved-snack-of-wealth-made-on-delhis-streets,Travel,Some street vendors say moonlight and dew are the magic ingredients
Why the return-to-office has been so rocky,https://www.bbc.com/worklife/article/20220718-the-five-big-things-we-know-about-return-to-office-so-far,Worklife,Plenty of workers have returned to desks – but there are still kinks to work out
The alien world hidden under the Mediterranean,/reel/video/p0c7d16y/the-mediterranean-s-hidden-wonders,,
The fortress at the heart of 'bloodiest siege in history',/reel/video/p0c40rwc/the-fortress-at-the-heart-of-bloodiest-siege-in-history-,,
An unlikely underwater garden full of octopuses,/reel/video/p0clz39f/behind-madagascar-s-octopus-garden-experiment,,
How long should you stay at a job?,https://www.bbc.com/worklife/article/20220720-the-case-for-job-hopping,Worklife,"Traditionally maligned, changing roles every year could have a big pay-off"
The film too kinky for Hollywood stars,https://www.bbc.com/culture/article/20220721-secretary-why-the-kinky-bdsm-romance-was-a-film-landmark,Culture,How 2002 movie Secretary pushed boundaries in depicting a BDSM relationship
How to stop storms killing women,https://www.bbc.com/future/article/20220719-how-bangladesh-system-fights-cyclones-climate-disasters,Future,Bangladesh's secret to fighting climate disasters? Women
The empire the Aztecs couldn't conquer,https://www.bbc.com/travel/article/20220710-the-empire-the-aztecs-couldnt-conquer,Travel,"They were a powerful political force, yet they were still nearly lost to history"
News quiz: How did Boris Johnson sign off from UK PMQs?,https://www.bbc.com/news/world-62253293,World,How closely have you been paying attention to what's been going on this week?
What your taste in ice cream says about you,https://www.bbc.co.uk/food/articles/ice_cream_personality,Food,Your favourite ice cream flavour could reveal more about your personality than you think
Who will win UK architecture's most prestigious prize?,https://www.bbc.com/programmes/articles/FzZpbczYXNCL2Krd37c5bl/who-will-win-the-most-prestigious-prize-in-uk-architecture,Arts,The stunning structures vying to be named the UK's best new building
The unseen whale killer,/future/article/20220712-how-to-fix-our-ocean-noise-pollution-problem,,
The ancient material that cools homes,/future/article/20220705-the-sustainable-cities-made-from-mud,,
Why the world's tallest trees are dying,/future/article/20220623-the-genetic-power-of-ancient-trees,,
"You, Me and The Big C wins UK podcast award",/news/entertainment-arts-62236332,Entertainment & Arts,"You, Me and The Big C and Dear Daughter are among the winners at this year's British Podcast Awards."
Giant radio telescope becomes space light show,/news/science-environment-62269520,Science & Environment,
Unwed Chinese woman loses legal bid to freeze eggs,/news/world-asia-china-62279373,China,
Tinder: Women's safety now at the heart of the app,/news/technology-62206485,Technology,
The YouTuber making millions from true crime and make-up,https://www.bbc.co.uk/news/business-61948546,Business,
"Xi Jinping vaccinated against Covid, China says",/news/world-asia-china-62279377,China,
Millions of galaxies revealed by Webb telescope,/news/science-environment-62259492,Science & Environment,
Drone images show homes gutted by heatwave blaze,/news/uk-england-norfolk-62255042,Norfolk,
Photographer captures magic of island's puffins,/news/uk-wales-62235145,Wales,
Africa's top shots: Wide grins and vintage cars,/news/world-africa-62249895,Africa,
In pictures: Hot weather sweeps across UK,/news/in-pictures-62205653,In Pictures,
Bear photography takes grandmother round the world,/news/uk-wales-62152869,Wales,
