title,href,tag,summary
US shoots down Chinese 'spy' balloon over Atlantic,/news/world-us-canada-64524105,US & Canada,The US military hopes to recover debris from the suspected Chinese spy aircraft that flew across America.
Teenager dies in Australian river shark attack,https://www.bbc.com/news/world-australia-64523498,Australia,
Pakistan blocks Wikipedia for 'blasphemous content',https://www.bbc.com/news/world-asia-64523501,Asia,
Why Ireland got a new holiday,https://www.bbc.com/travel/article/20230203-recipe-boxty-pancakes-and-bacon-for-st-brigids-day,Travel,
Superb Scotland stun England at Twickenham,/sport/rugby-union/64525412,Rugby Union,
Russia returns bodies of UK volunteers to Ukraine,/news/world-europe-64521865,Europe,Kyiv says Chris Parry and Andrew Bagshaw's remains were handed over as part of a prisoner swap.
Sixth officer fired after death of Tyre Nichols,/news/world-us-canada-64521857,US & Canada,"Preston Hemphill violated multiple rules, including stun gun deployment regulations, police say."
Japan PM fires aide over anti-LGBT remarks,/news/world-asia-64521862,Asia,Masayoshi Arai was dismissed after reportedly saying he would not want to live next to same-sex couples.
Twelve minutes of misery as Liverpool misfire again,/sport/football/64525812,Football,A nightmare opening 12 minutes against Wolves sums up Liverpool's struggles as they are dealt another blow in a disappointing campaign.
Despair to delight in a day - Dyche makes mark,/sport/football/64524819,Football,Everton's fans went from despair to delight in hours as new manager Sean Dyche inspired a stunning win over leaders Arsenal.
Ireland cruise to Six Nations win over Wales,/sport/rugby-union/64519964,Rugby Union,Warren Gatland's return is spoiled by Ireland as the world's number one side humble Wales in the opening Six Nations match in Cardiff.
What is the New Arctic diet?,https://www.bbc.com/travel/article/20230201-the-chefs-reviving-the-arctics-forgotten-food,Travel,It brings together the communities at the top of the world
The Gen Z friendship problem,https://www.bbc.com/worklife/article/20230201-can-gen-z-make-friends-in-the-pandemic-era,Worklife,Why young adults are struggling to make friends – and needing to get creative
The world's most influential school?,https://www.bbc.com/future/article/20230131-does-the-montessori-method-actually-work,Future,What science says about the 'Montessori method'
The unspeakable barbarity committed against Niger,/reel/video/p0f0pvg8/the-unspeakable-barbarity-committed-against-niger,,
The truth behind your favourite flavours,/reel/video/p0f0cw07/the-truth-behind-your-favourite-flavours,,
The benefits of a 'weekend marriage',/reel/video/p0dztrm5/is-separation-marriage-key-to-a-healthy-relationship-,,
Norway's 496km engineering miracle,https://www.bbc.com/travel/article/20230130-the-highest-rail-route-in-northern-europe,Travel,It's one of the world's most beautiful train journeys
The unruly ancient rituals for now,https://www.bbc.com/culture/article/20230203-the-unruly-ancient-rituals-still-practised-today,Culture,A revival of interest in chaotic folk customs can tell us a lot about life now
Why women with UTIs are frustrated,https://www.bbc.com/future/article/20230126-why-arent-there-better-treatments-for-cystitis,Future,Women are often dismissed when they report symptoms of urinary tract infections
How worker surveillance is backfiring,https://www.bbc.com/worklife/article/20230127-how-worker-surveillance-is-backfiring-on-employers,Worklife,More companies are monitoring their employees – and it's often doing more harm
Sex Pistols star fails in Irish Eurovision bid,https://www.bbc.com/news/entertainment-arts-64519292,Entertainment & Arts,"Public Image Ltd, which John Lydon formed after the Sex Pistols split, had hoped to go to the song..."
Image of 'vulnerable' plant wins photo award,https://www.bbc.co.uk/news/in-pictures-64472234,In Pictures,The winning images of this year's International Garden Photographer of the Year competition
Cancer as a young person: 'A blood test saved me',https://www.bbc.com/news/health-64505734,Health,Research suggests many 18-24 year-olds do not know the five major things to look for
Are ski trips coming to an end?,/future/article/20230124-how-climate-change-threatens-to-close-ski-resorts,,
Why Italy's olive trees are dying,/future/article/20230111-the-super-sniffer-dogs-saving-italys-dying-olive-trees,,
How far can vertical farming go?,/future/article/20230106-what-if-all-our-food-was-grown-in-indoor-vertical-farms,,
The history of rock is written on these walls,/news/entertainment-arts-64496004,Entertainment & Arts,"From graffiti to guest books, five venues share the scribblings of rock and pop's biggest stars."
Interpol working out how to police the metaverse,/news/technology-64501726,Technology,
Infected blood inquiry: Five things we have learned,/news/health-64497868,Health,
Africa's top shots: Yellow disguises and bird chasers,/news/world-africa-64497630,Africa,
Fraud claims against Adani group spark political row,/news/world-asia-india-64508129,India,
Bird flu 'spills over' to otters and foxes in UK,/news/science-environment-64474594,Science & Environment,
Canada experiments with decriminalising hard drugs,/news/world-us-canada-64461983,US & Canada,
In pictures: Up Helly Aa,/news/uk-scotland-64464271,Scotland,
Heavy snow disrupts life in India's Himalayan states,/news/world-asia-india-64462193,India,
The defiant low-lying island 70 years after floods,/news/uk-england-essex-64255567,Essex,
Survivors and leaders mark Holocaust Memorial Day,/news/in-pictures-64425194,In Pictures,
'Fen skating is a great metaphor for life',/news/uk-england-cambridgeshire-64399819,Cambridgeshire,
