title,href,tag,summary
"Sudan faces catastrophe as 100,000 flee war - UN",/news/world-africa-65448691,Africa,"A further 334,000 people have been displaced within Sudan, but hopes rise of possible peace talks."
Covid whistleblower returns home to Wuhan after jail,https://www.bbc.com/news/world-asia-china-65454824,China,
TV writers explain why they're walking out,https://www.bbc.com/news/world-us-canada-65447383,US,
A history of art in 7 colours,https://www.bbc.com/culture/article/20230428-a-history-of-art-in-7-colours,Culture,
A Cold War time capsule is now open,https://www.bbc.com/travel/article/20230501-regan-vest-inside-denmarks-secret-nuclear-bunker,Travel,
Late night shows to go dark due to writers' strike,/news/entertainment-arts-65447046,Entertainment & Arts,TV and movie writers walk out in the US after pay talks with major studios break down.
Soldier shoots dead politician he was guarding,/news/world-africa-65454213,Africa,"Some residents reported the soldier firing into the air, shortly before killing himself."
Serena Williams announces pregnancy at Met Gala,/news/world-us-canada-65454210,US & Canada,"Speaking to reporters alongside her husband, Williams says there ""are three of us"" on the red carpet."
Leeds set to sack Gracia and in talks with Allardyce,/sport/football/65453934,Football,Leeds United are set to sack manager Javi Gracia and are in talks to appoint former England boss Sam Allardyce.
The two-inch error that stopped an Olympic final,/sport/gymnastics/65426779,Sport,A 16-year-old Allana Slater had a choice: say nothing or trust her instincts and speak up... she chose the latter.
Fifa threatens Women's World Cup European blackout,/sport/football/65453756,Football,Fifa president Gianni Infantino threatens a broadcast blackout for the Women's World Cup in Europe unless TV companies improve their rights offers.
Why is the Coronation so spectacular?,https://www.bbc.com/future/article/20230428-the-surprising-power-of-pomp-and-ceremony,Future,The pomp and ceremony of a state ritual can act as a social glue
How to watch the Coronation in the US,https://www.bbc.com/culture/article/20230502-how-to-watch-king-charles-iiis-coronation-in-the-us,Culture,Your guide to viewing the day's events on TV and online
How coronation food reflects the times,https://www.bbc.com/travel/article/20230430-coronation-cuisine-the-food-fit-for-royalty,World's Table,"It has a history stretching back more than 1,000 years"
The daring attempt to steal the British Crown Jewels,/reel/video/p0fkdqrc/the-audacious-theft-of-the-british-crown-jewels,,
Illeism: The simple trick for improving your decision making,/reel/video/p0fg233t/the-ancient-trick-that-will-help-you-make-better-decisions,,
The secret lives of Saudi women,/reel/video/p075n0sy/the-secret-lives-of-saudi-women,,
The best Met Gala looks through the decades,https://www.bbc.com/culture/article/20230428-met-gala-2023-eight-of-the-best-looks-over-the-decades,Culture,"As it turns 75, we look back at the event's most memorable themes and outfits"
A guide to afternoon tea in London,https://www.bbc.com/travel/article/20230430-where-to-have-afternoon-tea-in-london,Travel,"Advice from an ""international tea expert"""
The puzzle of Neanderthal culture,https://www.bbc.com/future/article/20230428-the-puzzle-of-neanderthal-culture-and-aesthetics,Future,They may have even had an appreciation of aesthetics
How are mums working without childcare?,https://www.bbc.com/worklife/article/20230426-the-mothers-working-from-home-without-childcare,Worklife,"Even as many kids have returned to care, not every mother has the help she needs"
Is your job at risk from AI?,https://www.bbc.com/news/business-65459827,Business,The rapidly evolving technology could be used for jobs that had been assumed to be safe from...
The 17 most eye-catching looks at the Met Gala,https://www.bbc.com/news/entertainment-arts-65413976,Entertainment & Arts,Doja Cat was among the stars paying tribute not just to Karl Lagerfeld - but also his famous feline
The winners and losers from the NFL Draft,https://www.bbc.com/sport/american-football/65447163,American Football,The Houston Texans make a big splash
The revival of a historic Italian fruit,/future/article/20230424-how-agrivoltaics-helped-save-italys-citron-and-lemon-trees,,
The first climate-resilient nation?,/future/article/20230418-how-caribbean-island-dominica-is-fighting-climate-impacts,,
A major positive climate tipping point,/future/article/20230414-climate-change-why-2023-is-a-clean-energy-milestone,,
Jodie Comer and Jessica Chastain up for Tony awards,/news/entertainment-arts-65458314,Entertainment & Arts,The award-winning actresses are both shortlisted for their roles in acclaimed Broadway plays.
AI chatbots 'may soon be more intelligent than us',/news/world-us-canada-65452940,US & Canada,
Riding the 'vomit comet' with first disabled astronaut,/news/science-environment-65380263,Science & Environment,
Australia to ban recreational vaping,/news/world-australia-65446352,Australia,
Parasols and prayers: Africa's top shots,/news/world-africa-65409697,Africa,
Sudanese NHS doctor finally allowed to return to UK,/news/uk-65423219,UK,
Shein faces US calls for probe into Uyghur claims,/news/business-65452976,Business,
The photos that chronicle the cost of dying,/news/uk-scotland-65354687,Scotland,
Len Goodman obituary: From the East End to Strictly stardom,/news/entertainment-arts-58929590,Entertainment & Arts,
Penarth: Nofio gyda'r wawr yn y môr // Sea swimming at dawn,/newyddion/65372997,Cylchgrawn,
In pictures: Muslims around the world celebrate Eid,/news/in-pictures-65346964,In Pictures,
Image of wounded pregnant woman wins World Press Photo,/news/in-pictures-65340265,In Pictures,
