title,href,tag,summary
India bids farewell to iconic singer Lata Mangeshkar,/news/world-asia-india-60094193,India,The Bollywood star beloved by Indians around the world is cremated with full state honours.
Charles leads Jubilee tributes to 'remarkable' Queen,/news/uk-60279585,UK,
Tragic end for boy trapped in Moroccan well,/news/world-africa-60275177,Africa,
La Liga: Barcelona 2-1 Atletico Madrid - Gavi puts hosts ahead from Traore assist,/sport/live/football/60075567,European Football,
FA Cup fourth round: Watch Nottingham Forest v Leicester after Liverpool win,/sport/live/football/59989012,Football,
"Russia 70% ready to invade Ukraine, US sources say",/news/world-europe-60276342,Europe,"Moscow has amassed most of the military capability needed for a full-scale invasion, officials say."
"Give PM time and space to deliver, says Kwarteng",/news/uk-politics-60279079,UK Politics,"The business secretary says Boris Johnson is focused on the job, but MPs continue to question his future."
Sadowski-Synnott wins slopestyle gold,/sport/winter-olympics/60276965,News,Zoi Sadowski-Synnott wins New Zealand's first Winter Olympics gold medal in the women's slopestyle final.
Liverpool ease past Cardiff in FA Cup,/sport/football/60187991,Football,Liverpool reach the fifth round of the FA Cup for only the second time in seven seasons as they see off a weakened but spirited Cardiff City.
Mane and Salah face off in Afcon final,/sport/africa/60245124,Sport Africa,Sadio Mane's Senegal meet Mohamed Salah's Egypt in the Africa Cup of Nations final as the two Liverpool stars go head-to-head.
'Smith should have stayed on in Scotland',/sport/rugby-union/60275340,Rugby Union,Ex-England scrum-half Matt Dawson hails Scotland's performance but questions why England fly-half Marcus Smith was replaced.
The end of the rebellious teenager?,https://www.bbc.com/future/article/20220124-why-teens-arent-what-they-used-to-be,Future,Who are we when we're no longer children – and not yet adults?
Eight photos showing a US in crisis,https://www.bbc.com/culture/article/20220202-eight-photos-showing-a-us-in-crisis,Culture,"Images depicting protests, poverty and the effects of climate change"
A 'new' kind of nuclear family,https://www.bbc.com/worklife/article/20220128-the-millennials-choosing-friends-as-sperm-donors,Worklife,Couples are opting to start families with sperm donations from people they know
"Love, life and iconic images from the New York City subway",/reel/video/p0bllp4k/the-iconic-images-capturing-the-magic-of-the-80s,,
The Templar secret lurking beneath an Italian town,/reel/video/p08nysf4/the-templar-town-with-a-hidden-underground-twin-,,
The unexpected human 'superpower' we usually try to hide,/reel/video/p0blcwcy/reasons-to-love-being-a-sweaty-person,,
10 TV shows to watch this February,https://www.bbc.com/culture/article/20220203-10-tv-shows-to-watch-this-february,Culture,Including a gritty Fresh Prince reboot and the final series of Killing Eve
The brain quirk that ruins future plans,https://www.bbc.com/worklife/article/20220201-how-thinking-about-future-you-can-build-a-happier-life,Worklife,"How imagining who we'll be in 10 years builds happiness, health and wealth"
North Africa's ancient convenience food,https://www.bbc.com/travel/article/20220130-bsissa-north-africas-newest-breakfast-trend,Travel,It's becoming increasingly popular as a health food
The country fighting disinformation,https://www.bbc.com/future/article/20220128-the-country-inoculating-against-disinformation,Future,"For this tiny Baltic state, media literacy is part of its national security"
The 40% of food that never gets eaten,https://www.bbc.com/future/bespoke/follow-the-food/how-to-use-food-waste-for-good/,Follow the Food,"As global food production is on the rise, food waste is soaring"
Why are China's Winter Olympics so controversial?,https://www.bbc.com/news/explainers-59644043,Explainers,Winter Olympics host China is being criticised over its human rights record
Can you grow out of a food allergy?,https://www.bbc.com/food/articles/grow_out_food_allergy,Food,A food allergy can be inconvenient at best and life-threatening at worst
The climate benefits of tiny islands,/future/article/20220131-the-worlds-tiny-islands-inspiring-green-action,,
How a desert city holds back its sand,/future/article/20220125-how-dubai-is-pushing-back-its-encroaching-deserts,,
The 'outrageous' green plan for coal,/future/article/20220118-the-environmental-case-for-buying-a-coal-mine,,
Neighbours under threat after Channel 5 drops show,/news/entertainment-arts-60277939,Entertainment & Arts,The Australian network that airs the show says it is looking for a new UK partner for the soap.
India's Twitter alternative with global ambitions,/news/world-asia-india-60194920,India,
Could a greener asthma inhaler help you breathe better?,/news/health-59997297,Health,
Meta moves to tackle creepy behaviour in VR,/news/technology-60247542,Technology,
South Africa makes its own version of Moderna jab,/news/health-60258088,Health,
UK approves fifth Covid-19 vaccine,/news/health-60245736,Health,
Iceland signals end to whaling within two years,/news/world-europe-60265085,Europe,
Garden photographer wins competition for third time,/news/in-pictures-60111369,In Pictures,
Ice diving and dragons - photos from around the world,/news/in-pictures-60262132,In Pictures,
Africa's top shots: Cowboys and beach burials,/news/world-africa-60243953,Africa,
In Pictures: Lunar New Year 2022,/news/in-pictures-60209010,In Pictures,
In Pictures: US cities clear up after big freeze,/news/world-us-canada-60190444,US & Canada,
