title,href,tag,summary
Trump Jr praises dad's 'genius' in return to stand,/news/world-us-canada-67408894,US & Canada,The younger Mr Trump is the first defence witness in the family's civil fraud trial in New York.
WHO says Gaza's biggest hospital becoming a cemetery,https://www.bbc.com/news/live/world-middle-east-67400490,Middle East,
David Cameron: I want to support PM at hard time,https://www.bbc.com/news/uk-politics-67407974,UK Politics,
The truth about corporate net zero,https://www.bbc.com/worklife/article/20231110-the-tough-truth-behind-corporate-net-zero-sustainability-targets,Worklife,
The fried chicken served on Titanic,https://www.bbc.com/travel/article/20231112-maryland-fried-chicken-a-storied-dish-with-titanic-history,World's Table,
Bowen: Rumbling Middle East fault lines make this war different,/news/world-middle-east-67404110,Middle East,The future is bleak if the conflict doesn't force the Israelis and Palestinians to try again for peace.
US Supreme Court releases first-ever ethics rules,/news/world-us-canada-67408898,US & Canada,Judges have been criticised for failing to disclose gifts and holiday arrangements they received.
Agent assigned to Naomi Biden shoots amid car break-in,/news/world-us-canada-67406774,US & Canada,A Secret Service agent assigned to the president's granddaughter saw a government car being broken into.
"Sir Bobby Charlton: Family man, football hero, statesman",/sport/football/67409945,Football,"Heartfelt eulogies to Sir Bobby Charlton at a service to commemorate his life paint a picture of much more than a footballing legend, writes Simon Stone."
"Bags of urine, cans of Bud and the team that saved US soccer",/sport/football/67360749,Football,"There was more on the line than a spot at the 1990 World Cup - the United States team feared for their jobs, homes and the very future of football in their country."
Alcaraz beaten by Zverev on ATP Finals debut,/sport/tennis/67406692,Tennis,"Carlos Alcaraz suffers defeat on his ATP Finals debut as Alexander Zverev fights back to win, while Daniil Medvedev beats Andrey Rublev."
The mirrors cooling Sierra Leone,/future/article/20231109-how-africas-first-heat-officer-is-protecting-women-in-sierra-leone,,
How bubble veils muffle wind farm noise,/future/article/20231106-the-big-bubble-curtains-protecting-porpoises-from-wind-farm-noise,,
Tuning into indigenous climate science,/future/article/20231102-climate-scientists-are-working-with-indigenous-tribes,,
Six architectural gems in San Francisco,https://www.bbc.com/travel/article/20231111-experience-san-franciscos-six-best-architectural-gems,Travel,From the Frank Lloyd Wright Building to Salesforce Park to City Hall
Three reasons Americans won't buy EVs,https://www.bbc.com/worklife/article/20231108-three-big-reasons-americans-havent-rapidly-adopted-evs,Worklife,US consumers aren't driving electric vehicles off the lots in droves. Why?
How humans could travel through time,https://www.bbc.com/future/article/20231110-doctor-who-is-time-travel-really-possible-heres-what-physics-says,Future,Here's what physics says about our ability to venture into the future and past
Blockbusters that may never be seen,https://www.bbc.com/culture/article/20231113-coyote-vs-acme-and-the-blockbusters-that-will-never-be-seen,Culture,Why Coyote vs Acme is the latest film to be shelved despite already being shot
Theatre chief offers to quit after Juliet balcony fall,https://www.bbc.com/news/world-europe-67408066,Europe,Two actors in Hungary are in a serious condition following the accident during Romeo and Juliet
Iceland volcano: what will the impact be?,https://www.bbc.com/news/science-environment-67402198,Science & Environment,An eruption is thought imminent but its impact depends on where magma breaches the surface
The Marvels bombs with lowest MCU box office debut,https://www.bbc.com/news/entertainment-arts-67401772,Entertainment & Arts,"""This opening is an unprecedented Marvel box office collapse,"" says box office analyst David A Gross"
Napoleon: The truth about 'small man syndrome',/reel/video/p0gqbk09/napoleon-the-truth-about-small-man-syndrome-,,
A simple ritual key to Finnish wellbeing,/reel/video/p0gnhcnx/saunas-the-essence-of-finland-s-heartbeat,,
The unique dish of 'Turkey's Tuscany',/reel/video/p0gs90gh/mastic-artichokes-the-unique-dish-of-turkey-s-tuscany-,,
Could triple glazing become a UK standard?,https://www.bbc.co.uk/news/business-67161076,Business,Triple glazed windows are becoming more common in the UK and some say they could become standard.
"Northern Lights, rain and racing: Photos of the week",/news/in-pictures-67378797,In Pictures,
I'm A Celebrity 2023: This year's line-up revealed,/news/entertainment-arts-67410716,Entertainment & Arts,
Can artificial rain wash away Delhi's pollution?,/news/world-asia-india-67364941,India,
How Bumble's Whitney Wolfe Herd changed the dating scene,/news/technology-67359823,Technology,
Mounjaro weight loss jab authorised in UK,/news/health-67366256,Health,
Alan Wake and Baldur's Gate lead Game Awards list,/news/newsbeat-67402220,Newsbeat,
"Royals, rallies and regattas: Africa's top shots",/news/world-africa-67342719,Africa,
King Charles III delivers speech at State Opening of Parliament,/news/uk-politics-67344490,UK Politics,
Damage and disruption: Storm Ciarán in pictures,/news/in-pictures-67298061,In Pictures,
"Clouds, crowns and crews: Africa's top shots",/news/world-africa-67295807,Africa,
Elton John photography collection to go on display,/news/uk-england-london-67205468,London,
