title,href,tag,summary
Biden celebrates family ties in pub on Ireland tour,https://www.bbc.co.uk/news/articles/cyx0d0rk651o,News,Thousands of people gather to greet the US president as he visits the home county of his ancestors.
'An ally not a vassal': Macron defends Taiwan comments,https://www.bbc.com/news/world-europe-65258129,Europe,
Trump sues ex-attorney Michael Cohen for $500m,https://www.bbc.com/news/world-us-canada-65256568,US,
Japanese menus change as egg prices soar,https://www.bbc.com/news/world-asia-65200999,Asia,
The mystery of our genome's dark matter,https://www.bbc.com/future/article/20230412-the-mystery-of-the-human-genomes-dark-matter,Future,
Six things we learned from Elon Musk interview,/news/world-us-canada-65251160,US & Canada,The world's second richest man spoke for nearly an hour on a wide range of subjects.
Watch: Elon Musk's unexpected BBC interview... in 90 seconds,/news/world-us-canada-65249138,US & Canada,"Musk talks about the ""pain"" of owning Twitter and the BBC's objection to being labelled ""government funded""."
Dead rodents litter Canada PM's official home,/news/world-us-canada-65208045,US & Canada,"Mould and asbestos plague 24 Sussex, turning the official residence into a ""national embarrassment""."
Ten-man Chelsea lose first leg away to Real Madrid,/sport/football/65243061,European Football,Chelsea have it all to do if they are to advance to the Champions League semi-finals as they lose to holders Real Madrid at the Bernabeu.
Bennacer gives Milan first-leg lead over Napoli,/sport/football/65244881,European Football,Ismael Bennacer's first-half goal gives AC Milan a slender advantage over Napoli in the first leg of their all-Italian Champions League quarter-final.
'A farce' - Zilliacus withdraws Man Utd bid,/sport/football/65257850,Football,"Finnish entrepreneur Thomas Zilliacus withdraws his offer to buy Manchester United and says the decision of current owners the Glazers to go to a third round of bidding is a ""farce""."
Why you are only as old as you feel,/reel/video/p0fg0jrj/why-age-is-really-just-a-number,,
The origin of a modern obsession,/reel/video/p0fg23l8/the-modern-obsession-of-sneaker-collecting,,
Why the Dutch don't say sorry,/reel/video/p0d1dqv3/why-the-dutch-don-t-say-sorry,,
Where people drink beer for breakfast,https://www.bbc.com/travel/article/20230412-where-people-drink-beer-for-breakfast,Travel,Families pour into pubs for this beloved morning tradition
The bohemians who shocked 1800s Britain,https://www.bbc.com/culture/article/20230412-the-rossettis-the-bohemians-who-shocked-victorian-britain,Culture,How the Rossettis intrigued and scandalised Victorian society
Why 'turnover contagion' is spreading,https://www.bbc.com/worklife/article/20230411-the-great-resignation-has-quitting-become-too-cool,Worklife,Quitting has become almost glamorous – and that's not always good
What pitch-black darkness does to taste,https://www.bbc.com/future/article/20230411-what-dining-in-the-dark-does-to-your-tastebuds,Future,"Without visual cues, are your tastebuds fooled?"
Prince Harry to attend coronation without Meghan,https://www.bbc.com/news/uk-65255135,UK,Prince Harry will travel to the UK but Meghan will stay in California with their children
Jupiter moons mission to assess chance of life,https://www.bbc.com/news/science-environment-65254502,Science & Environment,A £1.4bn probe could tell us if the major moons of Jupiter have the potential to sustain life
Twitter and hate speech: What's the evidence?,https://www.bbc.co.uk/news/world-us-canada-65246394,US,Some studies show abuse on Twitter is increasing - but Elon Musk has pushed back
The rich worlds created by avalanches,/future/article/20230405-how-avalanche-management-could-help-wildlife-in-the-alps,,
The Alps' hidden butterfly paradise,/future/article/20230404-why-the-alps-are-a-haven-for-rare-butterflies,,
The abandoned mines heating homes,/future/article/20230324-how-old-coal-mines-can-help-the-climate,,
Harry Potter books to be made into new TV series,/news/entertainment-arts-65258807,Entertainment & Arts,The series will feature a new cast and will have seven seasons based on each of JK Rowling's books.
North Sea oil spills a wildlife threat - activists,/news/science-environment-65254022,Science & Environment,
The bean that could change the taste of coffee,https://www.bbc.co.uk/news/business-65189695,Business,
Ghana first to approve 'world-changer' malaria vaccine,/news/health-65252511,Health,
The ship graveyard which has claimed many lives,/news/uk-wales-57853220,Wales,
Nasa's JPL snake robot explores extreme terrain,/news/world-us-canada-65245054,US & Canada,
"Musk on layoffs, misinfo and sleeping in the office",/news/business-65248196,Business,
Green leaves and yawning soldiers: Africa's top shots,/news/world-africa-65200809,Africa,
In pictures: King Charles's state visit to Germany,/news/in-pictures-65123931,In Pictures,
Royal murals and rare rhinos: Africa's top shots,/news/world-africa-65106486,Africa,
Film fan creates hundreds of miniature movie sets,/news/uk-england-south-yorkshire-65112610,Sheffield & South Yorkshire,
Southern Lights unusually vivid over New Zealand,/news/world-asia-65108333,Asia,
