title,href,tag,summary
Omicron spreading at unprecedented rate - WHO,/news/world-59656385,World,"The WHO's head warns that the Covid variant is being underestimated, despite its potential impact."
A $10bn machine in search of the end of darkness,https://www.bbc.com/news/science-environment-59476869,Science & Environment,
Billie Eilish says porn exposure caused nightmares,https://www.bbc.com/news/entertainment-arts-59658663,Entertainment & Arts,
The family rifts triggered by Christmas,https://www.bbc.com/future/article/20211201-why-family-estrangement-is-surprisingly-common,Future,
The most life-affirming film of all,https://www.bbc.com/culture/article/20211214-a-matter-of-life-and-death-the-most-life-affirming-film,Culture,
"US surpasses 800,000 Covid deaths",/news/world-us-canada-59645307,US & Canada,More than a quarter of lives lost in the pandemic came after all US adults were eligible for a vaccine.
German raids on Covid extremists over death plot,/news/world-europe-59664076,Europe,Far-right anti-vaccination activists are suspected of plotting to kill Saxony leader Michael Kretschmer.
A miraculous escape after a factory's collapse,/news/world-us-canada-59659513,US & Canada,Colleagues sang Happy Birthday to Kyanna Parsons-Perez after a tornado buried them all in rubble.
Aguero announces retirement,/sport/live/football/59663876,Football,Former Manchester City striker Sergio Aguero announces his retirement from the game at the age of 33 in a media conference at current club Barcelona.
Aguero retires following heart problem,/sport/football/59660727,European Football,Sergio Aguero announces his retirement from football within six months of joining Barcelona from Manchester City.
Anderson and Broad in 12-man Test squad,/sport/cricket/59663727,Cricket,James Anderson and Stuart Broad are in England's 12-man squad for the second Ashes Test against Australia which starts on Thursday at 04:00 GMT.
The new revolutionary weapon in the fight against malaria,/reel/video/p0b8lm3l/how-drones-can-help-keep-us-healthy,,
'How lust saved me',/reel/video/p09bxtbk/two-friends-reflections-on-lust,,
The surprisingly deadly truth about grapefruit,/reel/video/p09grpkf/the-deadly-secret-of-the-humble-grapefruit,,
A tiny village reviving Gaelic culture,https://www.bbc.com/travel/article/20211214-a-tiny-village-reviving-gaelic-culture,Travel,A new generation of locals are now ready to share their culture
The 10 best tracks and albums of 2021,https://www.bbc.com/culture/article/20211213-the-10-best-tracks-and-albums-of-2021,Culture,BBC Culture's musical picks of the year
The 'immoral' side of climate change,https://www.bbc.com/future/article/20211213-who-will-pay-for-the-damage-caused-by-climate-change,Future,"'Our whole culture, identity and way of life is linked to the environment'"
Can you ever get over a grudge?,https://www.bbc.com/worklife/article/20211214-can-you-ever-get-over-a-lingering-grudge,Worklife,We all have lingering grudges. It’s in our interests to get over them – can we?
Sibling relationships through the lens,https://www.bbc.com/news/in-pictures-58157397,In Pictures,"After reflecting on the loss of his sister, Simon Bray set out on a photo project to explore sibling..."
School doesn't understand why I fall asleep in class,https://www.bbc.com/news/uk-england-59657873,England,Ridwan is one of more than a million children without enough space at home
Bullied for being 'effeminate' in China,https://www.bbc.com/news/world-asia-china-59576108,China,"A young man's death sparks discussions on gender norms, even as the state targets ""sissy men"""
The new weapon against climate change,/future/article/20211207-the-legal-battle-against-climate-change,,
Medieval Europe's solution to flooding,/future/article/20211129-the-medieval-dutch-solution-to-flooding,,
The hidden bustling world of hedgerows,/future/article/20211125-britains-ancient-fortresses-for-nature,,
Cornish comedian Jethro dies aged 73,/news/uk-england-cornwall-59666409,Cornwall,"The stand-up comedian, who spent more than 50 years on the road, died after contracting Covid-19."
Billionaire Patrick Drahi raises BT stake to 18%,/news/business-59610775,Business,
Probe makes historic pass through Sun's atmosphere,/news/science-environment-59661827,Science & Environment,
First UK death recorded with Omicron variant,/news/uk-59639007,UK,
Grindr fined £5.5m for sharing data for ads,/news/technology-59651703,Technology,
South Africa president being treated for Covid,/news/world-africa-59635277,Africa,
James Webb telescope lifted atop its launch rocket,/news/science-environment-59632757,Science & Environment,
Africa's top shots: Beaded singers and sea creatures,/news/world-africa-59592129,Africa,
Christmas Lane lights up for charity,/news/uk-england-suffolk-59552491,Suffolk,
Refugee's 'perfect pictures' of 1970s Hull life,/news/uk-england-humber-59463285,Humberside,
"Storm Arwen brings snow, waves and winds",/news/uk-england-59457581,England,
Fire-eaters and dancers at Dakar cultural carnival,/news/world-africa-59450598,Africa,
