title,href,tag,summary
"Human error to blame for deadly train crash, says Greek PM",/news/live/world-europe-64807384,Europe,At least 43 people are killed after a passenger train and freight train collide in one of the country's worst rail accidents.
Prince Andrew offered Frogmore Cottage - reports,https://www.bbc.com/news/uk-64812549,UK,
NYC to pay millions to George Floyd protesters,https://www.bbc.com/news/world-us-canada-64814096,US,
The effect of TikTok's beauty filters,https://www.bbc.com/future/article/20230301-the-problems-with-tiktoks-controversial-beauty-filters,Future,
The return of the US' lost language,https://www.bbc.com/travel/article/20230228-kouri-vini-the-return-of-the-us-lost-language,Travel,
At the crash site of 'no hope' - BBC reporter in Greece,/news/world-europe-64808262,Europe,Kostas Koukoumakas takes a look at the devastation after two trains collided in northern Greece.
Why Covid lab-leak theory is so disputed,/news/world-asia-china-57268111,China,The claim Covid-19 leaked from a Chinese laboratory dates from early in the pandemic. Here's what we know.
Havana Syndrome 'unlikely' to be caused by US foes,/news/world-us-canada-64814097,US & Canada,An unclassified assessment is released into the mysterious disease that has struck US officials abroad.
Premier League: Arsenal 0-0 Everton & Liverpool 0-0 Wolves,/sport/live/football/64736472,Football,Follow live score & text updates as table-topping Arsenal host struggling Everton and Liverpool play Wolves in the Premier League.
"Watch FA CUP: Sheff Utd v Spurs, plus Saints trail Grimsby, Man Utd also in action",/sport/live/football/64558783,Football,"Watch live coverage of Sheffield United v Tottenham, Burnley v Fleetwood plus live commentary & text updates from three other FA Cup fifth round fixtures."
Outstanding Malan a 'lesson to us all' - Buttler,/sport/cricket/64780392,Cricket,"England white-ball captain Jos Buttler says Dawid Malan's ""outstanding"" innings is ""a great lesson to all of us in the group""."
Huldufólk: The invisible elves of Iceland,/reel/video/p0f5xqv0/hulduf-lk-iceland-s-mythical-world-of-hidden-people,,
The shocking legacy of the Dutch 'Hunger Winter',/reel/video/p0f5qzdq/the-harmful-legacy-of-poor-nutrition,,
Extreme Korean game stirs heated controversy,/reel/video/p0f56xr5/extreme-korean-game-stirs-heated-controversy,,
The problem confronting women of colour,https://www.bbc.com/worklife/article/20230228-the-perfect-storm-keeping-women-of-colour-behind-at-work,Worklife,There’s a story hidden in the recent workplace changes for women
The 1991 video game phenomenon,https://www.bbc.com/culture/article/20230228-street-fighter-ii-the-1991-video-game-that-packs-a-punch,Culture,Street Fighter II's unique cultural reach
Playful fluffballs or rats of the sea?,https://www.bbc.com/future/article/20230228-how-alaskas-sea-otters-came-back,Future,"Once hunted almost to extinction, sea otters have seen a remarkable recovery"
The Greek meatballs packed with history,https://www.bbc.com/travel/article/20230228-soutzoukakia-the-greek-meatballs-packed-with-history,World's Table,Caroline Doriti's new cookbook shares the story behind this Greek comfort food
A Nordic country's remedy for stress,https://www.bbc.com/travel/article/20230227-greenlands-natural-medicine-for-the-soul,Travel,People are realising the country's value for mental health
TikTok sets daily screen time limit for under-18s,https://www.bbc.com/news/technology-64813981,Technology,"If young people hit the new limit, they will have to enter a passcode to continue using the app"
Rare Jurassic-era bug found at Arkansas Walmart,https://www.bbc.com/news/world-us-canada-64814931,US,A teacher who spotted the bug took it home - then realised during a class how unusual it was
The clothes you can't recycle,/future/article/20230227-how-to-recycle-your-clothes,,
How longer weekends help the planet,/future/article/20230220-is-a-4-day-workweek-good-for-the-climate,,
Can the unborn have a say on climate?,/future/article/20230215-should-future-generations-have-climate-rights,,
Pictures show devastation after Greece train disaster,/news/world-europe-64808123,Europe,"The cause of the crash, that happened shortly before midnight on Tuesday, is currently unknown."
Guilt-free flying not in easy reach - scientists,/news/science-environment-64788106,Science & Environment,
Twitch streamer Kai Cenat breaks subscriber record,/news/technology-64811710,Technology,
Ed Sheeran says wife developed tumour in pregnancy,/news/entertainment-arts-64809475,Entertainment & Arts,
Covid origin likely China lab incident - FBI chief,/news/world-us-canada-64806903,US & Canada,
What is carbon capture and can it fight climate change?,/news/science-environment-64723497,Science & Environment,
Blackpink lead top stars back on the road in Asia,https://www.bbc.co.uk/news/business-64286127,Business,
Spectacular northern lights seen across UK,/news/uk-64782372,UK,
SAG Awards: The red carpet in pictures,/news/entertainment-arts-64781316,Entertainment & Arts,
Vigils and flags: Ukraine war anniversary in pictures,/news/in-pictures-64757068,In Pictures,
The 24-year photography project,/news/in-pictures-64723755,In Pictures,
Outlaw-themed parade triumphs at Rio carnival,/news/world-latin-america-64742729,Latin America & Caribbean,
