title,href,tag,summary
Scholz becomes German leader as Merkel bows out,/news/world-europe-59575773,Europe,"Olaf Scholz is sworn in as chancellor, leading a three-party coalition after 16 years of Merkel rule."
Elizabeth Holmes: I 'never' lied to investors,https://www.bbc.com/news/world-us-canada-59587919,US & Canada,
Ex-boyfriend of Maxwell accuser corroborates account,https://www.bbc.com/news/world-us-canada-59585506,US & Canada,
The sci-fi that predicted life in 2021,https://www.bbc.com/culture/article/20211207-the-matrix-and-the-sci-fi-stories-that-became-a-reality,Culture,
The surgeons who operate from anywhere,https://www.bbc.com/future/article/20211207-the-surgeons-who-can-operate-from-anywhere-in-the-world,Future,
Pfizer says booster shot promising against Omicron,/news/world-59582006,World,The company says a third dose of its vaccine could improve protection against the new variant.
Boss says sorry for 'blundered' mass Zoom firing,/news/business-59573146,Business,"Vishal Garg says he ""is deeply sorry"" for sacking 900 staff in an online meeting."
That No 10 party: What the government said before,/news/uk-59575801,UK,Watch to see what the PM and ministers have said when questioned about the No 10 Christmas party.
"Robinson strikes with new ball as England look to fight back against Australia - clips, radio & text",/sport/live/cricket/57163377,Cricket,"Follow live text, in-play clips and TMS commentary from day two of the first Ashes Test in Brisbane."
Barcelona out of Champions League,/sport/football/59587194,European Football,Barcelona lose to Bayern Munich to miss out on a Champions League last-16 place and drop down into the Europa League.
Spurs game off after Covid positives,/sport/football/59576387,Football,Tottenham's Europa Conference League match against Rennes on Thursday is off after 13 positive Covid-19 tests at the club.
An increasingly popular tool to fight anxiety,/reel/video/p0b8c63l/the-rise-of-the-digital-therapist,,
The extreme wealth of the richest man who ever lived,/reel/video/p09dcbl0/the-richest-person-who-ever-lived,,
The perfect isolation of the world's most remote ghost town,/reel/video/p08svx89/the-picturesque-ghost-town-at-the-edge-of-the-world,,
The happy 'aunts with no kids',https://www.bbc.com/worklife/article/20211208-aunt-with-no-kids-the-women-redefining-family-roles,Worklife,Why mums aren't the only women playing major family roles
The ultimate 'no-boundaries' look,https://www.bbc.com/culture/article/20211208-how-the-beauty-of-fluidity-went-mainstream-in-fashion,Culture,How gender-fluid 'Romanticism' became a force to be reckoned with
The countries sued for climate change,https://www.bbc.com/future/article/20211207-the-legal-battle-against-climate-change,Future Planet,Climate-related court cases have more than doubled since 2015
Britain's most remote inhabited island,https://www.bbc.com/travel/article/20211208-foula-britains-most-remote-inhabited-island,Travel,Only around 30 permanent residents live on Foula
Why Germany loves 'school cones',https://www.bbc.com/future/article/20211201-the-german-tradition-that-calms-school-anxiety,Future,The dramatic history of a treasured tradition
Netherlands to buy iconic Rembrandt self-portrait,https://www.bbc.com/news/world-europe-59588109,Europe,"The Dutch government puts aside €150m for the 1636 work, currently owned by the Rothschild family."
Christmas movie-making snowballs to set new record,https://www.bbc.com/news/entertainment-arts-59560618,Entertainment & Arts,The number of new festive films listed for release in 2021 is four times higher than a decade ago
Medieval Europe's solution to flooding,/future/article/20211129-the-medieval-dutch-solution-to-flooding,,
The hidden bustling world of hedgerows,/future/article/20211125-britains-ancient-fortresses-for-nature,,
The living architecture of India,/future/article/20211117-how-indias-living-bridges-could-transform-architecture,,
TikTok jumps on online shopping bandwagon,/news/business-59563238,Business,Social media app TikTok is producing its first live shopping and entertainment event in the UK.
Mixed reviews for disaster comedy Don't Look Up,/news/entertainment-arts-59575497,Entertainment & Arts,
The people changing jobs so they can make a difference,http://www.bbc.co.uk/news/business/,Business,
"Vaccines should work against Omicron, WHO says",/news/world-59573037,World,
Bird flu at 'phenomenal level' in UK - chief vet,/news/science-environment-59585618,Science & Environment,
World's top Covid vaccine maker halves production,/news/world-asia-india-59574878,India,
Fish 'whoops and growls’ heard on restored reef,/news/science-environment-59567875,Science & Environment,
Christmas Lane lights up for charity,/news/uk-england-suffolk-59552491,Suffolk,
Weather Watchers Pic of the Season,https://www.bbc.co.uk/programmes/articles/3LT1MNnGmYK2bg1bGR4y55j/pic-of-the-season-autumn-2021,News,
Refugee's 'perfect pictures' of 1970s Hull life,/news/uk-england-humber-59463285,Humberside,
Africa's top shots: Fired-up stars and smoky runways,/news/world-africa-59502970,Africa,
"Storm Arwen brings snow, waves and winds",/news/uk-england-59457581,England,
