title,href,tag,summary
US to send controversial cluster bombs to Ukraine,/news/world-us-canada-66134663,US & Canada,"The White House defends the move, while acknowledging that such unexploded ordnance can harm civilians."
Why is US giving Ukraine 'abhorrent' weapons?,/news/world-europe-66133527,Europe,
Dutch government collapses over asylum row,/news/world-europe-66139789,Europe,
Murray unsure he has motivation for Wimbledon return,/sport/tennis/66139993,Tennis,
El Paso Walmart gunman gets 90 life sentences,/news/world-us-canada-66111468,US & Canada,
The heat index explained in...90 seconds,/news/world-us-canada-66071216,US & Canada,"Unlike temperature, the heat index measures what the body actually feels."
No charges for security who blocked Britney Spears,/news/world-us-canada-66129605,US & Canada,"The pop star says the incident near a restaurant in Las Vegas was a ""traumatic experience""."
Is Taylor Swift snubbing Canada?,/news/world-us-canada-66136501,US & Canada,"Swift has tour stops in South America, Asia and Australia, but not Canada. Is there bad blood?"
England are in a 'winnable' position - Moeen,/sport/cricket/66134034,Cricket,"Moeen Ali says England are in a ""winnable position"" after his two wickets restricted Australia on day two of the third Ashes Test at Headingley."
Van der Sar in intensive care after bleed on brain,/sport/football/66138530,Football,Former Manchester United and Ajax goalkeeper Edwin van der Sar is being treated in intensive care after suffering a bleed on his brain.
Cavendish denied new Tour wins record by Philipsen,/sport/cycling/66136531,Cycling,Jasper Philipsen denies Mark Cavendish a record 35th stage victory at the Tour de France with victory in Bordeaux on Friday.
The islands gifted as an unpaid debt,https://www.bbc.com/travel/article/20230706-the-viking-spirit-of-a-remote-scottish-archipelago,Travel,Why the Orkney Islands are fighting for their Viking roots
Sixteen of the best films of 2023,https://www.bbc.com/culture/article/20230402-8-of-the-best-films-of-2023-so-far,Culture,From John Wick: Chapter 4 and Close to Suzume and Polite Society
The maps revealing urban heat stress,https://www.bbc.com/future/article/20230706-the-simple-ways-cities-can-adapt-to-heatwaves,Future Planet,The heat island solutions visible from space
Jeff Bezos' political superpower revealed,/reel/video/p0fzd25s/jeff-bezos-political-superpower-revealed,,
The surprising impact of heatwaves on the air we breathe,/reel/video/p0fz7y12/why-extreme-heat-makes-air-quality-worse,,
The surprising benefits of breaking up,/reel/video/p0fyvbnd/the-unexpected-benefits-of-breaking-up,,
Why Wimbledon’s dress code is so strict,https://www.bbc.com/culture/article/20230707-wimbledon-the-controversy-of-tenniss-strict-146-year-old-dress-code,Culture,The rules have changed for the first time in the tournament's 146-year history
What would green shipping look like?,https://www.bbc.com/future/article/20230707-what-would-net-zero-shipping-look-like,Future,Steering towards net zero
Rava upma: warm and savoury semolina,https://www.bbc.com/travel/article/20230707-rava-upma-warm-and-savoury-semolina,Travel,This comforting staple of Indian cuisine is a perfect all-day food
The rise of job-searching burnout,https://www.bbc.com/worklife/article/20230628-why-unemployed-workers-are-so-burnt-out,Worklife,"Jobs can cause burnout, of course – but so can looking for a new role"
Why America could be overtaken as the corn superpower,https://www.bbc.com/news/world-us-canada-66089408,US,There could be global consequences if the US lost its title as the world's biggest exporter of corn
Bruce Springsteen settles an old score in Hyde Park,https://www.bbc.com/news/entertainment-arts-66131282,Entertainment & Arts,The star returns to the London venue for the first time since organisers cut off his set in 2012
'Almost every influencer will be hopping on Threads',https://www.bbc.com/news/technology-66122246,Technology,Threads users tell the BBC what they think about the app and its future
Why white paint could cool India,/future/article/20230628-the-white-roofs-cooling-womens-homes-in-indian-slums,,
How a photo changed our view of chimps,/future/article/20230623-how-jane-goodall-chimp-iconic-photo-changed-our-view-of-nature,,
The homes built from cannabis,/future/article/20230614-the-buildings-constructed-from-cannabis,,
Best in show: Africa's top shots,/news/world-africa-66118610,Africa,A selection of the best photos from across Africa and beyond this week.
Young adults see rise in severe distress - study,/news/health-66122386,Health,
BBC star 'accused of paying teen for explicit photos',/news/entertainment-arts-66140356,Entertainment & Arts,
Shipping agrees net-zero goal but critics unmoved,/news/science-environment-66131038,Science & Environment,
Malmö is Swedish city chosen to host Eurovision,/news/entertainment-arts-66130777,Entertainment & Arts,
Canada stops advertising with Facebook in news row,/news/world-us-canada-66104997,US & Canada,
World records hottest day for third time in a week,/news/science-environment-66120297,Science & Environment,
In pictures: King Charles III celebrations,/news/uk-scotland-66108829,Scotland,
Mystery of Holocaust escape girls finally solved,/news/uk-england-tyne-66040197,Tyne & Wear,
Eid al-Adha around the world in pictures,/news/world-66041087,World,
Photographer shares shots of famous musicians,/news/uk-wales-65989687,Wales,
Millinery masterpieces at Royal Ascot,https://www.bbc.co.uk/news/articles/c3g1e00xgy2o,News,
