title,href,tag,summary
More storms feared after Mississippi tornado,/news/world-us-canada-65082746,US & Canada,Friday night's tornado in the southern US killed 26 people and has displaced hundreds more.
Israel defence minister fired in legal reform row,https://www.bbc.com/news/world-middle-east-65080919,Middle East,
Strike brings German transport network to halt,https://www.bbc.com/news/world-europe-65083774,Europe,
Tottenham manager Conte leaves by mutual consent,https://www.bbc.com/sport/football/64168691,Football,
Why workers are live-quitting on TikTok,https://www.bbc.com/worklife/article/20230321-quittok-why-young-workers-are-live-quitting-on-tiktok,Worklife,
Why was the Mississippi tornado so destructive?,/news/world-us-canada-65072195,US & Canada,The strength and timing of the tornado added to the devastation in Rolling Fork and elsewhere.
Howling gale and flying debris as tornado hits school,/news/world-us-canada-65080552,US & Canada,CCTV footage shows the intensity of the tornado as it battered Amory High School in Mississippi.
"Ukraine drone downed over Russia, Moscow says",/news/world-europe-65082747,Europe,Kyiv has dismissed previous claims that it has attacked Russian civilian targets with explosive drones.
'Saka confirms status as jewel in England's crown',/sport/football/65082123,Football,BBC Sport's chief football writer Phil McNulty looks at Bukayo Saka's impact in England's 2-0 win over Ukraine.
'Conte departure became formality after criticism',/sport/football/65026103,Football,"Antonio Conte's departure as Tottenham manager was a mere formality once he concluded his incendiary unmasking of his squad's frailties, writes Phil McNulty."
How Conte's turbulent Tottenham tenure unravelled,/sport/football/65028913,Football,"As Antonio Conte's Tottenham tenure comes to an end after a volatile 16 months, BBC Sport looks at how the Italian's reign unravelled."
Heating homes using abandoned coal mines,/reel/video/p0fbsw4s/heating-homes-using-abandoned-coal-mines,,
Why your money isn't where you think it is,/reel/video/p0fby1fg/what-does-a-bank-do-with-your-money-,,
Four Japanese principles to lead a good life,/reel/video/p0fbmyc4/four-japanese-principles-to-lead-a-good-life,,
The 300-year-old pet portraits,https://www.bbc.com/culture/article/20230324-from-gainsborough-to-hockney-the-300-year-old-pet-portraits,Culture,The mysterious connection between humans and hounds
A remote-work change of heart?,https://www.bbc.com/worklife/article/20230317-the-workers-quietly-backtracking-on-return-to-office,Worklife,Some workers have resisted returning – only to enjoy being back now
A heritage hotel run by princesses,https://www.bbc.com/travel/article/20230326-a-heritage-hotel-run-by-princesses,Travel,They've transformed the opulent palace into an award-winning boutique hotel
The return of the X-planes?,https://www.bbc.com/future/article/20230324-how-x-planes-may-solve-the-sonic-boom-problem,Future,A new mission for Space Race pioneers
UAE pardons Israeli woman who faced life in prison,https://www.bbc.com/news/world-middle-east-65080918,Middle East,Fidaa Kiwan was jailed on drug charges but allowed to return home amid improving relations
The child whose drawing sparked a police investigation,https://www.bbc.com/news/world-europe-65015289,Europe,Masha is in a children’s home after Russian authorities placed her father under house arrest
Finland's Sanna Marin fights for survival in election,https://www.bbc.com/news/world-europe-64872698,Europe,Polls suggest she is in a tight race with centre-right Petteri Orpo and right-wing  Riikka Purra
Can kelp help people travel the world?,/future/article/20230323-climate-change-how-seaweed-could-power-planes,,
Shipping's wind power revolution,/future/article/20230310-will-shipping-return-to-its-ancient-roots,,
A better way to make concrete,/future/article/20230309-how-carbon-negative-concrete-can-help-the-climate,,
OneWeb launch completes space internet project,/news/science-environment-65066669,Science & Environment,The London firm part-owned by the UK government puts up its final batch of broadband satellites.
The web firm that wants to stop you getting 'cancelled',https://www.bbc.co.uk/news/business-65050160,Business,
Actor Jonathan Majors arrested on assault charges,/news/world-65081847,World,
India firm's licence cancelled after cough syrup deaths,/news/world-asia-india-65048188,India,
Have we found the 'animal origin' of Covid?,/news/science-environment-65067264,Science & Environment,
Your pictures on the theme of 'machinery',/news/in-pictures-65026997,In Pictures,
Deadly fungal infection spreading in US,/news/world-us-canada-65027557,US & Canada,
Northern lights dazzle in parts of UK overnight,/weather/features/65061790,Features,
Blazes and blast-offs: Photos of the week,/news/in-pictures-65062963,In Pictures,
A lover's embrace and purple royals: Africa's top shots,/news/world-africa-65049764,Africa,
Cherry blossoms draw spectators and photographers,/news/uk-england-birmingham-65043539,Birmingham & Black Country,
Photos saved from tip to be added to city archive,/news/uk-england-coventry-warwickshire-64980965,Coventry & Warwickshire,
