title,href,tag,summary
WHO warns of coming Covid storm in Europe,/news/live/uk-59738511,UK,"Germany, Sweden and Portugal are latest to announce new restrictions to stem spread of Omicron"
Channel migrants: Their terrifying fatal journey,https://www.bbc.co.uk/news/resources/idt-b7bd2274-88b1-4ef9-a459-be22e180b52c,News,
"The princess, the sheikh and the £550m divorce settlement",/news/world-middle-east-59739563,Middle East,
Why being rich is no longer glamorous,https://www.bbc.com/culture/article/20211215-succession-and-the-rich-on-tv-have-we-stopped-ogling-wealth,Culture,
The gifts that reject consumerism,https://www.bbc.com/future/article/20211208-how-to-make-diy-gifts-that-children-will-love,Future,
The secret lives of Maxwell and Epstein,/news/world-us-canada-59737125,US & Canada,Never-before-seen photos released during her trial shed new light on their private lives.
A visual guide to China's military build-up,/news/world-asia-china-59600475,China,China has a long-term plan to rival the world's biggest military powers.
Sex And The City stars support Chris Noth accusers,/news/world-asia-59738053,US & Canada,Three Sex And The City actresses issue a joint statement after co-star is accused of sexual assault.
La Liga: Sevilla v Barcelona,/sport/live/football/59333449,European Football,Follow live text updates as Sevilla host Barcelona in La Liga.
Carabao Cup quarter-final: Arsenal 2-1 Sunderland - League One side hit back,/sport/live/football/58122455,Football,Follow live text and BBC Radio 5 Live commentary as Arsenal host Sunderland in the Carabao Cup quarter-finals.
The Brazil & Barcelona great who never dared to dream,/sport/football/59696614,Football,"Rivaldo is one of the world's greatest players, a legend of Brazil and Barcelona. At 19, he looked very little like a footballer."
The people 'rage quitting' their jobs,https://www.bbc.com/worklife/article/20210903-why-rage-quitting-is-all-the-rage-this-year,Worklife,How workplace tensions are leading to angry resignations
The city that wakes up to eat at 4am,https://www.bbc.com/travel/article/20210301-trang-the-thai-city-obsessed-with-breakfast,Travel,It's the most breakfast-obsessed city in a food-obsessed country
Why single people smell different,https://www.bbc.com/future/article/20210621-why-single-people-smell-different,Future,Our scent contains a wealth of information about us
An ingenious way to run faster,/reel/video/p09r61yk/an-ingenious-way-to-run-faster,,
"Portugal's 7,000-year-old stone circles baffling experts",/reel/video/p0bbrfm1/the-mysteries-of-portugal-s-7-000-year-old-stonehenge-,,
String theory explained: A simple way to understand everything,/reel/video/p09xhj2b/string-theory-a-simple-way-to-understand-the-universe,,
Why some people are so good at gifting,https://www.bbc.com/worklife/article/20211213-why-some-people-are-great-at-giving-gifts,Worklife,How some people have mastered the art of finding the perfect present
How good is The Matrix 4?,https://www.bbc.com/culture/article/20211215-film-review-the-matrix-resurrections,Culture,The Matrix Resurrections is 'numbingly familiar'
The invention of the doughnut,https://www.bbc.com/future/article/20211214-doughnuts-the-fried-treat-that-conquered-the-modern-world,Future,From austerity food to a much-loved snack
The 333 islands opening to the world,https://www.bbc.com/travel/article/20211214-the-333-islands-opening-to-the-world,Travel,"""It's an amazing feat for any destination"""
"Quiz of the year, part one: Test your knowledge",https://www.bbc.com/news/world-59634182,World,How well do you remember the news of the past 12 months?
What do your table manners say about you?,https://www.bbc.com/ideas/videos/what-do-your-table-manners-say-about-you/p07gbkp3?playlist=festive-picks,Ideas,Elbows on the table? How to navigate the world of eating etiquette
Easy festive desserts to entertain,https://www.bbc.com/food/collections/easy_festive_desserts,Food,Christmas desserts don't have to be difficult to be fancy
The sector behind a third of our waste,/future/article/20211215-the-buildings-made-from-rubbish,,
The new weapon against climate change,/future/article/20211207-the-legal-battle-against-climate-change,,
Medieval Europe's solution to flooding,/future/article/20211129-the-medieval-dutch-solution-to-flooding,,
Lloyd Webber calls off Cinderella until February,/news/entertainment-arts-59742071,Entertainment & Arts,"The West End musical will return ""as soon as this wave is licked"", the composer and producer says."
Amazon bans itself from Twitch over nudity rules,/news/technology-59730006,Technology,
Largest-ever millipede fossil found on beach,/news/science-environment-59734747,Science & Environment,
Sunak sets out £1bn fund for Covid-hit businesses,/news/uk-59742884,UK,
Biden buys 500m test kits to tackle Omicron surge,/news/world-us-canada-59738678,US & Canada,
WHO issues holiday warning over Omicron,/news/world-59733716,World,
The world's first octopus farm - should it go ahead?,/news/science-environment-59667645,Science & Environment,
'Ghost rainbows' thrill coastal weather watchers,/news/uk-england-norfolk-59728244,Norfolk,
Night drone captures pre-Christmas town splendour,/news/uk-england-norfolk-59680508,Norfolk,
'Competition celebrates best wildlife in county',/news/uk-england-essex-59653351,Essex,
US photographer Sally Mann wins Prix Pictet award,/news/in-pictures-59682234,In Pictures,
Africa's top shots: Portraits in tyres and masquerades,/news/world-africa-59680921,Africa,
