title,href,tag,summary
Israel reports 10-hour battle at Hamas 'stronghold' as evacuation resumes,/news/live/world-middle-east-67364296,Middle East,"Israel says it takes over a Hamas site in Jabalia, northern Gaza, while air strikes continue across the Strip."
'We walked into a wasteland' - BBC in Gaza with Israeli forces,/news/world-middle-east-67362960,Middle East,
A turning point in Myanmar as army suffers big losses,/news/world-asia-67305690,Asia,
The batteries built from cotton,https://www.bbc.com/future/article/20231108-batteries-of-the-future-how-cotton-and-seawater-might-power-our-devices,Future,
Can luxury fashion ever be sustainable?,https://www.bbc.com/culture/article/20231108-can-luxury-fashion-ever-be-fully-sustainable,Culture,
Four takeaways from the third Republican debate,/news/world-us-canada-67364573,US & Canada,"There were some heated exchanges on Ukraine and China, but strict moderation limited direct clashes."
Why 'I don't recall' is a common strategy on the stand,/news/world-us-canada-67363774,US & Canada,"Ivanka Trump repeated the phrase ""I don't recall"" in her testimony. Experts say it was a smart approach."
Sad farewells for US pandas heading back to China,/news/world-us-canada-67363702,US & Canada,The three giant pandas were on loan at the national zoo in Washington for 23 years.
World Cup: New Zealand v Sri Lanka,/sport/live/cricket/66859253,Cricket,Follow live text updates as New Zealand play Sri Lanka in the Men's Cricket World Cup 2023
Football news & should Rashford have been sent off?,/sport/live/football/67365507,Football,"Champions League reaction as Man Utd lose 4-3 at FC Copenhagen after Marcus Rashford red card, while Arsenal beat Sevilla."
'Don't mess with Claressa' - a fighter as hard as Flint,/sport/boxing/67337495,Boxing,"Claressa Shields grew up without support, protection or a bed to call her own. She has since scaled the heights to bring joy to Flint, a city that has become a byword for a broken American dream."
How bubble veils muffle wind farm noise,/future/article/20231106-the-big-bubble-curtains-protecting-porpoises-from-wind-farm-noise,,
Tuning into indigenous climate science,/future/article/20231102-climate-scientists-are-working-with-indigenous-tribes,,
How bison could become climate heroes,/future/article/20231102-why-grazing-bisoncould-be-good-for-the-planet,,
South America's 'beverage of champions',https://www.bbc.com/travel/article/20231108-yerba-mate-south-americas-beverage-of-champions,Travel,This bitter tea is growing in popularity as people aim for a healthier lifestyle
The moment that reshaped Europe,https://www.bbc.com/culture/article/20231108-the-fall-of-the-berlin-wall-the-moment-that-reshaped-europe,Culture,"How 'two nations, one people, merged into a joyful reunion'"
The Shakespeare play lost since 1603,https://www.bbc.com/future/article/20231107-the-420-year-search-for-shakespeares-lost-play,Future,The play hasn't been seen for centuries – but experts think it will turn up.
Three reasons Americans won't buy EVs,https://www.bbc.com/worklife/article/20231108-three-big-reasons-americans-havent-rapidly-adopted-evs,Worklife,US consumers aren't driving electric vehicles off the lots in droves. Why?
'There's disgusting behaviour at my McDonald's',https://www.bbc.com/news/business-67093982,Business,The claim comes after a BBC investigation exposed a toxic culture at the fast food chain
Omegle video chat website shut after abuse claims,https://www.bbc.com/news/business-67364634,Business,"Omegle, which allowed users to interact with random strangers online, was popular with young people"
John Lewis rings changes with Christmas advert,https://www.bbc.com/news/entertainment-arts-67289429,Entertainment & Arts,Many retailers have spent heavily on recruiting famous faces to front their campaigns
How exercise helps sculpt the brain,/reel/video/p0gh541c/why-exercise-can-help-sculpt-the-brain,,
The smartphone you can take apart and fix yourself,/reel/video/p0gr66lr/the-smartphone-you-can-take-apart-and-fix-yourself,,
Jelling Stone: 3D scans reveal power of Viking queen,/reel/video/p0gr4csj/jelling-stone-3d-scans-reveal-power-of-viking-queen,,
Tracy Chapman makes country music history,https://www.bbc.co.uk/news/articles/cpdpn88zzydo,Entertainment,She becomes the first black songwriter to win song of the year at the CMA country music awards.
Extreme autumn heat sets up 2023 for record,/news/science-environment-67332791,Science & Environment,
King Charles III delivers speech at State Opening of Parliament,/news/uk-politics-67344490,UK Politics,
"Stop suggesting children as friends, tech firms told",/news/technology-67358369,Technology,
UK forests face 'catastrophic ecosystem collapse',/news/science-environment-67350897,Science & Environment,
Parkinson's implant restores man's ability to walk,/news/health-67295526,Health,
Vorderman leaves BBC show over anti-government posts,/news/entertainment-arts-67357877,Entertainment & Arts,
"Storms, singing and silence: Photos of the week",/news/in-pictures-67308202,In Pictures,
Damage and disruption: Storm Ciarán in pictures,/news/in-pictures-67298061,In Pictures,
"Clouds, crowns and crews: Africa's top shots",/news/world-africa-67295807,Africa,
Elton John photography collection to go on display,/news/uk-england-london-67205468,London,
Skulls and flowers: Mexico's 'skeleton' parade,/news/in-pictures-67193453,In Pictures,
