title,href,tag,summary
"US trying to draw Russia into war, Putin says",/news/world-europe-60220702,Europe,Russia's leader criticises the US and Nato amid tensions over his military build-up near Ukraine.
Tensions rise over 'unlawful' trucker blockade,https://www.bbc.com/news/world-us-canada-60218354,US & Canada,
Stolen Roman statue recovered after 50 years,https://www.bbc.com/news/world-europe-60226454,Europe,
The end of the rebellious teenager?,https://www.bbc.com/future/article/20220124-why-teens-arent-what-they-used-to-be,Future,
A Caribbean take on body positivity,https://www.bbc.com/travel/article/20220201-a-caribbean-take-on-body-positivity,Travel,
Tonga enters Covid lockdown after aid delivered,/news/world-asia-60210867,Asia,Cases are detected among port workers as humanitarian aid arrives after a volcano and tsunami.
US unveils new policy for transgender swimmers,/news/world-us-canada-60225075,US & Canada,Testosterone tests will determine whether transgender women swimmers have an unfair advantage.
The myth of a 'super-charged' immune system,/news/health-60171592,Health,Suddenly we are all talking about immunity but how much do we really understand?
Aubameyang's Barcelona announcement & international reaction,/sport/live/football/60227213,Football,"Pierre-Emerick Aubameyang is still waiting to be announced by Barcelona, plus Brazil hammer Paraguay in World Cup qualifying."
Raducanu leads UK Laureus Awards nominees,/sport/60224261,Sport,US Open champion Emma Raducanu is one of six British sports stars nominated for the 2022 Laureus World Sports Awards.
Barcelona confirm Aubameyang signing,/sport/football/60212512,European Football,Barcelona confirm the signing of Arsenal striker Pierre-Emerick Aubameyang on a free transfer.
Our relationship with beauty? ...It's complicated,/reel/video/p0b8lwsr/how-ideas-of-beauty-are-not-within-our-control,,
Why did the Templars mark this mysterious spot on the map?,/reel/video/p08q45rj/why-did-the-templars-mark-this-mysterious-spot-on-the-map-,,
How sweating reveals what we want to hide,/reel/video/p0blcwcy/reasons-to-love-being-a-sweaty-person,,
Why 1922 was literature's greatest year,https://www.bbc.com/culture/article/20220201-why-1922-was-literatures-greatest-year,Culture,How crisis inspired the greatest books in history
George Washington's unsung black chef,https://www.bbc.com/travel/article/20220201-hercules-posey-george-washingtons-unsung-enslaved-chef,Travel,"""His story is nothing short than legendary – he is an American hero"""
The brain quirk that ruins future plans,https://www.bbc.com/worklife/article/20220201-how-thinking-about-future-you-can-build-a-happier-life,Worklife,"How imagining who we'll be in 10 years builds happiness, health and wealth"
The climate benefits of tiny islands,https://www.bbc.com/future/article/20220131-the-worlds-tiny-islands-inspiring-green-action,Future,Small island communities have been pioneers the green transition
What next for Wordle and its fans?,https://www.bbc.com/news/technology-60215251,Technology,Fans have been left guessing what will come next
Colin the Caterpillar cake row crumbles,https://www.bbc.com/news/business-60223220,Business,Marks & Spencer and Aldi reach a settlement in a copyright row
Calls to allow people to return to the Radical Road,https://www.bbc.com/news/uk-scotland-edinburgh-east-fife-60111776,UK,One of Scotland's most historic paths has been closed for three years after a 50 tonne rock fall
How a desert city holds back its sand,/future/article/20220125-how-dubai-is-pushing-back-its-encroaching-deserts,,
The 'outrageous' green plan for coal,/future/article/20220118-the-environmental-case-for-buying-a-coal-mine,,
The rhino that became an icon for peace,/future/article/20220111-the-rhinos-bringing-peace-in-india,,
Whoopi Goldberg suspended over Holocaust remarks,/news/world-us-canada-60225196,US & Canada,"ABC suspends the US talk show host for two weeks after she said the Holocaust was ""not about race""."
"'As a female CEO, action is what matters'",https://www.bbc.co.uk/news/business-60169366,Business,
Slide show that persuaded Boris Johnson on climate,/news/science-environment-60203674,Science & Environment,
FBI urges burner phones for Olympic athletes,/news/technology-60215250,Technology,
Austria's vaccine mandate kicks in amid resistance,/news/world-europe-60155635,Europe,
Smear test could check risk for some other cancers,/news/health-60205239,Health,
UK cranes have most successful year since 1600s,/news/uk-england-norfolk-60222039,Norfolk,
In Pictures: Lunar New Year 2022,/news/in-pictures-60209010,In Pictures,
In Pictures: US cities clear up after big freeze,/news/world-us-canada-60190444,US & Canada,
Photographs capture city's Covid-19 response,/news/uk-england-tyne-60131496,Tyne & Wear,
Africa's top shots: Weighty matters and cartwheels,/news/world-africa-60156013,Africa,
In Pictures: Holocaust Memorial Day,/news/in-pictures-60154892,In Pictures,
