title,href,tag,summary
William and Kate meet crowds as parties mark Coronation,https://www.bbc.com/news/live/uk-65474716,UK,The royals meet crowds celebrating in Windsor as thousands join Coronation street parties across the UK
Your guide to the rest of the Coronation weekend,https://www.bbc.com/news/uk-65254834,UK,
Stars gear up to perform at Coronation concert,https://www.bbc.com/news/entertainment-arts-65480420,Entertainment & Arts,
'Mad panic' as Russia evacuates nuclear plant town,https://www.bbc.com/news/world-europe-65515443,Europe,
Eight killed by gunman in Texas mall shooting,https://www.bbc.com/news/world-us-canada-65515915,US,
Wagner 'promised ammunition' after retreat threat,/news/world-europe-65516633,Europe,Yevgeny Prigozhin seemingly U-turns on his threat to withdraw from the Ukrainian city of Bakhmut.
Canadian province declares wildfire emergency,/news/world-us-canada-65515446,US & Canada,"More than 100 wildfires rage in the western province of Alberta and 25,000 people are evacuated."
One governor's blueprint that could challenge Trump,/news/world-us-canada-65464667,US & Canada,"Republican Governor Ron DeSantis has transformed Florida, but can he export his vision nationally?"
Premier League: Arsenal lead Newcastle in breathless first half,/sport/live/football/65429126,Football,Follow live text and radio coverage as Newcastle host Arsenal in the Premier League.
Reaction as Celtic secure second Premiership title under Postecoglou,/sport/live/football/65518140,Football,Reaction as Celtic declared Scottish Premiership champions by defeating Heart of Midlothian.
Scottish Premiership: Rangers win but can't stop Celtic title party,/sport/live/football/65455682,Football,"Celtic can clinch successive Scottish Premiership titles at Hearts, with Rangers also in action against Aberdeen."
The Coronation: Six takeaways from a historic day,https://www.bbc.com/news/entertainment-arts-65488861,Entertainment & Arts,"BBC's Katie Razzall gives her cultural review of how the big day went down, in her view from the sofa"
Royal Family tree: Charles III and the line of succession,https://www.bbc.com/news/uk-23272491,UK,"The King, his siblings, children, grandchildren and great-grandchildren"
Penny Mordaunt's sword-wielding - and other top moments,https://www.bbc.com/news/uk-65510506,UK,"An MP holding a sword took a surprising star role, while the royal children shared a tender moment"
Five little-known Coronation facts to impress your friends,/reel/video/p0flpz2n/five-little-known-coronation-facts-to-impress-your-friends,,
A misunderstood ancient erotic manual,/reel/video/p0fl4b21/kama-sutra-a-misunderstood-ancient-erotic-manual,,
Why do French men pee on the street?,/reel/video/p0fg8f6z/why-do-french-men-pee-on-the-street-,,
Six extraordinary gardens around the world,https://www.bbc.com/culture/article/20230505-five-extraordinary-gardens-around-the-world,The Collection,"From a warm, lush haven of native plants to a wind-swept shoreline patch"
What side-hustlers are really making,https://www.bbc.com/worklife/article/20230504-the-workers-sharing-their-side-hustle-incomes,Worklife,"Sharing income can be taboo, but some people are open about side-hustle earnings"
12 TV series to watch this May,https://www.bbc.com/culture/article/20230504-12-of-the-best-tv-shows-to-watch-this-may,Culture,From Bridgerton prequel Queen Charlotte to an Arnold Schwarzenegger action show
A Cold War time capsule is now open,https://www.bbc.com/travel/article/20230501-regan-vest-inside-denmarks-secret-nuclear-bunker,Travel,"Only 50,000 visitors are permitted each year"
Vietnam records highest-ever temperature of 44.1C,https://www.bbc.com/news/world-asia-65518528,Asia,One farmer said the fierce heat meant people had to finish work by 10 o'clock in the morning
"US recalls 500,000 Covid tests over bacteria risk",https://www.bbc.com/news/world-us-canada-65503664,US,The FDA said the liquid solution in some Pilot Covid-19 At-Home Tests may pose safety concerns
Banks warn of big increase in online scams,https://www.bbc.com/news/technology-65486219,Technology,"Barclays said 77% of scams are now happening on social media, online stores and dating apps"
What 1.5C living actually looks like,/future/article/20230504-the-people-living-ultra-low-carbon-lifestyles,,
The revival of a historic Italian fruit,/future/article/20230424-how-agrivoltaics-helped-save-italys-citron-and-lemon-trees,,
The first climate-resilient nation?,/future/article/20230418-how-caribbean-island-dominica-is-fighting-climate-impacts,,
King's Coronation watched by more than 18 million,/news/uk-65518360,UK,The audience peaked at 20 million when the King was crowned in Westminster Abbey just after midday.
Ukraine's Eurovision winners start Liverpool party,/news/entertainment-arts-65495434,Entertainment & Arts,
Big Tech bosses told to protect public from AI risks,/news/business-65489163,Business,
"Covid global health emergency is over, WHO says",/news/health-65499929,Health,
In pictures: Royal superfans camp out ahead of Coronation,/news/in-pictures-65484438,In Pictures,
Animal tests for makeup resume after 25-year ban,/news/science-environment-65484552,Science & Environment,
North Carolina lawmakers pass 12-week abortion ban,/news/world-us-canada-65489803,US & Canada,
Stylish singers and snipers: Africa's top shots,/news/world-africa-65480076,Africa,
In pictures: Night-time Coronation rehearsal,/news/in-pictures-65467802,In Pictures,
The 17 most eye-catching looks at the Met Gala,/news/entertainment-arts-65413976,Entertainment & Arts,
Parasols and prayers: Africa's top shots,/news/world-africa-65409697,Africa,
The photos that chronicle the cost of dying,/news/uk-scotland-65354687,Scotland,
