title,href,tag,summary
Ben Wallace rules out PM bid and is 'leaning' towards Johnson,/news/live/uk-politics-63338261,UK Politics,But the defence secretary says he is keen to hear what former Chancellor Rishi Sunak has to say on defence.
Could Boris Johnson really make a comeback?,https://www.bbc.com/news/uk-politics-63342114,UK Politics,
Far-right leader poised to govern Italy,https://www.bbc.com/news/world-europe-63327290,Europe,
Why a 90s cult novel still appeals now,https://www.bbc.com/culture/article/20221020-the-secret-history-a-murder-mystery-that-thrills-30-years-o,Culture,
The flawed Soviet glider tank,https://www.bbc.com/future/article/20221020-the-tank-that-could-fly-into-battle,Future,
Tory leadership hopefuls jostle for MPs' support,/news/uk-politics-63338171,UK Politics,"Defence Secretary Ben Wallace says he won't run to replace Liz Truss, as others race to secure backing."
Steve Bannon facing jail time in contempt case,/news/world-us-canada-63332077,US & Canada,Bannon was convicted of contempt of Congress for refusing to co-operate with the January 6 committee.
Netflix adds disclaimer under The Crown trailer,/news/entertainment-arts-63341010,Entertainment & Arts,"The royal drama is described as a ""fictional dramatisation"" on YouTube, online and on Twitter."
Gerrard reaction & Premier League news conferences,/sport/live/football/63340766,Football,"All the Premier League news conferences, plus reaction and fallout from Thursday's games, including Steven Gerrard's sacking at Aston Villa after a 3-0 defeat at Fulham."
Ronaldo must face consequences - Ten Hag,/sport/football/63345292,Football,"Manchester United manager Erik ten Hag says there ""has to be consequences"" after confirming Cristiano Ronaldo refused to come on as a substitute against Tottenham on Wednesday."
Gerrard sacked - who might replace him at Aston Villa?,/sport/football/63339467,Football,"After Steven Gerrard's Aston Villa departure, BBC Sport looks at some of the possible contenders to replace him."
The surprising truth about the Philistines,/reel/video/p0d8gprs/the-bible-s-buried-secrets-david-and-goliath,,
How beetroot juice is fuelling elite athletes,/reel/video/p0d7t71j/how-beetroot-can-enhance-your-performance,,
The secret world of Russian webcam girls,/reel/video/p0br9fwz/a-peek-inside-the-world-of-webcam-translators,,
The trick to learning from failure,https://www.bbc.com/worklife/article/20221019-the-smart-way-to-learn-from-failure,Worklife,You're primed to not learn from mistakes – but there's a smart way to fix this
How maths unlocked a casino loophole,https://www.bbc.com/future/article/20221019-how-a-magician-mathematician-revealed-a-casino-loophole,Future,There are mathematical patterns in shuffled casino cards
A hotel saving a shell-marked village,https://www.bbc.com/travel/article/20221020-in-croatia-a-hotel-trying-to-heal-war-wounds,Travel,"In a popular tourist area, one village hotel is trying to salve the scars of war"
The stories hidden in an ancient craft,https://www.bbc.com/culture/article/20221020-the-stories-hidden-in-the-ancient-indian-craft-of-kantha,Culture,"Why eastern India's upcycling handicraft, kantha, is now booming globally"
The unsung heroines of electronic music,https://www.bbc.com/ideas/videos/the-bbc-women-who-pioneered-electronic-music/p05tdppj,Ideas,Daphne Oram and Delia Derbyshire paved the way for British electronic music
Six moments from the PM's six chaotic weeks,https://www.bbc.com/news/uk-politics-63334457,UK Politics,The UK PM's short time in office had some dramatic twists and turns
The politics driving China's hellish lockdowns,https://www.bbc.com/news/world-asia-china-63310524,China,The world has largely moved on from Covid - except for China
How to save Paradise from fire,/future/article/20221019-could-a-buffer-help-paradise-california-stop-next-wildfire,,
Spain's magnificent medieval waterways,/future/article/20221011-the-moorish-invention-that-tamed-spains-mountains,,
What if we had limitless clean energy?,/future/article/20221006-what-would-happen-if-we-had-limitless-green-energy,,
US court dismisses Kevin Spacey sex assault lawsuit,/news/world-us-canada-63338929,US & Canada,"The case was brought by Anthony Rapp, who had been seeking around $40m (£36m) in damages."
India destroys 100 million Covid vaccines,/news/world-asia-india-63324548,India,
Critics praise Swift album but lament lack of hits,/news/entertainment-arts-63341633,Entertainment & Arts,
The flying car that could turn into a biplane,/news/technology-63325341,Technology,
Amazon could pay UK shoppers £900m compensation,/news/technology-63328589,Technology,
How an abandoned baby led to strip-searches in Qatar,/news/world-62072074,World,
Vast marine protected area 'boosts tuna stocks',/news/science-environment-63291104,Science & Environment,
Africa's top shots: Munching man and pink kites,/news/world-africa-63241554,Africa,
Street photography exhibition extended,/news/uk-england-birmingham-63222871,Birmingham & Black Country,
Chris Killip: Retrospective for UK photographer,/news/in-pictures-63163667,In Pictures,
Dunfermline marks city status with new exhibition,/news/uk-scotland-edinburgh-east-fife-63201547,"Edinburgh, Fife & East Scotland",
Tragic boxing star's story told in forgotten photos,/news/uk-wales-63143785,Wales,
