title,href,tag,summary
Zelensky to address G7 as Russian missiles hit cities,/news/live/world-europe-61941287,Europe,Ukraine's president is expected to ask for more weapons and urge world leaders gathered in Germany to act faster.
What Severodonetsk's fall means for the war,https://www.bbc.com/news/world-europe-61945914,Europe,
Russia defaults on foreign debt for first time in over a century,https://www.bbc.com/news/business-61929926,Business,
G7 details $600bn plan to rival China's Belt and Road,https://www.bbc.com/news/world-asia-61947325,Asia,
Why negative comments cut so deep,https://www.bbc.com/future/article/20220624-why-criticism-lasts-longer-than-praise,Future,
Several die as Colombian bullfight stand collapses,/news/world-latin-america-61945917,Latin America & Caribbean,"Hundreds of people are injured and four have died after a wooden stand fell, local officials say."
Lamar ends Glastonbury with women's rights plea,/news/entertainment-arts-61946649,Entertainment & Arts,The Pulitzer Prize-winning rapper closes his headline set at the festival with a powerful statement.
Chaotic scenes as Taser drawn at US abortion protest,/news/world-us-canada-61942445,US & Canada,"In South Carolina, six people are arrested at an event full of pro-choice and anti-abortion activists."
"Transfer latest: Man Utd chase De Jong, Arsenal close to Jesus deal",/sport/live/football/61948522,Football,"Manchester United continue their pursuit of Barcelona's Frenkie de Jong, Arsenal close in on deal for Manchester City forward Gabriel Jesus, plus more."
Raducanu & Murray ready for Centre at Wimbledon,/sport/tennis/61938392,Tennis,Britain's Emma Raducanu and Andy Murray are set for Centre Court when Wimbledon gets under way on Monday.
I've never experienced anything like it - Leach,/sport/cricket/61946489,Cricket,"Spinner Jack Leach says it is ""very special"" to be part of England's thrilling new Test era under Ben Stokes and Brendon McCullum."
How I realised my husband was a psychopath,/reel/video/p0cgtn2l/the-gripping-true-crime-story-of-a-ruthless-killer,,
The most powerful pirate the world has ever seen,/reel/video/p0cgfmwn/zheng-yi-sao-the-most-successful-pirate-in-history,,
String theory explained: A simple way to understand everything,/reel/video/p09xhj2b/string-theory-a-simple-way-to-understand-the-universe,,
India's next big street-food craze?,https://www.bbc.com/travel/article/20220626-indias-next-big-street-food-craze,Travel,Sattu has remained at the fringes of the urban foodscape – until now
The nation where your face is recorded,https://www.bbc.com/future/article/20220616-the-nation-where-your-faceprint-is-already-being-tracked,Future,With facial recognition on the rise are we heading for surveillance states?
Who was the real Elvis Presley?,https://www.bbc.com/culture/article/20220624-who-was-the-real-elvis-presley,Culture,How does the portrayal of 'The King' in Baz Luhrmann's film compare to reality?
The 'bossware' spying on workers,https://www.bbc.com/worklife/article/20220621-the-employee-surveillance-that-fuels-worker-distrust,Worklife,"""I'm nervous to even watch a YouTube video during my lunch break"""
Nasa makes history with rocket launch in Australia,https://www.bbc.com/news/world-australia-61947195,Australia,It is Nasa's first launch from a commercial site outside the US
Diana Ross brings Motown glamour to Glastonbury,https://www.bbc.com/news/entertainment-arts-61945821,Entertainment & Arts,The star drew a huge crowd as she played a greatest hits show
US firms pledge to pay abortion travel expenses,https://www.bbc.com/news/business-61941591,Business,"Disney, JP Morgan and Meta are among the companies to confirm such policies"
The promise of a world without roads,/future/article/20220621-what-if-roads-went-underground,,
The English town that welcomed the dark,/future/article/20220614-the-crusade-for-darker-night-skies,,
Could we live without plastic?,/future/article/20220526-what-would-happen-if-we-stopped-using-plastic,,
Will electric motorbike sales take-off in Asia?,https://www.bbc.co.uk/news/business-61907734,Business,
"Pots, trays, tubs - consumers confront their plastic footprint",/news/science-environment-61551500,Science & Environment,
11 weird and wonderful Glastonbury moments,/news/entertainment-arts-61945263,Entertainment & Arts,
The world reacts to US abortion ruling,/news/world-us-canada-61788929,US & Canada,
Instagram: Video selfies trial to check teens' ages,/news/technology-61828900,Technology,
Top US court ends constitutional right to abortion,/news/world-us-canada-61928898,US & Canada,
World's deepest shipwreck discovered,/news/science-environment-61925862,Science & Environment,
Elusive street photographer's work debuts in UK,/news/uk-england-beds-bucks-herts-61887224,"Beds, Herts & Bucks",
"Africa's top shots: Stretch, bend, dive",/news/world-africa-61907505,Africa,
Ice cream and amusements at the seaside,/news/in-pictures-61870261,In Pictures,
In pictures: Americans face extreme temperatures,/news/in-pictures-61880159,In Pictures,
In photos: Throwback to life on Indian streets,/news/world-asia-india-61781505,India,
