title,href,tag,summary
Djokovic wins court battle to stay in Australia,/news/live/world-australia-59909477,Australia,The Serb tennis star's visa cancellation is overturned by a judge but the government could still try to deport him.
Judge orders Djokovic's immediate release,https://www.bbc.com/news/world-australia-59932430,Australia,
US actor and comedian Bob Saget dies aged 65,https://www.bbc.com/news/entertainment-arts-59932429,Entertainment & Arts,
The forgotten way medieval people slept,https://www.bbc.com/future/article/20220107-the-lost-medieval-habit-of-biphasic-sleep,Future,
The end of the 'flexible work penalty'?,https://www.bbc.com/worklife/article/20220103-will-workers-continue-to-pay-a-price-for-flexibility,Worklife,
"Kazakhstan unrest was coup attempt, says president",/news/world-asia-59900738,Asia,"President Tokayev says a hunt for ""terrorists"" is continuing and Kazakhstan will soon provide proof."
West Side Story triumphs at troubled Golden Globes,/news/entertainment-arts-59900500,Entertainment & Arts,Steven Spielberg's remake of the classic film was among the big winners at Sunday's event in LA.
Aung San Suu Kyi jailed for another four years,/news/world-asia-59933706,Asia,Myanmar's former leader faces a series of charges since being ousted in an army coup last February.
FA Cup reaction and build-up to Man Utd v Aston Villa,/sport/live/football/59929976,Football,"Reaction to the weekend's FA Cup third-round games and build-up to Manchester United v Aston Villa, plus all the latest transfer news."
Raiders beat Chargers to reach play-offs,/sport/american-football/59931164,American Football,"The Las Vegas Raiders, Pittsburgh Steelers and San Francisco 49ers earn the last three play-offs spots after a dramatic final day of the NFL regular season."
Warriors win on Thompson's return,/sport/basketball/59934030,Basketball,Klay Thompson returns from a 31-month injury absence to help the Golden State Warriors secure a 96-82 win over the Cleveland Cavaliers.
The Soviet palace that people love to hate,/reel/video/p0bfsd4y/the-soviet-palace-that-people-love-to-hate,,
Why this man believes he will live to 180 years old,/reel/video/p093919p/can-science-reverse-the-ageing-process-,,
An ingenious way to run faster,/reel/video/p09r61yk/an-ingenious-way-to-run-faster,,
Is this Canada's 'Stonehenge'?,https://www.bbc.com/travel/article/20220109-iniskim-umaapi-is-this-canadas-stonehenge,Travel,It's one of the oldest religious monuments in the world
Is this the worst film ever made?,https://www.bbc.com/culture/article/20220107-is-this-the-worst-film-ever-made,Culture,Why Plan 9 from Outer Space was 'a truly eccentric labour of love'
Why we're in 'the age of fake islands',https://www.bbc.com/future/article/20220105-why-were-in-the-age-of-artificial-islands,Future,A visual tour of humanity's bold attempts to create artificial land
Are Gen Z the most pragmatic about sex?,https://www.bbc.com/worklife/article/20220104-are-gen-z-more-pragmatic-about-love-and-sex,Worklife,"Why younger people aren't ""committed to being committed"""
Delhi's foul air is rooted in India's water crisis,https://www.bbc.com/news/world-asia-india-59808770,India,Years of ill-conceived farming practices have contributed to India's worsening air pollution
Anger and confusion follow deadly Kazakh protests,https://www.bbc.com/news/world-asia-59928856,Asia,"Violent protests have left Kazakhstan stunned and angry, the BBC's Abdujalil Abdurasulov finds"
Aussie-UK couple marry after 20 months apart,https://www.bbc.com/news/uk-england-beds-bucks-herts-59910762,UK,"The couple say it is ""brilliant"" to finally be wed after ""a lot of challenges"" due to Covid"
The big question for lithium batteries,/future/article/20220105-lithium-batteries-big-unanswered-question,,
The new use for abandoned oil rigs,/future/article/20210126-the-richest-human-made-marine-habitats-in-the-world,,
The sector behind a third of our waste,/future/article/20211215-the-buildings-made-from-rubbish,,
Huge fossilised 'sea dragon' found in UK reservoir,https://www.bbc.com/news/science-environment-59915689,Science & Environment,The creature lived more than 90 million years ago
Samsung sees profit jump amid global chip shortage,/news/business-59904658,Business,
Golden Globes 2022: The winners and nominees,/news/entertainment-arts-59638152,Entertainment & Arts,
Man held for making app to auction Muslim women,/news/world-asia-india-59933029,India,
India begins booster shots amid Covid case surge,/news/world-asia-india-59933028,India,
Past seven years hottest on record - EU data,/news/science-environment-59915690,Science & Environment,
Colds may give some Covid protection - study,/news/health-59911257,Health,
Spectacular Northern Lights pictured over Scotland,/news/uk-scotland-59927887,Scotland,
Photographers capture wealth of wildlife on farm,/news/uk-england-cambridgeshire-59901503,Cambridgeshire,
Africa's top shots: Trumpeting Tutu and the New Year,/news/world-africa-59896920,Africa,
In pictures: Orthodox Christians celebrate Christmas,/news/in-pictures-59907964,In Pictures,
Astronomer hones star photo skills in lockdown,/news/uk-england-cambridgeshire-59820361,Cambridgeshire,
