title,href,tag,summary
Second batch of classified Biden documents found,/news/world-us-canada-64244007,US & Canada,"The original cache is under review by US prosecutors, in a political embarrassment for the White House."
Russia replaces commander of Ukraine invasion force,/news/world-europe-64235713,Europe,
"Iran ready to execute British citizen, family say",https://www.bbc.com/news/world-middle-east-64240226,Middle East,
Collapsed crypto giant FTX recovers $5bn of assets,https://www.bbc.com/news/business-64245044,Business,
"Canada's 1,300km Atlantic rail route",https://www.bbc.com/travel/article/20230111-canadas-1300km-atlantic-rail-route,Travel,
Jill Biden has surgery to remove cancerous skin lesions,/news/world-us-canada-64244008,US & Canada,"The lesions were consistent with basal cell carcinoma, the most common form of skin cancer."
From stranded Syrian refugee to Canadian citizen,/news/world-us-canada-64244006,US & Canada,Hassan al-Kontar was granted refugee status in Canada after a 2018 ordeal at a Malaysian airport.
Police name man allegedly stabbed to death by girls,/news/world-us-canada-64239686,US & Canada,"Ken Lee, 59, was fatally stabbed in Toronto in December, allegedly attacked by eight teenaged girls."
EFL Cup reaction & latest transfer news,/sport/live/football/64244597,Football,"Reaction to the EFL Cup quarter-finals, Premier League updates and the latest transfer news and gossip."
GB's Draper lands Nadal in Australian Open draw,/sport/tennis/64245608,Tennis,"Rising British star Jack Draper will play top seed Rafael Nadal in the Australian Open first round, with Andy Murray also handed a tough draw."
Saints stun Man City to move into EFL Cup semis,/sport/football/64159377,Football,Southampton stun Manchester City at St Mary's Stadium to move into the semi-finals of the EFL Cup.
ASMR: How whispering took over the internet,/reel/video/p0d95c27/asmr-how-whispering-took-over-the-internet,,
The surprising truth about newborn sleep,/reel/video/p0dvg85t/the-science-behind-healthy-baby-sleep,,
Vladimir Komarov: The cosmonaut who fell to Earth,/reel/video/p0dm6362/vladimir-komarov-the-cosmonaut-who-fell-to-earth,,
The best TV shows you missed in 2022,https://www.bbc.com/culture/article/20230111-seven-of-the-best-tv-shows-you-missed-in-2022,Culture,"The best under-the-radar series, including a spy thriller starring Gary Oldman"
What if all food was grown indoors?,https://www.bbc.com/future/article/20230106-what-if-all-our-food-was-grown-in-indoor-vertical-farms,Future,Might mangos and apples grow in high-rise city farms one day?
Denmark's surreal dining experience,https://www.bbc.com/travel/article/20230110-alchemist-is-this-the-worlds-most-creative-restaurant,Travel,"It goes far beyond the classic constellation of tablecloths, waiters and chefs"
The companies that burn out young grads,https://www.bbc.com/worklife/article/20230111-the-companies-that-churn-through-young-workers,Worklife,"""There was just a steady churn of young, impressionable workers"""
'Proud to see South Asians on Coachella line-up',https://www.bbc.co.uk/news/newsbeat-64237696,Newsbeat,"Joy Crookes, Punjabi singer Diljit Dosanjh and Ali Sethi from Pakistan are performing in April"
Why reporting on Iran comes at a heavy price,https://www.bbc.com/news/world-middle-east-64222261,Middle East,"BBC Persian journalists are trolled and harassed on a daily basis, and their families persecuted"
Supermodel Tatjana Patitz dies at 56,https://www.bbc.com/news/entertainment-arts-64240886,Entertainment & Arts,"Tatjana Patitz, one of the 1990's most prominent supermodels, died in California"
An answer to India's flower waste,/future/article/20221208-fleather-the-vegan-leather-made-of-indias-flower-waste,,
In defence of real Christmas trees,/future/article/20221213-why-christmas-trees-may-be-good-for-the-environment,,
What would a green World Cup look like?,/future/article/20221206-what-would-a-green-world-cup-look-like,,
Guitar legend Jeff Beck dies aged 78,/news/entertainment-arts-64228780,Entertainment & Arts,"One of rock's most influential guitarists, he was inducted to the Rock and Roll Hall of Fame twice."
Leftover Covid swabs to be tested for other viruses,/news/health-64209168,Health,
Goldman Sachs starts massive round of job cuts,/news/business-64234129,Business,
Royal Mail overseas post disrupted by cyber incident,/news/business-64231473,Business,
Film company seeks funding for Macbeth adaptation,/news/uk-england-northamptonshire-64237978,Northampton,
UAE names oil chief to lead COP28 climate talks,/news/science-environment-64240206,Science & Environment,
UK investor reported losing £1m in FTX collapse,/news/technology-64225276,Technology,
Golden Globes: The red carpet in pictures,/news/entertainment-arts-64226431,Entertainment & Arts,
Repairing broken gadgets for a better future,/news/in-pictures-63737951,In Pictures,
Mastectomy photo project aims to empower women,/news/uk-england-manchester-64055153,Manchester,
In Pictures: Orthodox Christians mark Christmas,/news/world-64194408,World,
In photos: Severe cold wave grips north India,/news/world-asia-india-64143204,India,
