title,href,tag,summary
Rescuers inch nearer to boy stuck in well for days,/news/world-africa-60244091,Africa,"The five-year-old boy, Rayan, fell into the well while playing in the Moroccan town of Tamorot."
Former minister joins calls for PM to resign,/news/uk-politics-60268378,UK Politics,
GoFundMe seizes funds of Canada truck 'occupation',/news/world-us-canada-60267840,US & Canada,
Winter Olympics: GB's Treacy brothers fail to qualify in 1000m speed skating heats - watch & follow text,/sport/live/winter-olympics/60015446,Sport,
"FA Cup fourth round: Watch Kidderminster v West Ham, plus updates from Chelsea v Plymouth",/sport/live/football/59989010,Football,
Trump was wrong to seek to stop Biden win - Pence,/news/world-us-canada-60266121,US & Canada,Mike Pence issues his strongest rebuttal of Donald Trump's claim over the 2021 election result.
US gun group defends armed man killed by police,/news/world-us-canada-60268142,US & Canada,"Amir Locke, 22, was shot while lying on a couch with a gun in his hand, police video shows."
The tense moment police save a dog from a car fire,/news/world-us-canada-60269278,US & Canada,Police bodycam footage shows a dramatic dog rescue in the US state of Colorado.
Langer resigns as Australia coach,/sport/cricket/60269322,Cricket,Justin Langer resigns as coach of the Australia men's team after rejecting a short-term contract extension.
'Magic of the FA Cup alive and kicking',/sport/football/60268405,Football,"Middlesbrough's stunning win at Old Trafford shows the magic of the FA Cup is alive and kicking, but what next for Manchester United after their exit?"
Triple Olympic champion White to retire,/sport/winter-olympics/60270755,Sport,Three-time Winter Olympic snowboarding champion Shaun White says he will retire from the sport after the Games in Beijing.
Why people settle for romantic partners,https://www.bbc.com/worklife/article/20220124-why-people-arent-as-picky-in-love-as-they-think,Worklife,The surprising truth about how we pursue relationships
10 films to watch this February,https://www.bbc.com/culture/article/20220127-10-films-to-watch-this-february,Culture,"Including a space disaster movie, a Kanye West documentary and Jackass' return"
North Africa's ancient convenience food,https://www.bbc.com/travel/article/20220130-bsissa-north-africas-newest-breakfast-trend,Travel,It's becoming increasingly popular as a health food
The unexpected aftermath of a toppled Bristol statue,/reel/video/p0bm2slm/the-slave-trader-s-statue-that-divided-a-city,,
"Love, life and iconic images from the New York City subway",/reel/video/p0bllp4k/the-iconic-images-capturing-the-magic-of-the-80s,,
The Templar secret lurking beneath an Italian town,/reel/video/p08nysf4/the-templar-town-with-a-hidden-underground-twin-,,
The nation that's banishing light,https://www.bbc.com/travel/article/20220202-saving-the-night-sky-new-zealands-craziest-experiment-yet,Travel,Is this New Zealand's craziest experiment yet?
The climate benefits of tiny islands,https://www.bbc.com/future/article/20220131-the-worlds-tiny-islands-inspiring-green-action,Future,Small island communities have been pioneers the green transition
10 TV shows to watch this February,https://www.bbc.com/culture/article/20220203-10-tv-shows-to-watch-this-february,Culture,Including a gritty Fresh Prince reboot and the final series of Killing Eve
The brain quirk that ruins future plans,https://www.bbc.com/worklife/article/20220201-how-thinking-about-future-you-can-build-a-happier-life,Worklife,"How imagining who we'll be in 10 years builds happiness, health and wealth"
Quiz of the week: Who followed Neil Young off Spotify?,https://www.bbc.com/news/world-60248652,World,How closely have you been paying attention to what's been going on during the past seven days?
Why morning light is so crucial to your health,https://www.bbc.com/ideas/videos/why-morning-light-is-so-crucial-to-your-health/p0bl8d5w,Ideas,How morning light can help regulate our sleep patterns
The Olympic sport for people who love food,https://www.bbc.co.uk/food/articles/winter_olympic_food,Food,"""It's meat, carbs, veg - a balanced diet and lots of it"""
How a desert city holds back its sand,/future/article/20220125-how-dubai-is-pushing-back-its-encroaching-deserts,,
The 'outrageous' green plan for coal,/future/article/20220118-the-environmental-case-for-buying-a-coal-mine,,
The rhino that became an icon for peace,/future/article/20220111-the-rhinos-bringing-peace-in-india,,
How a three-month old album topped this week's chart,/news/newsbeat-60261266,Newsbeat,It's taken Don Broco until 2022 to release physical versions of their album - and the wait paid off.
India's Twitter alternative with global ambitions,/news/world-asia-india-60194920,India,
Iceland signals end to whaling within two years,/news/world-europe-60265085,Europe,
Meta moves to tackle creepy behaviour in VR,/news/technology-60247542,Technology,
South Africa makes its own version of Moderna jab,/news/health-60258088,Health,
UK approves fifth Covid-19 vaccine,/news/health-60245736,Health,
"Everest's highest glacier melting fast, study says",/news/world-asia-60259427,Asia,
Ice diving and dragons - photos from around the world,/news/in-pictures-60262132,In Pictures,
Africa's top shots: Cowboys and beach burials,/news/world-africa-60243953,Africa,
In Pictures: Lunar New Year 2022,/news/in-pictures-60209010,In Pictures,
In Pictures: US cities clear up after big freeze,/news/world-us-canada-60190444,US & Canada,
Photographs capture city's Covid-19 response,/news/uk-england-tyne-60131496,Tyne & Wear,
