title,href,tag,summary
Ukraine leader rebukes Nato refusal on no-fly zone,/news/live/world-europe-60532634,Europe,"President Zelensky says the West just gave ""the green light for further bombing of Ukrainian cities""."
"'My city's being shelled, but mum won’t believe me'",/news/world-europe-60600487,Europe,
Facebook hits out at Russia blocking its platforms,/news/technology-60626777,Technology,
Australia legend Warne dies aged 52,/sport/cricket/60622426,Cricket,
Death sentence reinstated for Boston bomber,/news/world-us-canada-60624642,US & Canada,
BBC News director on decision to suspend work in Russia,/news/world-60626352,World,"Jonathan Munro says the BBC has a responsibility to audiences, but also for the safety of journalists."
China Premier League coverage pulled,/sport/football/60524865,Football,China's rights holders have pulled Premier League coverage for this weekend over support for Ukraine.
Game Of Thrones actor John Stahl dies aged 68,/news/uk-scotland-tayside-central-60624212,Tayside and Central Scotland,The Scottish actor was also well known for playing Inveradarroch in soap opera Take The High Road.
'Adulation and scandal... but arguably cricket's best ever bowler' - Warne obituary,/sport/cricket/60624556,Cricket,"Why Shane Warne was one of cricket's greatest ever players, and also one of its most colourful characters."
Tributes paid to 'greatest showman' Warne,/sport/cricket/60626656,Cricket,"Australia Test captain Pat Cummins calls Shane Warne a ""once-in-a-century cricketer"" as he leads tributes to the iconic leg-spinner who died on Friday aged 52."
Zinchenko on 'mission' to reveal truth,/sport/football/60623061,Football,Oleksandr Zinchenko thanks the world for standing with Ukraine in an emotional interview with BBC Sport.
The best age to learn to read,https://www.bbc.com/future/article/20220228-the-best-age-for-learning-to-read,Future,How early literacy can have lifelong consequences
Why office romance is inevitable,https://www.bbc.com/worklife/article/20220228-the-inevitability-of-the-office-romance,Worklife,Why work is a prime breeding ground for relationships and hook-ups
A radical 1971 film that rewrote the western,https://www.bbc.com/culture/article/20220302-zachariah-the-1971-western-that-celebrated-male-intimacy,Culture,How Zachariah embraced intimate male friendship
The 'shocking' male sacrifice made for a Roman goddess,/reel/video/p0bsfp1y/the-goddess-who-changed-the-course-of-roman-history,,
The deadly toxin found in the world's oldest mummies,/reel/video/p0br366s/life-beyond-death-in-the-driest-place-on-earth,,
Why pleasure is key to losing weight,/reel/video/p0brtrb1/why-pleasure-is-key-to-losing-weight,,
Why this iconic monster is so scary,https://www.bbc.com/culture/article/20220303-nosferatu-the-monster-who-still-terrifies-100-years-on,Culture,"How the vampire from silent horror Nosferatu still terrifies, 100 years on"
The myths of 21st Century friendship,https://www.bbc.com/future/article/20220302-the-myths-and-reality-of-modern-friendship,Future,Is modern life really changing how we connect with each other?
Is this Britain's 'Atlantis'?,https://www.bbc.com/travel/article/20220227-dunwich-the-british-town-lost-to-the-sea,Travel,Scientists have discovered that it's more than just a legend
The rise of 'solo polyamory',https://www.bbc.com/worklife/article/20220301-does-solo-polyamory-mean-having-it-all,Worklife,"""I felt like monogamy would deny me something of myself"""
How your diet can treat diseases,https://www.bbc.com/future/bespoke/follow-the-food/how-your-diet-can-treat-diseases/,Follow The Food,The food we eat is one of the leading causes of illness
News quiz: Who had the year's most played record?,https://www.bbc.com/news/world-60568309,World,How closely have you been paying attention to the headlines?
Drop the mic and jump the shark: Idioms explained,https://www.bbc.co.uk/programmes/articles/gWzWGBZ3GkZ3VwH3GTN266/dropping-the-mic-and-jumping-the-shark,Radio 4,Modern idioms and where they came from
The puzzle of Mexico's ageing oaks,/future/article/20220222-the-mystery-of-mexicos-vanishing-stream-oaks,,
The animal 'sixth sense' for disaster,/future/article/20220211-the-animals-that-predict-disasters,,
The country embracing life on water,/future/article/20220202-floating-homes-the-benefits-of-living-on-water,,
India TV host yells at wrong man on Ukraine debate,https://www.bbc.com/news/world-asia-india-60614274,India,Rahul Shivshankar only realised his mistake when his perplexed guest spoke up
US jobs growth stronger than expected,/news/business-60621578,Business,
Bolton and Sisqó to compete in US Eurovision,/news/entertainment-arts-60619976,Entertainment & Arts,
Abandoned rocket 'hits the Moon' - scientists,/news/science-environment-60596449,Science & Environment,
Ukraine says it is fighting first 'hybrid war',/news/technology-60622977,Technology,
Another life-saving Covid drug identified,/news/health-60601750,Health,
Oxygen stocks running dangerously low in Ukraine,/news/health-60555228,Health,
In pictures: Russia intensifies attacks on Ukraine,/news/in-pictures-60601185,In Pictures,
"Africa's top shots: Bikes, blocks and borders",/news/world-africa-60599941,Africa,
In pictures: Kyiv under attack,/news/in-pictures-60536824,In Pictures,
In pictures: Destruction and fear as war hits Ukraine,/news/in-pictures-60505277,In Pictures,
Taking a photo every day at 12.34pm for 10 years,/news/uk-england-london-60471272,London,
