title,href,tag,summary
Danish police cannot rule out terror in mall attack,/news/live/world-europe-62031793,Europe,"Police say they cannot rule out the shooting being an act of terrorism, as a 22-year-old man is charged."
Gunman kills three in Danish shopping mall,/news/world-europe-62030919,Europe,
Three police die in 'pure hell' Kentucky shooting,/news/world-us-canada-62025539,US & Canada,
Leclerc admits Ferrari problems are ‘not good’,/sport/formula1/62031437,Formula 1,
Panic as people flee gunfire in Copenhagen mall,/news/world-europe-62032113,Europe,
Ukraine confirms Lysychansk captured by Russians,/news/world-europe-62030051,Europe,Ukraine says it pulled its troops out and Russia claims to control all of Luhansk region.
Video captures moment glacier collapses in Italian alps,/news/world-europe-62030708,Europe,Five people were killed in an avalanche sparked by the glacier collapse on the Marmolada mountain.
Kyrgios and Tsitsipas both fined over conduct,/sport/tennis/62031962,Tennis,Nick Kyrgios and Stefanos Tsitsipas are fined for their conduct during their fiery third-round match at Wimbledon.
"Go Jonny, go - Bairstow's love affair with Bazball",/sport/cricket/62030245,Cricket,"Jonny Bairstow's stellar form is a product of feeling valued, supported and important in the England team, says chief cricket writer Stephan Shemilt."
Djokovic sees off Van Rijthoven to make last eight,/sport/tennis/62030164,Tennis,Defending champion Novak Djokovic continues his pursuit of a seventh Wimbledon title as he beats Tim van Rijthoven to reach the quarter-finals.
F1 must learn from Zhou crash - Russell,/sport/formula1/62031509,Formula 1,George Russell says Formula 1 needs to learn lessons from the crash in which Zhou Guanyu's Alfa Romeo vaulted a barrier at Silverstone.
How a scandal in Kosovo led to the UN's first official 'informant',/reel/video/p0chw9r3/the-un-s-first-whistleblower,,
The English garden growing the world's deadliest plants,/reel/video/p0cj109h/the-deadly-plants-hiding-in-your-garden,,
The physics that suggests we have no free will,/reel/video/p086tg3k/the-physics-that-suggests-we-have-no-free-will,,
How heatwaves are killing pollen,https://www.bbc.com/future/article/20220701-how-heatwaves-are-creating-a-pollen-crisis,Future,"On the hottest days, plants struggle to be fertilised, affecting important crops"
The end of 'mandatory office fun',https://www.bbc.com/worklife/article/20220517-the-death-of-mandatory-fun-in-the-office,Worklife,"Why ""the inane office 'fun' of yesteryear has wholly passed"""
8 TV shows to watch this July,https://www.bbc.com/culture/article/20220629-8-of-the-best-tv-shows-to-watch-this-july,Culture,Including a TV series of Resident Evil and a sitcom starring Neil Patrick Harris
An isle with one dish to call its own,https://www.bbc.com/travel/article/20220703-the-taste-of-tobago-in-just-one-dish,Travel,Just don't try to eat it with a knife and fork
Why the world's tallest trees are dying,https://www.bbc.com/future/article/20220623-the-genetic-power-of-ancient-trees,Future Planet,Ancient trees may hold the key to saving our forests from climate change
Easy chicken bakes for midweek meals,https://www.bbc.co.uk/food/collections/easy_chicken_traybakes,Food,Top one-pan chicken recipes that are perfect for midweek meals
The freaky world of fractals,https://www.bbc.com/ideas/videos/the-freaky-world-of-never-ending-fractals/p07vddcn,Ideas,"What is a fractal, and how can they help us understand the universe?"
The promise of a world without roads,/future/article/20220621-what-if-roads-went-underground,,
The English town that welcomed the dark,/future/article/20220614-the-crusade-for-darker-night-skies,,
Could we live without plastic?,/future/article/20220526-what-would-happen-if-we-stopped-using-plastic,,
'Every mineral has a history and a story to tell',/news/science-environment-62013806,Science & Environment,From using penguin poo to coal fire - nature has many ways to generate minerals on and off Earth.
The retailers setting up shop in the metaverse,https://www.bbc.co.uk/news/business-61979150,Business,
North Korea claims Covid arrived on 'alien things',/news/world-latin-america-62005220,Asia,
Railway Children station hosts sequel premiere,/news/entertainment-arts-62014506,Entertainment & Arts,
How much plastic 'recycling' is actually recycled?,/news/science-environment-62013030,Science & Environment,
Army's YouTube and Twitter accounts hacked,/news/uk-62030644,UK,
Biden vows to protect women travelling for abortion,/news/world-us-canada-62018206,US & Canada,
"A mud bath, mosaics and other photos from the week",/news/in-pictures-62009739,In Pictures,
Welsh journalist shares photos of Ukraine horrors,/news/uk-wales-61965919,Wales,
Pride at 50: Rare photos of early marches,/news/in-pictures-61813459,In Pictures,
Have teenage kicks changed over the years?,/news/entertainment-arts-61968340,Entertainment & Arts,
"Africa's top shots: Tasting, dancing and baking",/news/world-africa-61993604,Africa,
