title,href,tag,summary
Biden sanctions Russia over 'beginning of invasion',/news/world-europe-60488037,Europe,"The US president says he will go after Russia's Western financing and the country's ""elites""."
Full-scale invasion 'likely' within 24 hours - Australia,/news/live/world-europe-60454795,Europe,
Armed hostage situation at Apple Amsterdam shop,/news/world-europe-60486726,Europe,
Will more police flatten New York's crime wave?,/news/world-us-canada-60484459,US & Canada,
Mickelson sorry for 'reckless' comments,/sport/golf/60487858,Golf,
Bear named 'Hank the Tank' wanted by US police,/news/world-us-canada-60486984,US & Canada,The black bear has broken into dozens of California homes due to his raging appetite for human food.
Tonga internet link restored after eruption,/news/world-asia-60458303,Asia,The Pacific island nation was cut off from the world for weeks after an undersea volcano erupted.
Mandatory Covid tests for all Hong Kong residents,/news/world-asia-china-60467039,China,All 7.5 million residents must undergo testing as the city battles surging infection rates.
Juve draw despite early Vlahovic goal,/sport/football/60465278,European Football,Dusan Vlahovic scores the quickest Champions League debut goal ever but Juventus are pegged back to draw at Villarreal.
Chelsea take command of last-16 tie,/sport/football/60465271,European Football,Title holders Chelsea take command of their Champions League last-16 tie against Lille with a comfortable first-leg victory at Stamford Bridge.
Tuilagi set to start for England,/sport/rugby-union/60486587,Rugby Union,Centre Joe Marchant has been left out of England's 25-man squad to face Wales at Twickenham on Saturday - with Manu Tuilagi set to start in the midfield.
Why won't you take my naked photos down?,/reel/video/p0bqhsh0/telegram-why-won-t-you-take-my-nudes-down-,,
The first fully automated farms,/reel/video/p0bkdc02/the-first-fully-automated-farms,,
The gruesome discovery of a huge tower of human skulls,/reel/video/p09x1374/the-huge-tower-of-human-skulls-unearthed-in-mexico-city,,
Why we've got the Vikings wrong,https://www.bbc.com/culture/article/20220222-netflixs-vikings-valhalla-why-weve-got-the-vikings-wrong,Culture,Popular culture's images of marauding pagans are misleading
How to green your pension,https://www.bbc.com/future/article/20220218-how-i-made-my-pension-sustainable,Future,Your pension might be having a surprising impact on the climate
Australia's X-rated underwater show,https://www.bbc.com/travel/article/20220221-australias-x-rated-underwater-show,Travel,The phenomenon attracts tourists and researchers from across the world
Are 'kids these days' truly weaker?,https://www.bbc.com/worklife/article/20220218-are-younger-generations-truly-weaker-than-older-ones,Worklife,Addressing the common perception of 'entitled' millennials and 'woke' Gen Z
USA women reach equal pay agreement,https://www.bbc.com/sport/football/60480155,Women's Football,United States forward Alex Morgan says an agreement with governing body US Soccer over equal pay is...
'I have to live in an Airbnb in my hometown',https://www.bbc.com/news/uk-60433654,UK,No-fault evictions and a boom in holiday lets have led to locals facing homelessness
"War, sickness and love in rebel-held Ukraine",https://www.bbc.com/news/world-europe-60460003,Europe,Orla Guerin talks to people who cross military checkpoints for medical treatment
The mystery of Mexico's relict oaks,/future/article/20220222-the-mystery-of-mexicos-vanishing-stream-oaks,,
The animal 'sixth sense' for disaster,/future/article/20220211-the-animals-that-predict-disasters,,
The country embracing life on water,/future/article/20220202-floating-homes-the-benefits-of-living-on-water,,
EasyJet boss: 'Make difficult decisions in the morning',https://www.bbc.co.uk/news/av/business-60484839,Business,"Johan Lundgren, CEO of the airline EasyJet, shares his business advice for the CEO Secrets series."
Screaming Trees frontman Mark Lanegan dies aged 57,/news/entertainment-arts-60487917,Entertainment & Arts,
Dog kennel hit by meteorite up for auction,/news/science-environment-60468427,Science & Environment,
EU cyber rapid-response team to help Ukraine,/news/technology-60484979,Technology,
Malawi finds Africa’s first wild polio case in years,/news/world-africa-60429726,Africa,
Spring Covid booster for over-75s and high risk,/news/uk-60465983,UK,
Fossil of huge Jurassic flying lizard found in UK,/news/science-environment-60407928,Science & Environment,
England's Big Picture: Images of the nation,/news/uk-england-60455065,England,
In pictures: Storm Eunice reaches the UK,/news/in-pictures-60428222,In Pictures,
Africa's top shots: Watchful eyes and wonky houses,/news/world-africa-60414123,Africa,
Exhibition to celebrate people of the Commonwealth,/news/uk-england-birmingham-60390827,Birmingham & Black Country,
Artist creates Valentine's Day light paintings,/news/uk-england-essex-60374371,Essex,
