title,href,tag,summary
Hundreds leave Gaza hospital as many feared killed at UN shelter,/news/world-middle-east-67462615,Middle East,Israel denied forcing people out of al-Shifa on foot and did not confirm it had hit al-Fakhoura shelter.
"China navy used sonar pulses against divers, Australia says",https://www.bbc.com/news/67461081,Australia,
AI boss Sam Altman ousted after board loses confidence,https://www.bbc.com/news/business-67458603,Business,
A billion Indians hope for cricket World Cup glory,https://www.bbc.com/news/live/world-asia-india-67447161,Cricket,
Bringing back the forest giants,https://www.bbc.com/future/article/20231113-bringing-back-californias-redwood-forests,Future Planet,
Biden facing internal dissent over Israel's Gaza campaign,/news/world-us-canada-67453674,US & Canada,It has stirred an extraordinary level of criticism from within the president’s own administration.
X ad boycott gathers pace amid antisemitism storm,/news/world-us-canada-67460386,US & Canada,"US firms, including Apple and Disney, are reportedly suspending ads on the Elon Musk-owned site."
Biden has a response for your jokes about his age,/news/world-us-canada-67459287,US & Canada,"The president, soon to turn 81, is the oldest in US history, but he has learned to defuse concerns about his age with humour."
India seek immortality in World Cup final against Australia,/sport/cricket/67460793,Cricket,"Australia know what to expect from a partisan crowd in Sunday's World Cup final, but the underdogs have enough to ensure an India win is not yet certain."
Why Everton sanction sent shockwaves through Premier League,/sport/football/67459084,Football,"With an appeal to come, plus pending financial cases against Manchester City and Chelsea, at look at why Everton's points deduction sent shockwaves through the Premier League."
Wales dealt big Euros blow with draw in Armenia,/sport/football/67388344,Football,Wales' hopes of automatic qualification for Euro 2024 suffered a devastating blow as they are held 1-1 by Armenia in Yerevan.
How I reduced my pets' carbon paw print,https://www.bbc.com/future/article/20231115-how-i-made-my-pets-more-environmentally-friendly,Future Planet,How I made my pets more environmentally friendly
The scandalous queens of 1910s New York,https://www.bbc.com/culture/article/20231114-radicals-and-rogues-these-subversive-1910s-women-made-new-york-cool-but-were-written-out-of-history,Culture,These radical women artists shocked – and made the city cool
The eight best photo-ops in NYC,https://www.bbc.com/travel/article/20231115-discover-the-eight-best-photo-ops-in-new-york-city,Travel,"From Instagram favourites to hidden gems, head here for unforgettable shots"
Why polar bears were once climate icons,/future/article/20231113-climate-change-why-photos-of-polar-bears-dont-work,,
The mirrors cooling Sierra Leone,/future/article/20231109-how-africas-first-heat-officer-is-protecting-women-in-sierra-leone,,
How bubble veils muffle wind farm noise,/future/article/20231106-the-big-bubble-curtains-protecting-porpoises-from-wind-farm-noise,,
South Korea's answer to tonkatsu,https://www.bbc.com/travel/article/20231117-donkkaseu-an-old-school-korean-pork-chop,World's Table,"It's sweet, savoury, bitter and spicy"
How Walt Disney came back from ruin,https://www.bbc.com/culture/article/20231117-steamboat-willie-how-walt-disney-came-back-from-ruin,Culture,The brain wave that transformed Walt Disney's life
How did 'ESG' become meaningless?,https://www.bbc.com/worklife/article/20231114-how-esg-came-to-mean-everything-and-nothing,Worklife,"How the business term ""ESG"" came to mean everything and nothing"
How clocks have shaped civilisation,https://www.bbc.com/future/article/20231117-how-clocks-and-watches-have-shaped-civilisation,Future,The methods we use to keep track of time have evolved enormously over millennia
Berlin's stunning indoor public pools,https://www.bbc.com/travel/article/20231116-the-hidden-beauty-of-berlins-indoor-pools,Travel,They date from the 1800s and feel like you're swimming in an ornate library
Rare whisky becomes world's most expensive at £2.1m,https://www.bbc.com/news/uk-scotland-67466202,Scotland,The Macallan 1926 single malt is one of the world's most sought-after bottles of Scotch whisky
The man who reached the deepest place on Earth,https://www.bbc.com/news/science-environment-67445718,Science & Environment,The story of Captain Don Walsh and his 11km journey to the bottom of the Mariana Trench
Shukubo: Japan's temples offering a taste of monastic living,/reel/video/p0gfhc2w/shukubo-japan-s-temples-offering-a-taste-of-monastic-living,,
A day in the life of the Black Mambas,/reel/video/p0gqnp2h/a-day-in-the-life-of-the-black-mambas,,
What's the best way to become really strong?,/reel/video/p0gsfwky/what-s-the-best-way-to-become-really-strong-,,
Napoleon's Ridley Scott on critics and cinema 'bum ache',/news/entertainment-arts-67419876,Entertainment & Arts,"The director says his response to criticism from historians about his film would ""have a bleep in..."
Pair of swan sweethearts make latest UK return,/news/science-environment-67407574,Science & Environment,
Russian Carlsberg staff arrested after business seized,/news/business-67436369,Business,
"Flowers, protest and parade: Photos of the week",/news/in-pictures-67449995,In Pictures,
Gaza hospital boss says no water or oxygen left,/news/world-middle-east-67442045,Middle East,
Ralph Fiennes on the politicians who inspired his Macbeth,/news/entertainment-arts-67442687,Entertainment & Arts,
Apple to cross message divide but green bubbles stay,/news/technology-67451724,Technology,
Capturing hidden Wales,/newyddion/67453980,Cylchgrawn,
Africa's top shots: Pirates and paper doves,/news/world-africa-67440655,Africa,
"Royals, rallies and regattas: Africa's top shots",/news/world-africa-67342719,Africa,
King Charles III delivers speech at State Opening of Parliament,/news/uk-politics-67344490,UK Politics,
Damage and disruption: Storm Ciarán in pictures,/news/in-pictures-67298061,In Pictures,
