title,href,tag,summary
Crimea fightback having 'psychological impact' on Russia,/news/world-europe-62608526,Europe,Western officials reveal the impact of recent Ukrainian strikes on the Russian-occupied peninsula.
Finnish PM reveals she has taken drug test,https://www.bbc.com/news/world-europe-62608831,Europe,
Billionaire jailed for 13 years in China,https://www.bbc.com/news/world-asia-china-62605879,China,
Evangelista on Vogue cover after being 'deformed',https://www.bbc.com/news/entertainment-arts-62601679,Entertainment & Arts,
Man Utd agree £70m Casemiro deal with Real Madrid,https://www.bbc.com/sport/football/62608356,Sport,
Ex-Briton 'Isis Beatle' sentenced to life in prison,/news/world-us-canada-62609217,US & Canada,"Elshafee El Sheikh, 34, was found guilty in April of kidnapping and supporting a terrorist group."
'Four hours with the militant who murdered my son',/news/world-us-canada-62440920,US & Canada,The mum of an American journalist beheaded by the Islamic State met her son's killer to forgive him.
Possible breakthrough to destroy 'forever chemicals',/news/science-environment-62561756,Science & Environment,US scientists have discovered a low-cost method for destroying chemicals associated with cancer.
England will not change approach - Stokes,/sport/cricket/62611549,Cricket,Ben Stokes says England will not change their style despite being thrashed by South Africa in the first Test.
Superstar or superflop? Will Casemiro fit Man Utd?,/sport/football/62603699,Football,Manchester United are closing in on the signing of Real Madrid midfielder Casemiro. Guillem Balague tells United fans what to expect.
Joshua 23lbs heavier than Usyk for rematch,/sport/boxing/62602133,Boxing,British challenger Anthony Joshua weighs in 23lbs heavier than Oleksandr Usyk for their heavyweight rematch on Saturday night in Saudi Arabia.
The secret lives of Yakuza women,/reel/video/p0816p3b/the-secret-lives-of-yakuza-women,,
Is a vegan diet healthier than eating meat and dairy?,/reel/video/p0b5x2z7/is-a-vegan-diet-healthier-than-eating-meat-and-dairy-,,
What is 'dopamine fasting' and how could it benefit you?,/reel/video/p0ct66jj/is-dopamine-fasting-good-for-you-,,
Can Hawaii solve a global food crisis?,https://www.bbc.com/travel/article/20220818-ahupuaa-hawaiis-ancient-land-management-system,Travel,The ancient system could set the world on a new path to sustainability
Why workers are still quitting,https://www.bbc.com/worklife/article/20220817-why-workers-just-wont-stop-quitting,Worklife,Why the Great Resignation isn’t over yet
A pizza topping that divides the world,https://www.bbc.com/future/article/20220818-why-is-ham-and-pineapple-pizza-so-controversial,Future,The science behind a sweet foil to salty ham
A prequel that deserves the hype,https://www.bbc.com/culture/article/20220818-house-of-the-dragon-review-its-pure-game-of-thrones,Culture,House of the Dragon is 'a darker Game of Thrones'
Seal breaks into New Zealand home and explores it,https://www.bbc.com/news/world-asia-62608162,Asia,"The curious seal, nicknamed Oscar, is thought to have squeezed through the cat flaps on its..."
"Drink more alcohol, Japan tells youth",https://www.bbc.com/news/world-asia-62585809,Asia,The government's tax agency is encouraging a new generation of sake drinkers
Why more people are working from home on Fridays,https://www.bbc.com/news/business-62560520,Business,After work drinks could be fizzling out on Fridays
The elephant buses safeguarding kids,/future/article/20220816-the-botswana-buses-tackling-human-elephant-conflict,,
The crab invading the Mediterranean,/future/article/20220809-how-the-mediterranean-became-the-worlds-most-invaded-sea,,
Scotland's most misunderstood landscape,/future/article/20220802-climate-change-the-promise-and-danger-of-scotlands-peat,,
Critics give verdicts on Game of Thrones prequel,/news/entertainment-arts-62603029,Entertainment & Arts,"Reviews are split on whether House of the Dragon is ""a smashing success"" or ""surprisingly..."
UK first country to approve dual-strain Covid jab,/news/health-62548336,Health,
Crops 'made better' at using sunlight to grow,/news/science-environment-62592286,Science & Environment,
Andrew Tate banned from Facebook and Instagram,/news/technology-62602913,Technology,
Keeping Up Appearances actress Tewson dies at 91,/news/entertainment-arts-62605184,Entertainment & Arts,
Did Freya the 94-stone walrus have to die?,/news/world-europe-62556295,Europe,
'I'm a different person after having monkeypox',/news/world-us-canada-62438263,US & Canada,
First saved images from vast photo archive shared,/news/uk-england-merseyside-62591866,Liverpool,
Africa's top shots: Crowning queens and coming of age,/news/world-africa-62588364,Africa,
Shortlist for crime writer's photo prize announced,/news/uk-england-tyne-62552361,Tyne & Wear,
In pictures: Stunning Sturgeon Moon lights up skies,/news/in-pictures-62518102,In Pictures,
"In pictures: Heatwaves, drought and wildfires",/news/in-pictures-62497772,In Pictures,
