title,href,tag,summary
Prigozhin confirmed dead in plane crash - Moscow,/news/world-europe-66632924,Europe,"Genetic analysis of the bodies was carried out following Wednesday's crash, Russian officials say."
Taliban ban women from visiting popular national park,https://www.bbc.com/news/world-asia-66633178,Asia,
Trump campaign raises $7.1m after historic mugshot,https://www.bbc.com/news/world-us-canada-66632882,US,
Premier League: Gordon gives Newcastle lead & Van Dijk sent off,/sport/live/football/66301994,Football,
The mystery of what causes ALS,https://www.bbc.com/future/article/20230825-the-mystery-of-why-some-people-develop-als,Future,
The indiscriminate devastation of Canada's wildfires,/news/world-us-canada-66620230,US & Canada,"Fires in western Canada have burned homes and ripped up trees, laying them down ""like toothpicks""."
Spanish FA activates sexual violence protocol,/sport/football/66633123,Football,An internal investigation is launched at Spain's football federation after its sexual violence protocol is activated.
"Haiti gang opens fire on protesters, killing seven",/news/world-latin-america-66631188,Latin America & Caribbean,"Soaring gang violence in Haiti has left more than 2,400 people dead in 2023 alone."
Dutch Grand Prix - Verstappen takes record-equalling ninth victory in a row,/sport/live/formula1/63208374,Formula 1,Follow live text and BBC Radio 5 Sports Extra commentary from the Dutch Grand Prix at Zandvoort.
"European football: Bayern goalless, Barca lead Villarreal",/sport/live/football/66633738,European Football,Follow live text coverage as Bayern Munich face Augsburg in the Bundesliga & Villarreal face Barcelona in La Liga.
Watch: Brave beat Superchargers to win first women's Hundred title - reaction,/sport/live/cricket/66527362,The Hundred,Watch live coverage and follow text and radio commentary from finals day in the 2023 Hundred at Lord's.
Why fans remain loyal to 'cringey' show,https://www.bbc.com/culture/article/20230824-and-just-like-that-series-2-finale-how-the-sex-and-the-city-sequel-became-the-ultimate-cringe-watch,Culture,How And Just Like That series 2 was mocked and loved in equal measure
Five top countries for expats in 2023,https://www.bbc.com/travel/article/20230822-five-of-the-best-countries-for-expats-in-2023,Travel,"From Malaysia to Mexico, residents explain what makes them love their new home"
Will empty offices stay ghost towns?,https://www.bbc.com/worklife/article/20230817-major-cities-are-now-with-filled-with-empty-office-buildings-what-happens-next,Worklife,"Once bustling high-rises are now scarcely used, if not vacant. What's next?"
Are we bracing for a new Sandy?,/reel/video/p0g8hx9j/are-we-bracing-for-a-new-hurricane-sandy-,,
Three lunar dilemmas unraveling the mysteries of our own planet,/reel/video/p0g8d11j/three-unsolved-mysteries-of-the-moon,,
The first police officer to arrest a US president,/reel/video/p0fds9ky/the-first-police-officer-to-arrest-a-us-president,,
The unbuilt rival to the Panama Canal,https://www.bbc.com/future/article/20230825-the-rival-to-the-panama-canal-that-was-never-built,Future,Does shipping need an alternative route across the Americas?
The 7 best dive bars in New York City,https://www.bbc.com/travel/article/20230825-discover-new-york-citys-seven-best-dive-bars,Travel,These beloved holdouts embody NYC's spirit
The 'apology fatigue' of social media,https://www.bbc.com/worklife/article/20230821-why-you-rarely-believe-celebrity-apologies-on-social-media,Worklife,Public figures issue an endless stream of apologies. They usually flop
11 best TV shows to watch in September,https://www.bbc.com/culture/article/20230824-from-top-boy-to-sex-education-11-of-the-best-tv-shows-to-watch-in-september,Culture,From Top Boy and Sex Education to The Other Black Girl
The K-pop girl group with no Korean members,https://www.bbc.com/news/world-asia-66541773,Asia,The multinational girl group has sparked a debate about whether they can truly be considered K-pop
Bullets unearthed from mass execution of German prisoners in WW2,https://www.bbc.com/news/world-europe-66608891,Europe,Casings and coins at a site in central France suggest prisoners were shot by the French Resistance...
The indigenous groups fighting the quest for 'white gold',https://www.bbc.com/news/world-latin-america-66520097,Latin America,Indigenous communities in northern Argentina are determined to protect the land from lithium mining
What is the greenest funeral option?,/future/article/20230821-how-to-plan-a-sustainable-funeral,,
Sound recordings from beneath the sea,/future/article/20230815-how-undersea-sounds-help-us-understand-ocean-life,,
The indigenous guardians healing Canada,/future/article/20230809-how-indigenous-guardians-are-protecting-canadas-environment,,
Sam Fender crowned king of North at Leeds Festival,/news/entertainment-arts-66361118,Entertainment & Arts,The Geordie rock star confirmed his headliner status with a career-defining set.
Thousands of penguins die in Antarctic ice breakup,/news/science-environment-66492767,Science & Environment,
Religion and reggae: Africa’s top shots,/news/world-africa-66603513,Africa,
EU safety laws start to bite for big tech,/news/technology-66604929,Technology,
Tributes as US game show host Bob Barker dies at 99,/news/entertainment-arts-66630261,Entertainment & Arts,
88 UK deaths linked to Canadian 'poison seller',/news/world-us-canada-66609884,US & Canada,
OnlyFans owner receives $338m payout,/news/business-66612769,Business,
Photo prize shortlist celebrates region's beauty,/news/uk-england-tyne-66594319,Tyne & Wear,
Sunflowers irresistible to Instagram photo hunters,/news/uk-wales-66514508,Wales,
In pictures: Michael Parkinson and his star guests,/news/entertainment-arts-66430865,Entertainment & Arts,
"Tricks, trials and salutes: Africa’s top shots",/news/world-africa-66532676,Africa,
WW2 aerial photos opened to public for first time,/news/uk-england-manchester-66511918,Manchester,
