title,href,tag,summary
"We face climate extinction, at-risk nations say",/news/world-58064485,World,The most vulnerable developing countries plead for action after a stark warning from a UN panel.
Violence against children escalates in Afghanistan,/news/world-asia-58142983,Asia,
Why women in Korea are reclaiming their short hair,https://www.bbc.com/news/world-asia-58082355,Asia,
How to escape the 'productivity trap',https://www.bbc.com/worklife/article/20210805-how-to-escape-the-productivity-trap,Worklife,
Two stars for Nicole Kidman series,https://www.bbc.com/culture/article/20210809-nine-perfect-strangers-two-stars-for-nicole-kidman-series,Culture,
Prince Andrew accuser files civil lawsuit in US,/news/uk-58153711,UK,Virginia Giuffre alleges the Duke of York sexually assaulted her when she was 17 years old.
Greek PM apologises for wildfire catastrophe,/news/world-europe-58152324,Europe,"Kyriakos Mitsotakis says Greece is facing an unprecedented natural disaster, as public anger grows."
Biden's plan to tackle racism with roads,/news/world-us-canada-58106414,US & Canada,An infrastructure package that seeks to address inequality gets a mixed reception on the ground.
Grealish 'teared up' as he left Villa,/sport/football/58150738,Football,"Jack Grealish says his departure from Aston Villa for Manchester City was as emotional as Lionel Messi's final Barcelona press conference and that he ""teared up"" as he left the team."
Tokyo 2020 - all the best stats,/sport/olympics/58109921,Olympics,"World records, Team GB making more history, US v China, and all the best stats from the Tokyo 2020 Olympic Games."
Aguero out for 10 weeks with injury,/sport/football/58147456,Football,"Barcelona striker Sergio Aguero will not play for 10 weeks because of a right calf injury, say the La Liga club."
The infamous murder cases suddenly being solved,/reel/video/p09rpcx0/how-the-world-s-first-dna-detective-catches-killers,,
An ingenious way to run faster,/reel/video/p09r61yk/how-to-run-faster-by-changing-the-way-you-see,,
'I get explicit messages every day',/reel/video/p09pz26t/cyber-flashing-i-get-explicit-messages-every-day-,,
The alien terrain created by batteries,https://www.bbc.com/future/article/20210809-how-your-phone-battery-creates-striking-landscapes,Future,"The huge, distinctive pools formed by the global hunt for lithium"
How hybrid work can lead to favouritism,https://www.bbc.com/worklife/article/20210804-hybrid-work-how-proximity-bias-can-lead-to-favouritism,Worklife,'Proximity bias' sets up some workers to get ahead
The remote job that prevents disaster,https://www.bbc.com/travel/article/20210809-the-guardian-of-colorados-front-range,Travel,"After 100 years, a woman is again watching over the forest"
A new type of Hollywood hero,https://www.bbc.com/culture/article/20210809-coda-and-the-films-finally-treating-deaf-people-with-respect,Culture,How deaf characters are finally taking centre stage in Hollywood
Child kidnapped by gang over satanic abuse fear,https://www.bbc.com/news/uk-wales-57941016,UK,Two gang members snatched the child at knifepoint as they returned home from school
Has Banksy been on a seaside 'spraycation'?,https://www.bbc.co.uk/news/uk-england-norfolk-58145220,UK,Are new murals that have appeared on England's east coast really the work of the elusive artist?
Mars rover's first rock sample goes missing,https://www.bbc.com/news/science-environment-58148756,Science & Environment,Engineers investigate why the Perseverance robot failed in its first attempt to gather a rock core
The vast methane leaks seen from space,/future/article/20210805-the-search-for-the-worlds-largest-methane-sources,,
How to invite wildlife into your home,/future/article/20210727-how-to-boost-biodiversity-and-attract-wildlife-to-your-home,,
The neglected 'Galapagos of Europe',/future/article/20210720-europes-museum-of-living-fossils,,
How TV's The Windsors is making its unregal stage debut,/news/entertainment-arts-58101586,Entertainment & Arts,The creator and cast of the royal comedy satire take us behind the scenes of their West End show.
Climate report is 'code red for humanity',/news/science-environment-58130705,Science & Environment,
Tech giant Alibaba to sack manager accused of rape,/news/business-58141606,Business,
'Smallest baby at birth' goes home after a year,/news/world-asia-58141756,Asia,
Five things we have learned from the IPCC report,/news/science-environment-58138714,Science & Environment,
Saudi Aramco profits soar by almost 300%,/news/business-58141607,Business,
Stephen Lawrence drama 'celebrates common decency',/news/entertainment-arts-58112588,Entertainment & Arts,
Striking news pictures from around the world,/news/in-pictures-58100824,In Pictures,
"Africa's top shots: Faster, higher, stronger",/news/world-africa-58073608,Africa,
Underwater Scotland,/news/in-pictures-58071314,In Pictures,
Hot air balloons launched from secret location,/news/uk-england-bristol-58083380,Bristol,
The photographer comparing Blitz to present day,/news/uk-england-devon-57734003,Devon,
