title,href,tag,summary
Families search for missing after Hamas attack on Israel kills 600,/news/live/world-middle-east-67037895,Middle East,At least 413 people have also died in Israeli air strikes on Gaza after an unprecedented assault from Palestinian militants.
Biden sends fresh military aid to Israel after attack,https://www.bbc.com/news/world-us-canada-67049196,US,
Israeli forces fight to drive out Hamas militants,/news/world-middle-east-67045138,Middle East,
Verstappen wins in Qatar as Hamilton and Russell collide,/sport/formula1/67048883,Formula 1,
Scorsese on finding his new star,https://www.bbc.com/culture/article/20231006-hy-martin-scorsese-fears-for-the-future-of-cinema,Culture,
Destroyed cars line road near festival in chilling video,/news/world-middle-east-67048805,Middle East,The remains of cars can be seen after militants attacked people attending an outdoor party.
Race to rescue victims from Afghan earthquake,/news/world-asia-67047203,Asia,Hundreds are feared dead after the 6.3-magnitude quake hit remote villages in western Afghanistan.
Two Israeli tourists and guide shot dead in Egypt,/news/world-middle-east-67046394,Middle East,"Another Israeli was wounded in the attack in the city of Alexandria, Israel's foreign ministry says."
Nervous Fiji battling to make World Cup quarter-finals - radio & text,/sport/live/rugby-union/65868220,Rugby Union,Follow radio and text commentary as Fiji take on Portugal with a place in the World Cup quarter-finals at stake.
Barcelona pull one back against La Liga strugglers Granada,/sport/live/football/67047790,European Football,Follow live text commentary as Barcelona aim to stay in touch with leaders Real Madrid as they visit Granada in La Liga.
Martinelli hits late winner as Arsenal beat Man City,/sport/football/66974882,Football,Gabriel Martinelli hits the late winner as Arsenal earn a statement victory over defending Premier League champions Manchester City at Emirates Stadium.
How modern readers get this epic wrong,https://www.bbc.com/culture/article/20231004-the-iliad-the-ultimate-story-about-war,Culture,How a new translation of The Iliad offers fresh insights into an ancient text
Why digital nomads are choosing Bansko,https://www.bbc.com/travel/article/20231003-bansko-bulgarias-unlikely-new-digital-nomad-hub,Travel,"It's home to just 10,000 people but hundreds of digital nomads"
The bird that sparked a mass clean-up,https://www.bbc.com/future/article/20231002-the-photo-of-the-deepwater-horizon-bird-that-shocked-the-world,Future Planet,The symbol of the worst US environmental disaster
"The lab growing 225,000 carats of diamond per month",/reel/video/p0gjlpbh/inside-india-s-lab-grown-diamond-industry,,
The scandalous life of a 'dashing and unreliable' king,/reel/video/p0gjd5xk/the-scandalous-life-of-a-dashing-and-unreliable-king,,
San José: A shipwreck worth billions on the ocean floor,/reel/video/p0gj0wgc/san-jos-the-holy-grail-of-shipwrecks,,
The film that caused a US moral panic,https://www.bbc.com/culture/article/20231005-the-exorcist-and-why-demonic-possession-taps-into-our-darkest-fears,Culture,How The Exorcist tapped into our darkest fears
The weird sound from the early Universe,https://www.bbc.com/future/article/20231003-the-primordial-hum-from-the-beginning-of-the-universe,Future,A primordial hum reverberating across space may reveal secrets about dark energy
Six must-do things in Hong Kong,https://www.bbc.com/travel/article/20231006-virginia-chans-six-offbeat-experiences-in-hong-kong,Travel,Discover a new side to the bustling city with these insider tips
The sneaky trend hurting finances,https://www.bbc.com/worklife/article/20231003-skimpflation-an-even-sneakier-form-of-shrinkflation,Worklife,You're getting fewer services for your money – but you might not even notice
How did Israeli intelligence fail to stop major attack?,https://www.bbc.com/news/world-middle-east-67040221,Middle East,Israeli officials tell BBC an investigation into Gaza's surprise attack will go on for years
The 'white gold' rush dividing communities,https://www.bbc.com/news/technology-67028209,Technology,The rush to mine lithium for car batteries is dividing environmental and native American communities
The inspiring youth orchestra that built itself from nothing,https://www.bbc.com/news/world-latin-america-66844170,Latin America & Caribbean,Accessibility for all is at the core of the ethos for Antigua and Barbuda's youth orchestra
"A 2,000-year-old method to water crops",/future/article/20230922-the-ancient-sri-lankan-tank-cascade-systems-tackling-drought,,
The goats fighting fires in LA,/future/article/20230922-these-la-goats-help-stop-wildfires,,
The city that went green to keep cool,/future/article/20230922-how-medellin-is-beating-the-heat-with-green-corridors,,
Regulator sues Musk to force testimony in X probe,/news/business-67024538,Business,"Musk accused the Securities and Exchange Commission of ""harassment"" in the two sides' latest battle."
Teenagers' inner secrets laid bare for stage show,/news/entertainment-arts-66994571,Entertainment & Arts,
Record surge in days over key 1.5C warming limit,/news/science-environment-66857354,Science & Environment,
Film director Terence Davies dies aged 77,/news/entertainment-arts-67041682,Entertainment & Arts,
"Fashion, football and frontline politics: Photos of the week",/news/in-pictures-67029261,In Pictures,
Children in hospital after eating cannabis sweets,/news/world-latin-america-66991933,Latin America & Caribbean,
How a chatbot encouraged a man who wanted to kill the Queen,/news/technology-67012224,Technology,
"Stars, bars and beans: Africa’s top shots",/news/world-africa-67017528,Africa,
"Bears, birds and kangaroos: Comedy Wildlife Photo Awards",/news/in-pictures-67004896,In Pictures,
Sir Michael Gambon: A career in pictures,/news/in-pictures-66950664,In Pictures,
Vintage style and bonfires: Africa’s top shots,/news/world-africa-66947006,Africa,
In pictures: Storm Agnes sweeps across Scotland,/news/uk-scotland-66947142,Scotland,
