title,href,tag,summary
Israel military confirms deadly strike on Gaza refugee camp,/news/live/world-middle-east-67258466,Middle East,The IDF says the strike killed a senior Hamas commander. The Hamas-run health ministry says at least 50 people were killed.
Anti-war protesters disrupt US Senate hearing,/news/world-us-canada-67275665,US & Canada,
Teen taken hostage by Hamas back home in Chicago,/news/world-us-canada-67276547,US & Canada,
The harm of dehumanising language,https://www.bbc.com/future/article/20231030-the-real-life-harm-caused-by-dehumanising-language,Future,
The 'Christmas creep' of holiday candy,https://www.bbc.com/worklife/article/20231030-christmas-creep-why-holiday-candy-hits-shelves-so-early,Worklife,
Friends stars 'devastated' by Matthew Perry's death,/news/entertainment-arts-67260551,Entertainment & Arts,"The cast of Friends say they are mourning the ""unfathomable loss"" of their fellow star on Saturday."
"How social media fuelled antisemitic violence in Dagestan, Russia",/news/world-europe-67269477,Europe,"Before an outburst of violence, Telegram channels spread hate speech. The BBC has tracked messages inciting the public to gather at an airport where a flight from Tel Aviv was arriving."
Watch: Spain's Princess Leonor turns 18 and swears oath,/news/world-europe-67273657,Europe,"At a formal ceremony, the future queen promises to uphold the constitution."
Women's Nations League: Belgium score superb opener to lead England,/sport/live/football/67276280,Football,Follow live updates as England travel to Belgium for a crucial meeting in the Women's Nations League.
"Watch: Goalless in Northern Ireland v Hungary, updates from Albania v Republic of Ireland",/sport/live/football/67196016,Football,"Live text updates as Republic of Ireland face Albania followed by Northern Ireland against Hungary in the Women's Nations League qualifiers, live on BBC iPlayer and BBC Sport website."
Watch: Scotland 0-0 Netherlands in Women's Nations League,/sport/live/football/67258241,Football,Scotland seek their first win in Women's Nations League as they host the Netherlands.
A US mystery you can see but not touch,https://www.bbc.com/travel/article/20231025-the-paulding-light-a-us-mystery-you-can-see-but-not-touch,Travel,"""We were not able to disprove the existence of a ghost"""
'Lost demon' uncovered in Joshua Reynolds painting,https://www.bbc.com/news/entertainment-arts-67271251,Entertainment & Arts,The artist’s controversial depiction of an imaginary fiend had disappeared under layers of paint
The 'poltergeist' that shocked the UK,https://www.bbc.com/culture/article/20231026-the-enfield-poltergeist-why-the-unexplained-mystery-that-shocked-1970s-britain-continues-to-disturb,Culture,"Why 1970s mystery The Enfield Poltergeist continues to disturb, decades on"
The bizarre history of satanic rituals,/reel/video/p0gj5lfq/the-bizarre-history-of-satanic-rituals,,
Sashiko: The traditional Japanese embroidery technique going global,/reel/video/p0gl796s/japanese-sashiko-the-art-of-stitching-stories,,
Where gods and kings 'turn to stone',/reel/video/p0gndvlg/mount-nemrut-turkey-s-mystical-stone-monoliths,,
Why 'Slut' is Swift's call to arms,https://www.bbc.com/culture/article/20231030-taylor-swifts-1989-the-real-meaning-of-the-song-slut,Culture,"Taylor Swift's song Slut isn't a furious anthem, but still has a damning message"
The world's best tourism villages,https://www.bbc.com/travel/article/20231030-the-worlds-best-tourism-villages-in-2023,Travel,"For those looking to immerse themselves in local culture, here's where to go"
The revival of a coveted lost US corn,https://www.bbc.com/travel/article/20231031-jimmy-red-corn-grits-with-egg-yolks,World's Table,It was once prized for making illegal whiskey
How right to repair might change tech,https://www.bbc.com/future/article/20231027-how-the-right-to-repair-might-change-technology,Future,Laws aimed at prolonging the life of electronic devices may change technology
The 'overburdened' workers on strike,https://www.bbc.com/worklife/article/20231027-why-so-many-healthcare-workers-are-walking-off-the-job,Worklife,"Walgreens, Kaiser Permanente and more: US healthcare workers are pushing back"
De Niro takes stand to deny discrimination claim,https://www.bbc.com/news/entertainment-arts-67271246,Entertainment,"The actor is said to be ""grumpy"" while giving evidence in a civil trial against a former assistant"
What China wants from Israel-Hamas war,https://www.bbc.com/news/world-asia-china-67237146,China,Its top diplomat has been in Washington for talks but there are limits to what it can achieve
Pumpkins: The overlooked superfood,/future/article/20231026-are-halloween-pumpkins-a-future-superfood,,
The Danish island eliminating trash,/future/article/20231025-bornholm-the-danish-island-aiming-for-zero-waste,,
The ocean drones tracking hurricanes,/future/article/20231026-the-mystery-of-why-hurricanes-suddenly-intensify,,
Bankman-Fried pressed in court over past comments,/news/world-us-canada-67272395,US & Canada,"As inconsistencies were put to him, the former crypto boss often told the court ""I don't recall"" ."
Scientists warn of faster threat to climate limit,/news/science-environment-67242386,Science & Environment,
Little Britain sketch 'racist and outdated',/news/entertainment-arts-67273423,Entertainment & Arts,
Austrians fall ill after taking fake weight-loss drug,/news/world-europe-67217729,Europe,
Facebook and Instagram to offer paid subscriptions,/news/technology-67226394,Technology,
Band walk 870 miles on tour around Welsh coast,/news/uk-wales-67219848,Wales,
Elton John photography collection to go on display,/news/uk-england-london-67205468,London,
Skulls and flowers: Mexico's 'skeleton' parade,/news/in-pictures-67193453,In Pictures,
Steely gaze of endangered tigress tops mangrove photo awards,/news/in-pictures-67155632,In Pictures,
"Poses, pouts and poles: Africa's top shots",/news/world-africa-67155786,Africa,
Sydney Opera House: The story of an icon in photos,/news/world-australia-67153713,Australia,
Stranded boats and dead fish: Amazon drought,/news/in-pictures-67087949,In Pictures,
