title,href,tag,summary
Thousands flee eastern Ukraine as Russia steps up offensive,/news/live/world-europe-60991746,Europe,"Ukrainian authorities are calling on people to evacuate the Luhansk region, with five humanitarian corridors planned."
How a guitarist saved hundreds on a sinking ship,https://www.bbc.com/news/world-africa-60841291,Africa,
"Ancelotti on brink of history, but job on the line",https://www.bbc.com/sport/football/60919616,European Football,
The big 'single shaming' problem,https://www.bbc.com/worklife/article/20220405-single-shaming-why-people-jump-to-judge-the-un-partnered,Worklife,
'I was diagnosed autistic at 60',https://www.bbc.com/future/article/20220405-the-life-changing-diagnosis-of-autism-in-later-life,Future,
'There are a lot of people left under the rubble',/news/world-europe-61007427,Europe,Borodyanka's residents say Russian forces stopped them from digging for survivors amidst town's destruction.
Ed Sheeran wins Shape of You copyright case,/news/entertainment-arts-61006984,Entertainment & Arts,"After the High Court judgement, the singer says such ""baseless"" claims ""are way too common now""."
How police shut down world's largest darknet market,/news/technology-61002904,Technology,German police say illegal sales on the site amounted to at least £1bn a year
European news conferences,/sport/live/football/61006588,Football,Hear from West Ham's David Moyes and Leicester's Brendan Rodgers ahead of their Europa League and Conferences League ties on Thursdays evening.
Stokes not training while he waits for scan on knee,/sport/cricket/61007258,Cricket,England vice-captain Ben Stokes says he cannot make any plans for this summer until he has had a scan to assess the extent of a knee problem.
Le Tissier 'steps aside' from Southampton role,/sport/football/61009245,Football,"Matt Le Tissier says he has ""stepped aside"" from his role as ambassador at former club Southampton."
The forgotten 90s car that should have changed the world,/reel/video/p0bkrk32/how-an-electric-car-dream-was-crushed,,
What is restless legs syndrome and why does it matter?,/reel/video/p0bvy1j0/the-common-medical-condition-you-ve-never-heard-of,,
Who has the world's sexiest accent?,/reel/video/p09f7crn/do-you-have-the-world-s-sexiest-accent-,,
Alexander the Great's ancient highway,https://www.bbc.com/travel/article/20220405-a-remote-highway-along-the-arabian-sea,Travel,It's one of the most scenic drives in South Asia
What makes the perfect escape?,https://www.bbc.com/culture/article/20220404-what-makes-the-perfect-escapist-retreat,Culture,How ultra-escapist retreats around the world offer sanctuary from everyday life
"The entry-level workers making $100,000",https://www.bbc.com/worklife/article/20220401-the-entry-level-workers-earning-six-figure-salaries,Worklife,"In some sectors, new graduates are on six-figure salaries many people never hit"
The pollution visible from space,https://www.bbc.com/future/article/20220405-the-fungi-cleaning-new-delhis-air,Future Planet,'Our children have worn masks to school long before the Covid crisis'
The city designed by playing games,https://www.bbc.com/future/article/20220404-the-dutch-city-experimenting-with-the-future-of-urban-life,Future,The Dutch city of Almere is a melting pot of innovation
Brazil at work: Black and held back,https://www.bbc.com/news/world-latin-america-60980009,Latin America & Caribbean,Black people only hold 6% of managerial posts in Brazil
Why South Korea struggles to sleep,https://www.bbc.com/news/world-asia-60703300,Asia,"Growing numbers suffer from sleep deprivation, with many turning to sleeping pills"
The mangrove that defied destruction,/future/article/20220329-how-a-caribbean-community-restored-its-dying-mangrove,,
The alternatives to Russia's gas,/future/article/20220324-how-biogas-can-help-europe-cut-russian-gas,,
The town that got up and left,/future/article/20220310-the-illinois-town-valmeyer-could-be-a-model-for-relocation,,
Rare identical triplets were 'one in 200-million',https://www.bbc.com/news/uk-england-merseyside-60995514,UK,"Gina and Craig Dewdney reflect on the ""best, but hardest job"" as their three boys turn one"
Music and TV treasures launch British Pop Archive,/news/entertainment-arts-60998194,Entertainment & Arts,
"Farm staff shortage may mean price rises, MPs warn",/news/science-environment-60999236,Science & Environment,
Riley received series of porn messages on Instagram,/news/technology-60983593,Technology,
Shanghai Covid lockdown extended to entire city,/news/world-asia-china-60994022,China,
The Indian behind the VFX company winning Oscars,/news/world-asia-india-60983131,India,
UN scientists lay out five ways to save the planet,/news/science-environment-60987614,Science & Environment,
In pictures: Behind the shop facade,/news/in-pictures-60905538,In Pictures,
Africa's top shots: Smiles in tiaras and steely stares,/news/world-africa-60939581,Africa,
Fashion photographer Patrick Demarchelier dies,/news/entertainment-arts-60952353,Entertainment & Arts,
Wild shots: Scottish Nature Photography Awards,/news/uk-scotland-highlands-islands-60912679,Highlands & Islands,
Pictures as Queen joins royals for Philip memorial,/news/in-pictures-60916160,In Pictures,
