title,href,tag,summary
"Christmas travel will spread Omicron, warns Fauci",/news/world-us-canada-59714272,US & Canada,The US infectious disease expert says the Covid-19 variant will spread - even among the vaccinated.
Javid refuses to rule out more Covid restrictions,/news/uk-59718601,UK,
Liz Truss replaces Lord Frost in post-Brexit talks,/news/uk-politics-59721801,UK Politics,
Man beaten to death at Sikhism's holiest shrine,/news/world-asia-india-59715937,India,
La Liga: Real Madrid v Cadiz,/sport/live/football/59721556,European Football,
French ski season in disarray as UK tourists banned,/news/world-europe-59712015,Europe,Snow on the slopes of Mont Blanc is the best Chamonix has seen in years - but few Brits will enjoy it.
Highlights from the career of architect Richard Rogers,/news/entertainment-arts-59717076,Entertainment & Arts,"Lord Rogers, who has died aged 88, designed the Millennium Dome and the Pompidou Centre."
Record low turnout in Hong Kong vote,/news/world-asia-china-59717343,China,Only 30.2% took part in the vote - the lowest turnout in Hong Kong's election history.
"NFL scores & updates – Cowboys lead Giants, plus Lions beating Cardinals",/sport/live/american-football/58482330,American Football,"Follow live text updates and watch clips from week 15 of the NFL, with the Cowboys at the Giants and the Titans at the Steelers."
Watch: Sports Personality of the Year 2021,/sport/live/sports-personality/58898061,Sports Personality,Watch live coverage and follow text updates as the 2021 BBC Sports Personality of the Year is announced.
Spurs and Liverpool share thrilling draw,/sport/football/59625603,Football,Liverpool lose ground in the Premier League title race in a pulsating draw at Tottenham that saw Andrew Robertson sent off.
The city where you can't serve meat,https://www.bbc.com/travel/article/20211101-varanasi-where-its-forbidden-to-serve-meat,Travel,A meat ban has fostered creativity among a new generation of chefs
Why women are more sexually fluid,https://www.bbc.com/worklife/article/20210610-why-more-women-identify-as-sexually-fluid-than-men,Worklife,Why more women are embracing less rigid sexual identities – and men aren't
The most shocking film of 2021,https://www.bbc.com/culture/article/20210715-titane-the-most-shocking-film-of-2021,Culture,This sci-fi body horror pushes the boundaries of cinema
How archaeologists finally found India's 'Atlantis',/reel/video/p0bbbxjd/searching-for-the-sunken-kingdom-of-dwarka,,
A simple exercise that gives your brain an unexpected boost,/reel/video/p09v8wyh/a-simple-exercise-that-gives-your-brain-an-unexpected-boost,,
The words that reveal if you are an extrovert or an introvert,/reel/video/p09hg3dd/why-extroverts-have-their-own-extreme-language,,
The family rifts triggered by Christmas,https://www.bbc.com/future/article/20211201-why-family-estrangement-is-surprisingly-common,Future,Family estrangement can be painful – but there are ways to heal
The technology that powered the Inca,https://www.bbc.com/travel/article/20211212-the-innovative-technology-that-powered-the-inca,Travel,It helped them build the largest empire in South American history
Why taking leave is so hard in the US,https://www.bbc.com/worklife/article/20211209-why-its-so-hard-for-some-workers-to-ask-for-time-off,Worklife,The pressures keeping US workers at their desks instead of on holiday
The best TV shows of 2021,https://www.bbc.com/culture/article/20210415-the-best-tv-shows-of-2021-so-far,Culture,"From Squid Game to Succession, Ted Lasso, Mare of Easttown and Maid"
How to make the best roast potatoes this Christmas,https://www.bbc.co.uk/food/articles/perfect_roast_potatoes,Food,Discover what makes the perfect roast potato
What makes a Christmas film sparkle?,https://www.bbc.co.uk/programmes/articles/3CN7Gn4V2drCmwfcLRDBzq5/festive-flicks-what-makes-a-christmas-film-sparkle,Arts,Themes and traits that make for a festive filmic feast
Is Gen Z changing Christmas food?,https://www.bbc.co.uk/food/articles/gen_z_christmas,Food,What might we see at the festive feast in the future?
The sector behind a third of our waste,/future/article/20211215-the-buildings-made-from-rubbish,,
The new weapon against climate change,/future/article/20211207-the-legal-battle-against-climate-change,,
Medieval Europe's solution to flooding,/future/article/20211129-the-medieval-dutch-solution-to-flooding,,
GirlsDoPorn victims win rights to their videos,/news/technology-59699234,Technology,More than 400 people can now demand the illegally obtained films be removed from websites.
LA rapper Drakeo the Ruler dies after stabbing,/news/world-us-canada-59720744,US & Canada,
Last view of mighty Webb space telescope on Earth,/news/science-environment-59692930,Science & Environment,
Will Omicron stall airlines' recovery in 2022?,https://www.bbc.co.uk/news/business-59654176,Business,
Dutch to enter tight lockdown over Omicron wave,/news/world-europe-59713503,Europe,
Controversial Alzheimer's drug rejected by EU,/news/health-59699907,Health,
Brazil wildfires killed 17 million animals - study,/news/science-environment-59670396,Science & Environment,
US photographer Sally Mann wins Prix Pictet award,/news/in-pictures-59682234,In Pictures,
Africa's top shots: Portraits in tyres and masquerades,/news/world-africa-59680921,Africa,
Chilean crowds celebrate death of Pinochet's widow,/news/world-latin-america-59692506,Latin America & Caribbean,
Sibling relationships through the lens,/news/in-pictures-58157397,In Pictures,
Christmas Lane lights up for charity,/news/uk-england-suffolk-59552491,Suffolk,
