title,href,tag,summary
UK warns of plot to install Russia ally in Ukraine,/news/uk-60095459,UK,The Foreign Office takes the unusual step of naming a former Ukrainian MP as a potential Kremlin candidate.
German navy chief resigns over Ukraine comments,/news/world-europe-60099924,Europe,
NFL divisional round: Bengals 16-16 Titans - Brown makes stunning one-handed TD grab,/sport/live/american-football/60077552,American Football,
French adventurer dies rowing across the Atlantic,/news/world-europe-60097918,Europe,
'Surreal' January wildfire shuts California highway,/news/world-us-canada-60092300,US & Canada,
Gen Z marchers praying for an end to US abortion,/news/world-us-canada-60088680,US & Canada,The young activists are optimistic their movement's long-cherished goal may be within reach.
Fans sue over film that cut Ana de Armas,/news/world-us-canada-60092299,US & Canada,"The comedy Yesterday has the actress in the trailer, but not the movie itself - to the anger of fans."
Jailed Iranian-Briton Ashoori to start hunger strike,/news/uk-60098576,UK,The 67-year-old engineer from London hopes the strike will bring attention to those unfairly held in Iran.
England routed by Windies in first T20,/sport/cricket/60099674,Cricket,England's batting woes cross formats and continents as they are routed by West Indies in the first T20 international in Barbados.
Saints end 12-match Man City winning run,/sport/football/60005892,Football,Southampton hold on for a well-earned draw at St Mary's to end Manchester City's 12-game winning run in the Premier League.
Rashford snatches win for Man Utd,/sport/football/60005896,Football,Marcus Rashford scores a stoppage-time winner as Manchester United snatch victory against West Ham to move into the top four of the Premier League.
Surprising ways that Victorians flirted,https://www.bbc.com/culture/article/20220114-the-surprising-ways-that-victorians-flirted,Culture,How a lesser-known artform allowed British aristocracy to circumvent etiquette
The Spanish town 'lost in France',https://www.bbc.com/travel/article/20220117-aranese-spains-little-known-language,Travel,It has been caught between larger kingdoms and nation-states for centuries
How to read the Doomsday Clock,https://www.bbc.com/future/article/20220119-how-to-read-the-doomsday-clock,Future,What it tells us about the end of the world
The unexpected structures appearing in the homes of the super-rich,/reel/video/p0bggk07/pop-up-homeless-shelters-in-the-homes-of-the-rich,,
The country with the 'happiest children in the world',/reel/video/p09z5rlp/how-societal-pressures-shape-motherhood,,
The 'invisible' Soviet town that suddenly appeared in Poland,/reel/video/p09zf8v2/the-invisible-soviet-town-that-suddenly-appeared-in-poland,,
Italy's surprising capital of coffee,https://www.bbc.com/travel/article/20220119-trieste-italys-surprising-capital-of-coffee,Travel,It's geographically separated from the rest of the country and built on caffeine
Why hybrid is emotionally exhausting,https://www.bbc.com/worklife/article/20220120-why-hybrid-work-is-emotionally-exhausting,Worklife,"If hybrid is the future of work, why are workers finding it so draining?"
The private life of a masterpiece,https://www.bbc.com/culture/article/20220120-gainsboroughs-blue-boy-the-private-life-of-a-masterpiece,Culture,How this painting became a symbol of gay pride
India's hidden dinosaur wealth,https://www.bbc.com/future/article/20220113-why-indias-fossil-wealth-has-remained-hidden,Future,"India is rich in fossils, but many are just sitting in the ground"
How we might build a food utopia,https://www.bbc.com/future/bespoke/follow-the-food/how-we-might-build-a-food-utopia/,Follow the Food,What if we could reimagine the global food system so that it worked perfectly?
Should human kidneys be bought and sold?,https://www.bbc.com/ideas/videos/should-human-kidneys-be-bought-and-sold/p0bgz6yf,Ideas,"Globally, thousands die each year waiting for a kidney transplant"
The health risks associated with detoxes,https://www.bbc.co.uk/food/articles/food_detox,Food,There's a backlash against food detoxes and here's why
The 'outrageous' green plan for coal,/future/article/20220118-the-environmental-case-for-buying-a-coal-mine,,
The rhino that became an icon for peace,/future/article/20220111-the-rhinos-bringing-peace-in-india,,
The big question for lithium batteries,/future/article/20220105-lithium-batteries-big-unanswered-question,,
Director James Cameron on the dangers of deepfakes,/news/technology-60083090,Technology,The award-winning movie-maker hopes critical thinking will combat an influx of deepfake videos.
Omicron spread led shoppers to desert High Street,/news/business-60066434,Business,
Tonga's volcanic plume reached half-way to space,/news/science-environment-60088413,Science & Environment,
Survivor tells of sea escape from Tonga tsunami,/news/world-asia-60078540,Asia,
What exactly would Meat Loaf not do for love?,/news/entertainment-arts-60082456,Entertainment & Arts,
WHO warns Covid not over amid Europe case records,/news/world-europe-60048390,Europe,
Plans to tackle 'new narcotics' of fly-tipping,/news/science-environment-60031410,Science & Environment,
Striking pictures from around the world this week,/news/in-pictures-60076150,In Pictures,
Africa's top shots: From baptisms to card games,/news/world-africa-60070024,Africa,
Snowfall pictured in Sahara Desert,/news/world-africa-60045153,Africa,
Celebrating creativity in the construction industry,/news/in-pictures-59952716,In Pictures,
Stunning Wolf Moon dazzles around the world,/news/in-pictures-60038631,In Pictures,
