title,href,tag,summary
Nothing very promising in peace talks - Russia,/news/live/world-europe-60923158,Europe,The Kremlin plays down hopes of a breakthrough following talks between Russian and Ukrainian delegates in Istanbul.
Germany warns on gas supply over Russia payment row,https://www.bbc.com/news/business-60925016,Business,
Egypt complain of racial abuse by Senegal fans,https://www.bbc.com/sport/football/60925012,Football,
The workers 'coasting' in their jobs,https://www.bbc.com/worklife/article/20220329-the-coasting-workers-whove-checked-out-of-their-jobs,Worklife,
The truth about 'sleep training' babies,https://www.bbc.com/future/article/20220322-how-sleep-training-affects-babies,Future,
Putin demands Mariupol surrender to end shelling,/news/world-europe-60926470,Europe,Comments come as satellite images show the devastation unleashed by Russia's bombardment.
Russia launches new strikes after peace promise,/news/world-europe-60925713,Europe,"The Chernihiv governor says Russia bombarded the city overnight, despite pledge to reduce attacks."
IS Beatle jihadist 'fought for suffering Muslims',/news/world-us-canada-60930690,US & Canada,El Shafee Elsheikh is one of a group of IS militants with UK links accused of beheading hostages in Syria.
Family and stars remember Warne at memorial,/sport/cricket/60895845,Cricket,"Sir Elton John, Ed Sheeran and a host of former cricketers lead tributes to Australia legend Shane Warne at a state memorial service."
Australia waltz into World Cup final,/sport/cricket/60923112,Women's Cricket,Australia waltz into the final of the Women's World Cup with a 157-run dismantling of West Indies in Wellington.
Chelsea cannot be business as usual - MP,/sport/football/60931486,Football,"Chelsea cannot be allowed to operate like it is ""business as usual"" after the sanctions imposed on Roman Abramovich, says sports minister Nigel Huddleston."
The future of death: How to rethink cemetery spaces,/reel/video/p0by4st8/the-world-s-first-underwater-burial-site,,
The shocking Cold War experiments hidden by the CIA,/reel/video/p0by2ybb/mk-ultra-the-cia-s-secret-pursuit-of-mind-control-,,
The surprisingly deadly truth about grapefruit,/reel/video/p09grpkf/the-deadly-secret-of-the-humble-grapefruit,,
Iceland's unsung 'herring girls',https://www.bbc.com/travel/article/20220329-icelands-unsung-herring-girls,Travel,They paved the way for Iceland's exemplary commitment to gender equality
"Marvel's Moon Knight is good, not great",https://www.bbc.com/culture/article/20220328-moon-knight-review-this-marvel-show-has-no-reason-to-exist,Culture,Oscar Isaac is the saving grace of the new superhero show on Disney+
Why tiny tasks feel oddly soothing,https://www.bbc.com/worklife/article/20220323-puttering-around-why-small-tasks-feel-so-therapeutic,Worklife,"Folding laundry, watering houseplants – why do these feel so therapeutic?"
The lost mangrove that came back,https://www.bbc.com/future/article/20220329-how-a-caribbean-community-restored-its-dying-mangrove,Future Planet,It's no easy task to replant this unique ecosystem
The gardens that survived for centuries,https://www.bbc.com/future/article/20220328-how-long-can-a-garden-last,Future,"Even when they're utterly forgotten, gardens can be surprisingly resilient."
French election: A really simple guide,https://www.bbc.com/news/world-europe-60799845,Europe,Voters in France will go to the polls on 10 April to elect a new president
'They won't tell me how many bullets were in me',https://www.bbc.com/news/world-europe-60922393,Europe,One woman tells the BBC from hospital that a Russian soldier opened fire on her for no reason
The alternatives to Russia's gas,/future/article/20220324-how-biogas-can-help-europe-cut-russian-gas,,
The town that got up and left,/future/article/20220310-the-illinois-town-valmeyer-could-be-a-model-for-relocation,,
The homes powered by a kite,/future/article/20220309-the-kites-flying-to-harness-the-worlds-strongest-winds,,
It's A Sin leads Bafta TV nominations,/news/entertainment-arts-60921931,Entertainment & Arts,"The Channel 4 drama set during the 1980s Aids crisis is up for 11 awards, including best..."
Dyson headphones come with air vacuum for mouth,/news/technology-60927032,Technology,
Single star detected at record-breaking distance,/news/science-environment-60931100,Science & Environment,
Endometriosis: ‘Doctors would tell me it’s in my head’,/news/world-60922369,World,
"'I was too rough around the edges, perhaps'",https://www.bbc.co.uk/news/business-60907794,Business,
Europe reveals fast fashion crackdown,/news/science-environment-60913226,Science & Environment,
Star-studded Ukraine charity concert raises £12m,/news/entertainment-arts-60912544,Entertainment & Arts,
Wild shots: Scottish Nature Photography Awards,/news/uk-scotland-highlands-islands-60912679,Highlands & Islands,
Pictures as Queen joins royals for Philip memorial,/news/in-pictures-60916160,In Pictures,
Oscars red carpet fashion in pictures,/news/entertainment-arts-60896370,Entertainment & Arts,
'Ship of gold' photos recovered from ocean floor,/news/world-us-canada-60866212,US & Canada,
'Photography completely turned my life around',/news/uk-england-hampshire-60859905,Hampshire & Isle of Wight,
