title,href,tag,summary
Direct hit as Nasa smashes spacecraft into asteroid,/news/science-environment-63039191,Science & Environment,The Dart probe slams into the Dimorphos asteroid to see how easy it is push a space rock off course.
Children flee school in Russia after gun attack,/news/world-europe-63034281,Europe,
Far-right wins in Italy and vows to govern for all,/news/world-europe-63029909,Europe,
How scholars decoded the Rosetta Stone,https://www.bbc.com/culture/article/20220923-the-rosetta-stone-the-real-ancient-codebreakers,Culture,
The African city Europeans tried to erase,https://www.bbc.com/travel/article/20220925-the-ancient-remains-of-great-zimbabwe,Travel,
Edward Snowden granted Russian citizenship,/news/world-europe-63036991,Europe,The former US intelligence contractor leaked a vast US intelligence surveillance programme in 2013.
Family travel world before children go blind,/news/world-62960970,World,A Montreal family goes on a global sightseeing tour after three of the children are diagnosed with a genetic condition.
Florida braces for 'strengthening' Hurricane Ian,/news/world-us-canada-63036617,US & Canada,"Residents are stocking up on groceries, fuel and sandbags as Ian strengthens into a major hurricane."
'England show spirit - but how can Maguire start?',/sport/football/63039010,Football,"While England showed desire against Germany, Harry Maguire looks in no shape for the pressures of a World Cup campaign."
Fury says 'Joshua fight off' as deadline expires,/sport/boxing/63039435,Boxing,Tyson Fury says his proposed heavyweight world-title fight with Anthony Joshua in December is off as his self-imposed deadline expires.
Italy pip Hungary to spot in Nations League finals,/sport/football/63042165,Football,Italy pip Hungary to a place in the Nations League finals with an assured win over the hosts in Budapest.
The global superstar who spied on the Nazis,/reel/video/p0cyg1kl/josephine-baker-the-stage-sensation-who-became-a-wwii-spy,,
The legendary 'rings of power' uncovered after centuries,/reel/video/p0b1mn5r/the-legendary-miracle-rings-of-ourense,,
The striking difference between French and American attitudes to sex,/reel/video/p08v6mkp/are-americans-awkward-about-sex-,,
Hollywood's most underestimated star,https://www.bbc.com/culture/article/20220907-why-jennifer-lopez-is-hollywoods-most-underestimated-star,Culture,"Despite her triple talent, why Jennifer Lopez still doesn't receive her dues"
How an essential job skill is changing,https://www.bbc.com/worklife/article/20220923-why-digital-literacy-is-now-a-workplace-non-negotiable,Worklife,You may think you know this soft skill – but it doesn't mean what you think
The risk posed by falling space junk,https://www.bbc.com/future/article/20220912-what-happens-to-space-debris-when-it-returns-to-earth,Future,Reports of returning space debris appear to be increasing in frequency
Portugal's mysterious 'birthing stones',https://www.bbc.com/travel/article/20220926-portugals-mysterious-birthing-stones,Travel,It's one of the world's most baffling geological phenomena
Oath Keepers trial is biggest Capitol riot case yet,https://www.bbc.com/news/world-us-canada-63013702,US,To what extent was the storming of the Capitol building planned in advance?
Darth Vader voice to be recreated as actor retires,https://www.bbc.com/news/entertainment-arts-63032248,Entertainment & Arts,James Earl Jones's famous voice is now being digitally recreated by a Ukrainian start-up
How to bake without using an oven,https://www.bbc.co.uk/food/articles/oven_free_bakes,Food,Create delicious desserts without turning the oven on – saving time and money
India's sustainable cooling solution,/future/article/20220920-how-indias-lattice-buildings-cool-without-air-con,,
Why fast fashion needs a makeover,/future/article/20220913-how-to-fix-unsustainable-fast-fashion,,
Why Auckland is the 'spongiest' city,/future/article/20220823-how-auckland-worlds-most-spongy-city-tackles-floods,,
TikTok may be fined for failing to protect children,/news/technology-63033263,Technology,The video-sharing platform has been issued with a final notice of intent by the UK's data watchdog.
'Truly remarkable' drug helps motor neurone disease,/news/health-62851186,Health,
More than half of the world's palm trees in danger,/news/science-environment-63038597,Science & Environment,
Is Finland's Wood City the future of building?,https://www.bbc.co.uk/news/business-62798950,Business,
Rihanna to headline Super Bowl half-time show,/news/entertainment-arts-63029845,Entertainment & Arts,
Uganda's transplant revolution brings hope to thousands,/news/world-africa-62916880,Africa,
Hurricane forces Nasa to shelter Moon rocket,/news/science-environment-63036757,Science & Environment,
Candid photos chronicle life as an obese teen,/news/uk-wales-62799126,Wales,
Autumn equinox and steam trains: Photos of the week,/news/in-pictures-63009263,In Pictures,
Africa's top shots: Painted faces and flying singers,/news/world-africa-62992391,Africa,
Pic of the Season summer vote is open,https://www.bbc.co.uk/programmes/articles/5jLKkbYd250n0KSrH0kfzjy/pic-of-the-season-summer-2022,News,
In pictures: The Queen's funeral,/news/in-pictures-62918196,In Pictures,
