title,href,tag,summary
Dozens feared dead after bomb hits Ukraine school,/news/world-europe-61369229,Europe,A Ukrainian official says 60 people may be dead after an air strike on a village school in Luhansk.
Zelensky's WW2 speech accuses Russia of Nazism,/news/world-europe-61370906,Europe,
"'If this is true, then I am also a Nazi'",/news/world-europe-61361827,Europe,
Verstappen leads in Miami after Leclerc overtake,/sport/live/formula1/58919801,Formula 1,
Bono sings with Ukrainian soldier in Kyiv,/news/world-europe-61373349,Europe,
Ncuti Gatwa named as next Doctor Who actor,/news/uk-61371123,Entertainment & Arts,The star of Netflix's Sex Education will replace Jodie Whittaker in the BBC science fiction show.
EasyJet to remove seats so it can cut down on crew,/news/business-61370175,Business,The airline plans to remove a row of seats so that it can fly with fewer cabin crew on board.
TV stars walk the red carpet at Bafta Awards,/news/entertainment-arts-61372083,Entertainment & Arts,The cream of British TV talent is honoured at this year's Bafta Television Awards in London.
Man City thrash Newcastle to go three clear at top,/sport/football/61288441,Football,Manchester City thrash Newcastle United to move three points clear of Liverpool at the top of the Premier League.
Alcaraz powers to Madrid Open title,/sport/tennis/61373763,Tennis,Spanish teenager Carlos Alcaraz completes a brilliant week with victory over Alexander Zverev in the Madrid Open final.
Nketiah scores twice as Arsenal sink 10-man Leeds,/sport/football/61288436,Football,Arsenal take a huge step towards securing Champions League football next season as they see off 10-man Leeds United.
The record-breaking dive under the Arctic ice,https://www.bbc.com/future/article/20220503-the-record-breaking-dive-under-the-arctic-ice,Future,The first mission beneath the all-enveloping ice
Most dangerous road in the world?,https://www.bbc.com/travel/article/20220502-the-worlds-most-dangerous-road,Travel,It takes travellers into a fascinating world of coca and gold
The workers with 'quitter's remorse',https://www.bbc.com/worklife/article/20220428-quitters-remorse-the-workers-who-regret-resigning,Worklife,"""By my second day at work, I was deeply regretting the choice I'd made"""
How two nuclear bombs dropped on a US farm,/reel/video/p0c5889f/broken-arrows-the-accidents-that-could-end-the-world,,
How the FBI eventually caught the bike-riding bank robber,/reel/video/p0c2ny6b/the-olympic-hopeful-turned-bike-riding-bank-robber,,
The surprising psychology behind being rich,/reel/video/p07vts5j/the-surprising-psychology-behind-being-rich,,
Is veganism always best for the planet?,https://www.bbc.com/future/article/20220429-the-climate-benefits-of-veganism-and-vegetarianism,Future,Can you count carbon like calories?
The superhero movie Marvel can't match,https://www.bbc.com/culture/article/20220505-why-sam-raimis-spider-man-shows-whats-wrong-with-marvel,Culture,Spider-Man at 20: why Sam Raimi's film is one of the best blockbusters ever made
"The interns making $8,000 a month",https://www.bbc.com/worklife/article/20220428-the-top-talent-interns-taking-home-sky-high-wages,Worklife,Some interns are taking home higher pay packets than staffers
The fritters that are sacrilege to shun,https://www.bbc.com/travel/article/20220501-isso-vade-the-spicy-snack-that-unites-sri-lanka,Travel,"""One of the most delicious street foods you could ever find on an island"""
News quiz: Who sold Maradona's 'Hand of God' shirt?,https://www.bbc.com/news/world-61304824,World,How closely have you been paying attention to the news headlines?
"Are we obsessed with carrots, onions, peas and tomatoes?",https://www.bbc.com/food/articles/veg_variety,Food,Fifty percent of the UK’s vegetable intake is made up of just four vegetables
14 splendid reads for a Platinum Jubilee summer,https://www.bbc.co.uk/programmes/articles/2N08ffhFKwYrgdQXZF9Xj6X/platinum-picks-14-splendid-reads-for-a-jubilee-summer,Arts,BBC Two's book club is back for another series of light-hearted literary banter
The hidden volcano beneath a city,/future/article/20220427-how-taiwan-discovered-an-active-volcano-on-its-doorstep,,
The forest tended by an elusive giant,/future/article/20220414-how-africas-forest-elephants-help-fight-climate-change,,
What would happen if we stopped mining?,/future/article/20220413-how-ending-mining-would-change-the-world,,
Actor Dennis Waterman dies aged 74,/news/entertainment-arts-61372712,Entertainment & Arts,"The British star was known for his roles in TV shows including Minder, New Tricks and The Sweeney."
Amazon targets review firms with legal action,/news/technology-61348521,Technology,
Travel limits on foreign music tours to be eased,/news/business-61346766,Business,
"Mine e-waste, not the Earth, say scientists",/news/science-environment-61350996,Science & Environment,
True Covid pandemic death toll is 15 million - WHO,/news/health-61327778,Health,
'Exceptionally dangerous' conditions for US wildfire,/news/world-latin-america-61367797,US & Canada,
Big Zuu cooks up Bafta TV Awards success,/news/entertainment-arts-61243580,Entertainment & Arts,
"Star Wars, a sandstorm and other images this week",/news/in-pictures-61348541,In Pictures,
Your pictures on the theme of 'under construction',/news/in-pictures-61322294,In Pictures,
In pictures: Dogs at polling stations,/news/in-pictures-61333251,In Pictures,
Africa's top shots: Beauty kings and fire eaters,/news/world-africa-61327201,Africa,
Lockdown reflections in photography awards,/news/in-pictures-61308032,In Pictures,
