title,href,tag,summary
"First phase of Ukraine war over, Russia says",/news/live/world-europe-60856533,Europe,"A senior military official has said Russia will focus on the complete ""liberation"" of Ukraine's eastern Donbas region."
Next stop Kyiv - the battle on the capital's outskirts,/news/world-europe-60874223,Europe,
Kim fronts Hollywood-style video to launch missile,/news/world-asia-60877578,Asia,
US lawmaker toppled by Nigerian billionaire cash,/news/world-us-canada-60876857,US & Canada,
West Indies edge into lead over England,/sport/cricket/60877712,Cricket,
Rowling hits back at Putin's 'cancel culture' comment,/news/world-europe-60878133,Europe,"Mr Putin referenced the Harry Potter author during a speech condemning ""cancel culture"" in the West."
Court hears of violent plot to abduct US governor,/news/world-us-canada-60876858,US & Canada,"A former co-conspirator said the accused plotters were seeking the ""ignition"" for a second civil war."
The ups and downs of teaching during Covid,/news/world-us-canada-60877832,US & Canada,"From remote learning to the end of masking, Arielle has taught students throughout the pandemic."
Saudi GP to go ahead despite nearby attack,/sport/formula1/60880598,Formula 1,The Saudi Arabian Grand Prix is expected to go ahead as planned after hours of meetings following a missile attack near the track in Jeddah.
Egypt edge African champions Senegal in Cairo,/sport/football/60881814,Sport Africa,A fourth-minute own goal is enough to give Egypt a 1-0 win over Senegal in Cairo in their World Cup play-off.
Giroud closes in on Henry's France record,/sport/football/60882155,Football,Olivier Giroud is just five goals away from surpassing Thierry Henry's all-time record for France after scoring in a friendly against the Ivory Coast.
Europe's fiercely vegan city,https://www.bbc.com/travel/article/20220320-tbingen-europes-fiercely-vegan-fairy-tale-city,Travel,Will this fairy-tale town of the future prevail?
What happened to the ozone hole?,https://www.bbc.com/future/article/20220321-what-happened-to-the-worlds-ozone-hole,Future,It used to be seen as one of the planet's most pressing environmental issues
The realities of the four-day week,https://www.bbc.com/worklife/article/20220322-the-realities-of-the-four-day-workweek,Worklife,The unexpected consequences of a shortened workweek
How one of the world's most expensive spices is harvested,/reel/video/p0bpz9c7/how-one-of-the-world-s-most-expensive-foods-is-harvested,,
"A Nordic tale of 'sex, death, revenge and power'",/reel/video/p0bx78hx/why-we-are-still-living-in-an-old-norse-saga,,
The deadly toxin found in the world's oldest mummies,/reel/video/p0br366s/life-beyond-death-in-the-driest-place-on-earth,,
Oscars 2022: Who will win?,https://www.bbc.com/culture/article/20220324-oscars-2022-who-will-win-and-who-should,Culture,Our critics give their Academy Award predictions – and pick their favourites
The alternatives to Russia's gas,https://www.bbc.com/future/article/20220324-how-biogas-can-help-europe-cut-russian-gas,Future,"Food waste, farm sludge and sewage could find new life as sources of fuel"
The mysterious people of the Caribbean,https://www.bbc.com/travel/article/20220322-the-mysterious-people-of-the-caribbean,Travel,It's been perplexing anthropologists for centuries
The relationship taboo that won't die,https://www.bbc.com/worklife/article/20220317-age-gaps-the-relationship-taboo-that-wont-die,Worklife,Why can't people accept that some couples simply aren't close in age?
News quiz: What did gamers do for Ukraine?,https://www.bbc.com/news/world-60856173,World,How closely have you been paying attention to what's been going on during the past seven days?
How popular are your food opinions?,https://www.bbc.co.uk/food/articles/love_hate_foods,Food,"Love them or loathe them, certain foods evoke such a strong response"
Recruitment software’s discrimination problem,https://www.bbc.co.uk/bbcthree/article/c62bcab6-db6f-4026-90bb-7f508705a65b,BBC Three,"""AI recruitment means I’ve got zero chance"""
The town that got up and left,/future/article/20220310-the-illinois-town-valmeyer-could-be-a-model-for-relocation,,
The homes powered by a kite,/future/article/20220309-the-kites-flying-to-harness-the-worlds-strongest-winds,,
Hong Kong's answer to landslides,/future/article/20220225-how-hong-kong-protects-people-from-its-deadly-landslides,,
Charli XCX scores her first number one album,/news/entertainment-arts-60879915,Entertainment & Arts,"The star's fifth studio album, Crash, was billed as an experiment in commercial pop. It worked."
Russia 'hacked Ukrainian satellite communications',/news/technology-60796079,Technology,
UK's rainfall records rescued by volunteer army,/news/science-environment-60860397,Science & Environment,
Stomach bug cases plummeted in UK's Covid lockdown,/news/health-60819716,Health,
Celebration as the Oscars ceremony returns to Hollywood,https://www.bbc.co.uk/news/business-60834516,Business,
Britain's loudest bird makes booming recovery,/news/science-environment-60863563,Science & Environment,
Rapper cleared of violent disorder incident,/news/uk-england-coventry-warwickshire-60881243,Coventry & Warwickshire,
US photographer Dirck Halstead dies at 85,/news/in-pictures-60878983,In Pictures,
"Africa's top shots: Quiffs, puppets and chapatis",/news/world-africa-60861605,Africa,
Laptop art: From Vans to Harry Styles,/news/in-pictures-60592677,In Pictures,
Aerial photos show 100 years of changing landscape,https://www.bbc.co.uk/news/articles/cv2l5x3n0mxo,News,
Africa's top shots: Easy riders and lollipop men,/news/world-africa-60777278,Africa,
