title,href,tag,summary
Trump sues justice department over Florida search,/news/world-us-canada-62640448,US & Canada,Donald Trump wants to temporarily stop the FBI from reviewing material seized from his home.
Ukraine: We were not behind Moscow car bomb killing,https://www.bbc.com/news/world-europe-62643274,Europe,
'Ten Hag's Man Utd era ignited on memorable night',https://www.bbc.com/sport/football/62641019,Football,
Where our urge to fix things comes from,https://www.bbc.com/culture/article/20220822-why-we-are-drawn-to-mending-things,Culture,
A Mesopotamian marvel that still stands,https://www.bbc.com/travel/article/20220822-the-ziggurat-of-ur-iraqs-answer-to-the-pyramids,Travel,
Independence Day attacks will get powerful response - Zelensky,/news/live/world-62643108,World,"Ukraine’s president has warned Russia could try ""something particularly ugly"" in the run-up to Wednesday's anniversary."
US school gunman's brain 'irretrievably broken',/news/world-us-canada-62640447,US & Canada,"The Parkland attacker was damaged ""through no fault of his own"", his lawyers argue."
The political brawl brewing over Miami’s airwaves,/news/world-us-canada-62585660,US & Canada,The sale of a popular conservative Spanish station comes as Republicans and Democrats vie for Latino votes.
Transfer window latest,/sport/live/football/62642756,Football,"All the latest transfer gossip with just 10 days remaining in the window, including the latest on Chelsea's pursuit of Anthony Gordon and Newcastle's hopes on Watford's Joao Pedro."
'We should have won' - but Liverpool 'million miles' off,/sport/football/62640368,Football,Liverpool's winless start to the season continued with a disappointing loss at Manchester United but is there a quick fix or are the results a real cause for concern?
Will Djokovic be able to play in the US Open?,/sport/tennis/62555146,Tennis,"Former world number one Novak Djokovic has his ""fingers crossed"" he is allowed to play in the US Open despite not being vaccinated against Covid-19."
The 'unethical' experiment that split up identical twins,/reel/video/p0cpzlg0/why-the-perfect-nature-vs-nurture-experiment-went-wrong,,
The 'monster' that terrified Georgian London,/reel/video/p0ctd635/the-monster-that-terrified-georgian-london,,
The Swedish tradition that can make you happier at work,/reel/video/p0bmzygz/the-swedish-tradition-that-can-make-you-happier-at-work,,
The dark side of being called pretty,https://www.bbc.com/future/article/20220819-the-best-way-to-teach-kids-body-confidence,Future,Our early years can define how we feel about our looks
Scandalous roots of the amusement park,https://www.bbc.com/culture/article/20220818-the-surprisingly-scandalous-origins-of-disneyland,Culture,The surprising evolution of the 17th-Century 'Pleasure Gardens'
"Europe's archipelago of 40,000 islands",https://www.bbc.com/travel/article/20220821-turku-finlands-new-nordic-food-hotspot,Travel,Its endless bounty has created a new Nordic culinary hotspot
The workers hit hardest by presenteeism,https://www.bbc.com/worklife/article/20220819-why-young-workers-miss-out-on-flexible-hours,Worklife,Some employees work flexibly while others are dragged down by rigid hours
Space telescope reveals 'incredible' Jupiter views,https://www.bbc.com/news/science-environment-62641866,Science & Environment,The James Webb Space Telescope shows the planet in unprecedented detail
Direct sales dream job felt like 'selling my soul',https://www.bbc.com/news/business-62466147,Business,A BBC investigation reveals tough working conditions and potential exploitation
What my grandparents' partition trauma taught me,https://www.bbc.com/news/world-asia-india-62571883,India,Grandchildren of partition survivors on what they learnt from hearing stories
The elephant buses safeguarding kids,/future/article/20220816-the-botswana-buses-tackling-human-elephant-conflict,,
The crab invading the Mediterranean,/future/article/20220809-how-the-mediterranean-became-the-worlds-most-invaded-sea,,
Scotland's most misunderstood landscape,/future/article/20220802-climate-change-the-promise-and-danger-of-scotlands-peat,,
"British Airways to cut 10,000 winter flights",/news/business-62637616,Business,The airline is cancelling flights from Heathrow 'to protect key holiday destinations over...
Nicki Minaj equals Lauryn Hill chart record,/news/entertainment-arts-62644326,Entertainment & Arts,
YouTube joins Facebook in banning Andrew Tate,/news/technology-62602913,Technology,
Monkeypox antiviral drug put to the test in trial,/news/health-62644509,Health,
Brain stimulation boosts memory for a month,/news/health-62606510,Health,
Nasa Moon mission Artemis gets go-ahead to launch,/news/science-environment-62640529,Science & Environment,
Singer John Farnham has cancer surgery,/news/entertainment-arts-62643803,Entertainment & Arts,
The pomp and celebrations as new Zulu king crowned,/news/world-africa-62623061,Africa,
First saved images from vast photo archive shared,/news/uk-england-merseyside-62591866,Liverpool,
Africa's top shots: Crowning queens and coming of age,/news/world-africa-62588364,Africa,
Shortlist for crime writer's photo prize announced,/news/uk-england-tyne-62552361,Tyne & Wear,
In pictures: Stunning Sturgeon Moon lights up skies,/news/in-pictures-62518102,In Pictures,
