title,href,tag,summary
"'My mother was missing, I got a picture of the body'",/news/world-asia-india-65795959,India,Frantic scenes unfolded after India's horrific train crash which has killed at least 288 people.
Utah schools ban Bible for 'vulgarity and violence',https://www.bbc.com/news/world-us-canada-65794363,US,
Parents clash in Pride protest at US primary school,https://www.bbc.com/news/world-us-canada-65688615,US,
Follow FA Cup final: Man City v Man Utd,https://www.bbc.com/sport/live/football/65468309,Football,
How old is too old to be a dad?,https://www.bbc.com/future/article/20230602-what-are-the-risks-of-being-an-older-father,Future,
Modi vows punishments over deadly India rail crash,/news/world-asia-india-65798640,India,At least 288 people were killed in the collision of two passenger trains and a goods train in Odisha.
Three Israeli soldiers killed near Egypt border,/news/world-middle-east-65798205,Middle East,"The incident came after a drug smuggling operation was thwarted at the border, the army says."
Mystery of spy deaths in Italian boat accident,/news/world-europe-65788462,Europe,Intelligence officers from Italy and Israel are among the four people who drowned on 28 May.
Scottish Cup final: Build-up as treble-chasing Celtic face Inverness CT,/sport/live/football/65747127,Football,"Follow TV, radio and live text coverage of the Scottish Cup final between Celtic and Inverness Caledonian Thistle."
England complete emphatic victory over Ireland - reaction & analysis,/sport/live/cricket/64958480,Cricket,Analysis and the best clips as England complete a 10-wicket victory over Ireland in the one-off Test at Lord's.
England break Ireland spirit to record big win,/sport/cricket/65768570,Cricket,England finally overcome a spirited fightback by Ireland to win the one-off Test at Lord's by 10 wickets.
Incredible drag queens from history,https://www.bbc.com/culture/article/20230131-historys-most-incredible-drag-queens-and-kings,Culture,The amazing stories of pioneering drag artists from centuries past
The students with retired housemates,https://www.bbc.com/future/article/20230525-how-to-make-multigenerational-living-a-success,Future,Can a campus experiment connect different generations?
Why 'back-up careers' are disappearing,https://www.bbc.com/worklife/article/20230525-why-the-back-up-career-is-moving-further-out-of-reach,Worklife,"Teaching, nursing, building – why plan B jobs aren't so secure anymore"
A rare insight into Hitler's private life,/reel/video/p0frs3m6/the-home-movies-showing-hitler-s-private-life,,
"Is this the Dutch secret to a healthier, happier life?",/reel/video/p0frgztf/world-bicycle-day-how-to-stay-healthy-like-the-dutch,,
How modern life is making men infertile,/reel/video/p09k7qw5/how-modern-life-is-making-men-infertile,,
The generation clocking the most hours,https://www.bbc.com/worklife/article/20230525-why-young-workers-are-putting-in-so-much-overtime,Worklife,Why fear and uncertainty is pushing Gen Zers to put in overtime hours
8 ways to make your clothes last longer,https://www.bbc.com/culture/article/20230601-eight-ways-to-make-your-clothes-last-longer,Culture,There's a lot to be learnt from history about making the most of our clothing
A most perilous fish stew,https://www.bbc.com/travel/article/20230602-bougna-fish-stew-with-sweet-potatoes,Travel,Spearfisherwoman Valentine Thomas dives deep for dinner
The first lab-grown burger: 10 years on,https://www.bbc.com/future/article/20230601-why-cultivated-meat-is-still-so-hard-to-find-in-restaurants,Future Planet,"Lab-grown meat is still only available in one restaurant, and only on Thursdays"
The birds ensnared by plastic,https://www.bbc.com/future/article/20230531-the-photo-that-changed-the-worlds-response-to-the-plastics-crisis,Future,The 'environmental tragedy' captured by a viral photo
British Vogue editor Edward Enninful steps down,https://www.bbc.com/news/entertainment-arts-65794311,Entertainment & Arts,"After six years as editor-in-chief, Edward Enninful will help lead Vogue brands in a global role"
Anger in Belgium over verdict in student's hazing death,https://www.bbc.com/news/world-europe-65767457,Europe,Sanda Dia died after being made to consume excessive amounts of fish oil and alcohol in 2018
Why we need more female electricians,/future/article/20230525-how-more-us-female-electricians-helps-climate-change,,
Where the sound of nature is too quiet,/future/article/20230519-the-sound-recordings-used-to-coax-back-species,,
Lebanon's unexpected solar boom,/future/article/20230517-how-solar-power-is-keeping-lebanons-lights-on,,
Esports helps F1 to find stars of the future,/news/newsbeat-65791039,Newsbeat,The virtual track is helping the world's biggest racing teams spot rising talent and win new fans.
Brics ministers call for rebalancing of global order,/news/world-africa-65784030,Africa,
Blood test for 50 cancers excites scientists,/news/health-65775159,Health,
Jojo Moyes: 'I've always been a woman's woman',/news/entertainment-arts-65794240,Entertainment & Arts,
Are tornadoes in the US getting worse?,/news/world-us-canada-65700588,US & Canada,
Beijing's comedy crackdown is hitting its music scene,/news/world-asia-china-65784761,China,
"Performance, protest and pigs: Photos of the week",/news/in-pictures-65789708,In Pictures,
Long lashes and fashion flair: Africa's top shots,/news/world-africa-65772200,Africa,
Windrush generations mark 75th anniversary,/news/in-pictures-65682878,In Pictures,
New Yorkers gather for Manhattanhenge,/news/world-us-canada-65761850,US & Canada,
Photographing history: The quarrymen of Wales,/news/uk-wales-65717619,Wales,
Photographer blends Africa with Welsh communities,/news/uk-wales-65709322,Wales,
